Title,Creator,Creation Time,Summary,Link,Abstract,Details
董廷瑶治咽喉麻痹案,biaoyin10,创建时间:10-23 14:32,摘要:许某，男，11岁。初诊（1974年6月29日），十日来不能咽食，仅饮流质，亦时见喷吐，西医诊断为第九、第十对脑神经麻痹。面色晦暗，声音嘶哑，喉中如梗，自感舌麻，脉细，舌红而黯，苔薄白。[阅读全文:],index.php?doc-view-7057,主题词： 	噎膈		医家：	董廷瑶		关键词：		流派：		医案患者信息		性别：	男		年龄段：	学龄期(7至13岁)		职业：		婚姻：		<li>籍贯：</li>		医案信息		就诊时间：	1974年06月28日		主要症状：	不能咽食		病因病机：	瘀结阻络		中医诊断：	噎膈		证型：	噎膈（痰瘀互结证）		西医诊断：	脑神经麻痹		治则：	活血通络		方剂：		医家信息		籍贯：		单位：		职称：		名中医：		所属学科：		代表作：		专业特长：,".ndGBfE { display:none; } 	
	许某，男，11岁	初诊（1974年6月29日）	十日来不能咽食，仅饮流质，亦时见喷吐，西医诊断为第九、第十对脑神经麻痹。面色晦暗，声音嘶哑，喉中如梗，自感舌麻，脉细，舌红而黯，苔薄白。其症为瘀结阻络，故拟活血化瘀。 	sstp上海科学技术出版社nihao	 	桃仁9克 土红花4.5克   当归6克 	sstp上海科学技术出版社nihao	 	赤芍6克 川芎3克   乳没各4．5克 	sstp上海科学技术出版社nihao	 	五灵脂9克 生蒲黄6克    桔梗3克 	sstp上海科学技术出版社nihao	 	枳壳4．5克 	sstp上海科学技术出版社nihao	 	七剂	二诊（7月5日）	诸症均减，稍能进食，发音略开，喉梗尚有。上法甚合，仍宗前方。	上方去灵脂、 蒲黄， 加赭石１２克，生草２．４克，六剂。	三诊（７月１２日）	已能咽食，音声亦出，喉梗欲咳，有痰不爽。此为络结初开，尚需宣瘀泄痰。 	sstp上海科学技术出版社nihao	 	桃仁９克土  红花４．５克  乳没各４．５克 	sstp上海科学技术出版社nihao	 	当归６克   桔梗３克    生甘草２．４克 	sstp上海科学技术出版社nihao	 	川贝４．５克 杏仁６克   竹茹６克 	sstp上海科学技术出版社nihao	 	六剂	四诊（７月１９日）	咽食如常，音声大亮，喉梗已无，吐痰爽利，惟面色萎黄，小溲频数，脉沉而细，舌苔薄润。病情向愈，正气略虚，上病及下。当需滋肾利尿为主。	菟丝子９克   覆盆子９  克花粉９克  	sstp上海科学技术出版社nihao	 	川贝４．５克   竹茹６克  杏仁６克 	sstp上海科学技术出版社nihao	 	盐水炒桑螵蛸９克 生草３克  远志６克	山萸肉６克七剂 	sstp上海科学技术出版社nihao	 	服后诸症皆安。	【按】本例之症殊为罕见。前贤曾有“噎枯在上，咽喉壅塞，饮虽可入，食不能下”的记述，并认为与气滞火炎、血阻痰凝等有关（见《证治汇补》）；王清任氏亦提出了“饮水即呛，乃会厌有血滞”的论点，制定了会厌逐瘀汤。本例的病机，以其不能咽食、咽中阻结、面色晦暗、喉梗舌麻，故从瘀滞论治，投以活血通络解结之法，即见好转。是本之于王氏所说，得到启发也。二诊后加入化痰开音之品，功效益彰，终于获得痊愈。 	sstp上海科学技术出版社nihao	 	 	sstp上海科学技术出版社nihao"
董廷瑶治增殖体肥大案,biaoyin10,创建时间:10-23 14:22,摘要:顾某，男，4岁。初诊（1993年11月21日），每于外感发热后，夜眠即感鼻塞气憋，吸气困难，发作时，张口吸气，咳逆喘促，不能平卧，须高枕斜倚，反复发病已有二年。[阅读全文:],index.php?doc-view-7055,主题词： 	喘病		医家：	董廷瑶		关键词：		流派：		医案患者信息		性别：	男		年龄段：	学龄前期(4至6岁)		职业：		婚姻：		<li>籍贯：</li>		医案信息		就诊时间：	1993年11月20日		主要症状：	鼻塞吸难，张口呼吸		病因病机：	冲气上逆，痰浊阻络		中医诊断：	喘病		证型：	冲气上逆		西医诊断：	增殖体肥大		治则：	镇冲降逆，泻肺涤痰		方剂：		医家信息		籍贯：		单位：		职称：		名中医：		所属学科：		代表作：		专业特长：,".sCwxOH { display:none; } 	
	顾某，男，4岁	初诊（1993年11月21日）	每于外感发热后，夜眠即感鼻塞气憋，吸气困难，发作时，张口吸气，咳逆喘促，不能平卧，须高枕斜倚，反复发病已有二年。屡屡急诊，某院诊为“增殖体肥大”，手术切除后，上症停发四月余。继因入托哭吵，引发气憋唇紫，急送市某院，诊断同前，全麻再行手术切除。本月12日感冒发热，应用抗生素静滴后，高热虽退，旧疾引发，气憋难忍，深吸喷气，高枕倚坐不得卧，痛苦不堪。审视患儿，面色苍白，形体瘦弱，鼻塞张口，呼吸短促，唇微紫绀，舌苔薄腻，二脉细弦小促。细察之下，此乃冲气上逆，气机失调，痰浊阻络，肺窍不利。亟须镇冲降逆，泻肺涤痰。 	sstp上海科学技术出版社nihao	 	沉香粉3克（后下） 代赭石20克（先入） 桑白皮9克  甜葶苈10克 	sstp上海科学技术出版社nihao	 	杏仁6克 川贝母3克  陈皮5克 紫菀6克 	sstp上海科学技术出版社nihao	 	川石斛9克 谷芽9克（炒） 	sstp上海科学技术出版社nihao	 	五剂	二诊	药后气促顿减，夜卧仍觉鼻塞气憋吸难，尚有呃气，寐则汗出，苔化薄润。思之，病已二年，中气虚耗，气机升降逆调，略辅补气之品以升清降逆。	沉香3克（后下） 赭石20克（先入）  苏梗6克 陈皮5克 	sstp上海科学技术出版社nihao	 	炙黄芪、太子参各6克 焦白术、茯苓各9克 防风5克炒 白芍6克 	sstp上海科学技术出版社nihao	 	炙甘草3克 	sstp上海科学技术出版社nihao	 	六剂	三诊	自施补气降逆以来，呼吸明显改善，夜能平卧，入睡尚有轻度鼾声，病虽向愈，但未断根，体质虚耗，再予：	炙黄芪9克 太子参9克 炙甘草3克  焦白术9克 	sstp上海科学技术出版社nihao	 	沉香3克（后下） 赭石２９克（先入） 炒白芍6克 天花粉9克 	sstp上海科学技术出版社nihao	 	调治半月，患儿呼吸恢复正常，虽有哭闹，也未引发气憋。今年又因他疾前来就诊，询之，其母云，一年来曾有数次外感发热，而气逆喘憋未作，全家甚慰。	【按】本病西医学称谓“增殖体肥大”，病发即见鼻塞吸难，张口呼吸，动则气促，睡有鼾声，患儿消瘦明显，精神委靡，贫血貌，西医谓“增殖体面容”，手术二次仍未根治。中医辨证，以其病发即气憋吸难不能卧，近似“喉风证”之喉部通气障碍，然喉风证来势迅猛，甚则窒息，危殆立至，故又称“走马风”、“缠喉风”。本案患儿虽见呼吸不利，气憋吸难，反复发作，然时发时止，病程二年余，显然异于“喉风证”。董师谓此不可受前医诊断增殖体框囿，单从局部着眼见症治症，难收成效。病系外感发热后气机逆乱，冲气上逆，挟痰迫肺，肺窍失宣而胸满气憋，此喘逆迫促所由来也。病理既明，应从整体出发，当效法仲景伤寒汗吐下后，心下痞硬，噫气不除，旋覆代赭汤之意。药选赭石，取其质重善以镇冲降逆；沉香，味辛体重，能升能降，气雄横行，有通天彻地之功，故《药品正义》谓其若怪异诸病，以此佐攻痰药，能降气安神。两味相合为君，益增其降逆平喘之力，再配以桑皮、葶苈、杏、贝，泻肺化痰。药下痰浊虽化，但喘逆噫气未平，细思患儿病久，中气必已虚损，冲气乘虚上干，填塞胸膺，排挤胸中大气，使之下陷而吸难，应从“虚”字着眼。忆张锡纯组参赭镇气汤，参赭同用治阴阳两虚之喘逆迫促，能纳气归原，亦治冲气上干，填塞胸臆之满闷，而仲景旋覆代赭本有人参，也因元气之虚也。故于次诊加入参、术、芪，以补下陷之元气，佐以沉、赭，调气升清以降逆，上宣肺窍，下平冲逆。病理药理契合，气机调畅，则喘促气憋终获痊愈。 	sstp上海科学技术出版社nihao	 	 	sstp上海科学技术出版社nihao"
董廷瑶治五软案2,biaoyin10,创建时间:10-23 15:35,摘要:张某，男，１８个月。初诊（１９８３年９月３日），生后不久即发惊肢搐，历经中西医药治疗，现惊搐已平，但头倾项软，仅可正坐，足不能立，手难紧握，口不能言，耳目尚明，夜眠欠安，汗多淋漓。[阅读全文:],index.php?doc-view-7071,主题词： 	五软		医家：	董廷瑶		关键词：		流派：		医案患者信息		性别：	男		年龄段：	幼儿期(1至3岁)		职业：		婚姻：		<li>籍贯：</li>		医案信息		就诊时间：	1983年09月02日		主要症状：	头倾项软，足不能立		病因病机：	五软肢痿，元气受伤		中医诊断：	五软		证型：	肾精亏虚证		西医诊断：	脑发育不良症		治则：	益气温阳，滋肾壮元		方剂：		医家信息		籍贯：		单位：		职称：		名中医：		所属学科：		代表作：		专业特长：,".bYlJWH { display:none; } 	
	张某，男，１８个月	初诊（１９８３年９月３日）	生后不久即发惊肢搐，历经中西医药治疗，现惊搐已平，但头倾项软，仅可正坐，足不能立，手难紧握，口不能言，耳目尚明，夜眠欠安，汗多淋漓。西医诊断脑发育不良症。二脉濡弱，舌淡苔少。证属五软肢痿，元气受伤。主以滋肾壮元。 	sstp上海科学技术出版社nihao	 	黄厚附片６ 克  熟地１５克   党参６克 	sstp上海科学技术出版社nihao	 	清炒黄芪９克  焦白术９克   炙甘草３克 	sstp上海科学技术出版社nihao	 	当归９克  赤芍６克  朱茯苓神各９克 	sstp上海科学技术出版社nihao	 	七剂连服二周	二诊（９月１７日）	颈项能竖，形神渐振，坐已稳，便调尿长，夜寐欠宁，四肢仍软，脉濡舌淡，前法续进。便下欠畅，言语不能，睡眠不安，舌净苔少，再以益肾开窍。 	sstp上海科学技术出版社nihao	 	熟地１２克    萸肉６克 钗石斛６克 	sstp上海科学技术出版社nihao	 	朱麦冬６克   干菖蒲４．５克 远志６克 	sstp上海科学技术出版社nihao	 	制首乌１５克   巴戟肉９克 肉桂１．５克（后入） 	sstp上海科学技术出版社nihao	 	竹节白附子４．５克 朱茯苓９克 	sstp上海科学技术出版社nihao	 	七剂后又连用一月	三诊（１１月１９日）	形神渐和，手足力软，纳食不多，便下通调，二脉尚弱，舌苔薄滑。犹需滋肾振痿。	熟地１２克 萸肉６克 麦冬９克 	sstp上海科学技术出版社nihao	 	五味子３克 干菖蒲４．５克 茯神９克 	sstp上海科学技术出版社nihao	 	太子参１０克  巴戟肉９克 酸枣仁１０克 	sstp上海科学技术出版社nihao	 	陈皮３克  炒谷芽９克 	sstp上海科学技术出版社nihao	 	十剂	此后腰腿见振，两足能立，左手有力，右手稍软，智力渐增，语言略开，但发音欠清。随访痿软已愈，但智能语言较差。	【按】五软五迟，素属难愈。本例病起于初生惊之后，其肾元受损、气阳亏虚，诚为无疑。初方投以益气温阳之剂，药下颈腰能挺。三诊时主用温肾开窍，前后三月，痿软明显好转，惟智力尚低耳 	sstp上海科学技术出版社nihao"
董廷瑶治下肢抽搐案,biaoyin10,创建时间:10-23 15:30,摘要:诸某，女，６岁。初诊（１９７２年３月１０日），患儿自出生后１８个月起，即发生两下肢抽搐，日发数次至十余次不等，发作后大汗一身而搐止。虽经多方治疗，迄今未已。来诊时见其面色一般。[阅读全文:],index.php?doc-view-7049,主题词： 	抽搐		医家：	董廷瑶		关键词：		流派：		医案患者信息		性别：	女		年龄段：	学龄前期(4至6岁)		职业：		婚姻：		<li>籍贯：</li>		医案信息		就诊时间：	1972年03月09日		主要症状：	下肢抽搐		病因病机：	痰热内扰、心胆不宁		中医诊断：	抽搐		证型：	痰热内扰证		西医诊断：		治则：	清热化痰，调和阴阳		方剂：	温胆汤		医家信息		籍贯：		单位：		职称：		名中医：		所属学科：		代表作：		专业特长：,".NRAqFX { display:none; } 	
	诸某，女，６岁	初诊（１９７２年３月１０日）	患儿自出生后１８个月起，即发生两下肢抽搐，日发数次至十余次不等，发作后大汗一身而搐止。虽经多方治疗，迄今未已。来诊时见其面色一般，形神尚活，胃纳欠佳，脉弦数，舌尖红苔白腻。初以为血分瘀热，筋失濡养，治以养血活血。 	sstp上海科学技术出版社nihao	 	生地３０克 当归６克  桃仁９克 	sstp上海科学技术出版社nihao	 	红花４.５克 地龙６克  川牛膝９克 	sstp上海科学技术出版社nihao	 	赤芍６克  秦艽６克 炙甘草２.４克 	sstp上海科学技术出版社nihao	 	四剂	二诊（３月１４日）	足筋仍搐，日发次频，神志清晰，询之则诉心慌胆怯，脉舌如前，再试以活血熄风宁神。	上方去膝、艽，加全蝎１.５克，远志４.５克，龙齿１５克，七剂。 	sstp上海科学技术出版社nihao	 	三诊（３月２１日）	抽搐次数虽见略减，但不明显。仍诉胆怯心慌，神志不安，然而静坐即搐，起动不发，脉舌同前。于是更法治之，拟从痰热内扰、心胆不宁着手。温胆汤加味主之。	陈皮４.５克 制半夏９ 克茯苓９克 	sstp上海科学技术出版社nihao	 	炙甘草２.４克  竹茹９克 枳实４.５克	菖蒲４.５克 当归６克  龙齿１５克七剂 	sstp上海科学技术出版社nihao	 	四诊（３月２８日）	药后三日，足搐即止。今晨又掣一次，但较轻松，胃纳已动，脉尚弦，舌苔薄腻，原方加远志４５克，七剂。	以后又续服十四剂以资巩固，足搐从此停发。	【按】温胆汤主治胆虚痰扰、惊悸不安之症。本例心慌胆怯、胃纳欠佳、脉弦数、舌尖红苔白腻，其主因是痰火内扰，故投以温胆汤药证恰当，三剂而效显，七剂而病安，续服之而根除。 	sstp上海科学技术出版社nihao	 	但痰热内扰为何下肢抽搐，投以温胆后为何迅即停发，是颇耐寻思的。试分析之。	何以胆病而足搐？似较罕见。考之《内经》，足少阳经筋布于外踝、胫膝外廉，结于伏兔之上及尻部；“其病小趾次趾支转筋，引膝外转筋，膝不可屈伸，筋急，前引髀，后引尻”（《灵枢·经筋》）。于此推想，胆病累及经筋而致下肢转筋、引急，是可能的；与本例颇相近似。 	sstp上海科学技术出版社nihao	 	何以静时搐发？张聿青有用温胆汤加减治疗一个“将寐之时，体辄跳动”的病例，其案语指出：“胃有湿痰，甲木不降，肝阳暗动……以阳入于阴而胆阳不降，致阳欲入而不能遽入也。”从中可以得到启发，即安静之时，气血内守，胆气当降；若痰湿阻遏肝胆之气，则阳升风动。本例静时搐作，殆即此理。 	sstp上海科学技术出版社nihao	 	何以汗后搐止？盖少阳为全身的半表半里；邪在少阳，则随枢机出入表里阴阳。若邪并于阴则阴实；邪并于阳则阳实；譬之疟邪，发时先寒后热、汗出而和，即是如此（参《素问·疟论》）。本例邪在少阳，气并于阴则胆逆风动而搐作，继之少阳枢机升极而降，则气并于阳而全身大汗后搐止。 	sstp上海科学技术出版社nihao	 	由此可见，痰热内扰是病之本，足筋抽搐是病之标；初二诊治标不治本，宜其罔效，三诊时治合病本，效如桴鼓。	关于温胆汤，为《内经》半夏汤的演变之方。经云：“泻其有余，调其虚实，以通其道，而去其邪。”（《灵枢·邪客》）后人总结为“使上下通则阴阳和”（《医方集解》）。温胆汤之诸药，在性能上可说是半夏汤的发展，也能使上下通、阴阳和。试看本例药后痰热清化，胆气降而筋得养，使少阳枢机出入表里而无杆格之虞，即是“上下通、阴阳和”的具体表现。 	sstp上海科学技术出版社nihao	 	 	sstp上海科学技术出版社nihao"
董廷瑶治痿证案4,biaoyin10,创建时间:10-23 15:19,摘要:宋某，男，８岁。初诊（１９８４年１月８日），自幼腰背软弱，步行易跌，下蹲后不能站立，无法登楼，且见握手不紧。检查大腿细瘦，小腿腓肠肌假性肥大，曾多处求治，被诊为进行性肌营养不良症。[阅读全文:],index.php?doc-view-7068,主题词： 	痿病		医家：	董廷瑶		关键词：		流派：		医案患者信息		性别：	男		年龄段：	学龄期(7至13岁)		职业：		婚姻：		<li>籍贯：</li>		医案信息		就诊时间：	1984年01月07日		主要症状：	腰背软弱，步行易跌		病因病机：	本元虚弱，筋肉失养		中医诊断：	痿病		证型：	痿病（肝肾两虚证）		西医诊断：	进行性肌营养不良症		治则：	温通养筋，扶元益肾		方剂：		医家信息		籍贯：		单位：		职称：		名中医：		所属学科：		代表作：		专业特长：,".wvSiJZ { display:none; } 	
	宋某，男，８岁	初诊（１９８４年１月８日）	自幼腰背软弱，步行易跌，下蹲后不能站立，无法登楼，且见握手不紧。检查大腿细瘦，小腿腓肠肌假性肥大，曾多处求治，被诊为进行性肌营养不良症。纳和眠安，二便尚调，二脉沉弱，舌淡苔薄。证属元虚，治从扶元强筋。 	sstp上海科学技术出版社nihao	 	川椒１．５克 淡附片４．５克  怀牛膝９克 	sstp上海科学技术出版社nihao	 	当归６克     鸡血藤１２克   伸筋草９克 	sstp上海科学技术出版社nihao	 	党参９克   黄芪９克   炒白术９克 	sstp上海科学技术出版社nihao	 	木瓜９克 	sstp上海科学技术出版社nihao	 	七剂，其后续服三周 	三诊（２月１５日）	手足稍觉有力，跨步渐稳、腰脊能直，舌苔薄润。治守前义，增以益肾。上方去木瓜，加杜仲９克，狗脊９克。如此连服二月。 	sstp上海科学技术出版社nihao	 	四诊（４月１８日）	走步稳健，亦可上楼，手握有力，腰脊屈伸轻利，蹲下之后，起立尚难。脉舌同前，原法不变。	党参９克  黄芪９克   杜仲９克 	sstp上海科学技术出版社nihao	 	狗脊９克  川椒１．５克 淡附片４．５克 	sstp上海科学技术出版社nihao	 	怀牛膝９克  当归６克鸡血藤１２克 	sstp上海科学技术出版社nihao	 	伸筋草９克 ，嘱以本方长服	【按】本例为严重痿证，且病史已久，殊难治疗，今以四诊辨证，注重肾元虚怯，故投温通养筋与扶元益肾并举之剂，三月后弋获初效。由此不难领会，川椒之辛温强筋，是堪瞩目。 	sstp上海科学技术出版社nihao	 	 	sstp上海科学技术出版社nihao"
董廷瑶治痿证案3,biaoyin10,创建时间:10-23 15:14,摘要:谭某，男，４岁。初诊（１９９１年１１月７日），患儿于六个月前发现双下肢小腿肌肉肥大坚实，腿距较宽，步行不稳，走路易跌，上楼不能屈腿，只得爬行而上，从卧、坐位站起困难。[阅读全文:],index.php?doc-view-7067,主题词： 	痿病		医家：	董廷瑶		关键词：		流派：		医案患者信息		性别：	男		年龄段：	学龄前期(4至6岁)		职业：		婚姻：		<li>籍贯：</li>		医案信息		就诊时间：	1991年11月06日		主要症状：	步行不稳，走路易跌		病因病机：	先天胎赋不足，气虚血凝		中医诊断：	痿病		证型：	痿病（肝肾两虚证）		西医诊断：	进行性肌营养不良症		治则：	益气通阳，活血行痹		方剂：	黄芪桂枝五物汤		医家信息		籍贯：		单位：		职称：		名中医：		所属学科：		代表作：		专业特长：,".zCaMkq { display:none; } 	
	谭某，男，４岁	初诊（１９９１年１１月７日）	患儿于六个月前发现双下肢小腿肌肉肥大坚实，腿距较宽，步行不稳，走路易跌，上楼不能屈腿，只得爬行而上，从卧、坐位站起困难。曾在某市级医院检查：肌张力正常，病理征未引出，化验尿素氮６．７８mmol／Ｌ，丙氨酸氨基转移酶３２．５U，天冬氨酸氨基转移酶１９．５U，肌酸磷酸激酶２５３．９U。尿常规（－）。肌电图示肢体有纤颤，正尖波，股内侧伸肌运动单位时限稍突（界限性），为肌原性损害。诊断为进行性肌营养不良症（假肥大型）。住院一月，应用肌营养药、复合维生素Ｂ、维生素Ｅ等，未获改善，遂来求治。询之患儿出生后有“立迟”、“行迟”病史，渐至步履不稳，上楼必须爬行，纳便尚调，视其舌淡苔薄而干，按之脉细小涩，两小腿粗大坚实，按之不痛。辨证为先天胎赋不足，气虚血凝，乃《金匮》之“血痹”是也。先拟黄芪桂枝五物汤加减，益气通阳，活血行痹。  	sstp上海科学技术出版社nihao	 	炙黄芪６克  桂枝３克 赤芍９克 	sstp上海科学技术出版社nihao	 	当归９克  川牛膝９克  炙甘草３克 	sstp上海科学技术出版社nihao	 	薏苡仁１２克  桃仁９ 克 宣木瓜６克 	sstp上海科学技术出版社nihao	 	随症酌情加入鸡血藤 １５克，忍冬藤１５克。	二诊（１２月５日）	服药一月，左腿腓肠肌已转软，步行较前为稳，惟面少华，神委倦怠，肢软无力，舌质淡红，苔薄转润，尚觉口干。乃阳气得行，血运已通，然气血本亏，筋失濡养，再拟气血双调，通络行痹。 	sstp上海科学技术出版社nihao	 	炙黄芪１０克 党参６克  赤白芍（各）６克 	sstp上海科学技术出版社nihao	 	当归９克生地１５克 乌梅６克 	sstp上海科学技术出版社nihao	 	怀牛膝９克桑枝１０克 宣木瓜６克 	sstp上海科学技术出版社nihao	 	鸡血藤１０克	三诊（１９９２年２月２７日）	调治三月余，小腿肌肉假性肥大渐消，已趋正常，行走平稳，复查肌酸磷酸激酶５５．２U，丙氨酸氨基转移酶４．８U。患儿舌红苔净，二脉沉细濡软。药已奏效，痹虽宣启而气血仍虚，肝血不充而筋脉失养，再予益气养血，润肝濡筋为治。 	sstp上海科学技术出版社nihao	 	炙黄芪６克   党参９克   当归６克 	sstp上海科学技术出版社nihao	 	天冬９克 麦冬９克   黄精９克 	sstp上海科学技术出版社nihao	 	花粉９克  忍冬藤１５克  鸡血藤１５克 	sstp上海科学技术出版社nihao	 	服上方半月，步行如常，已能直立提腿登楼。再拟原法巩固之。	【按】进行性肌营养不良是一种遗传性家族性疾病，是儿科少见的顽重病症，先见肌肉假性肥大，活动受限，继之发展为进行性肌萎缩，能存活至青春期以后者不多。中医一般归属痿证，多从补益肝肾，健筋壮骨治疗。本例属假性肥大型，患儿小腿坚粗，步行易跌，肢体麻木不仁，舌淡少苔，脉细小涩；又兼生后即有“五迟”之象，符合《金匮》“血痹阴阳俱微……外证身体不仁，如风痹状”之证。诚如《诸病源候论》所云：“血痹者，由体虚……邪入于血而痹。”是为正虚阳气不足，致使风气得以直入血中，阴血凝涩，血运不畅遂成痹。宣可决壅，通可行滞，而阴阳形气俱不足，当调之以甘药，选黄芪桂枝五物汤出入。黄芪益气，桂枝通阳；芍药入营，合当归、桃仁活血养血；佐牛膝、苡仁、木瓜平肝通络缓其转筋拘挛，共奏益气通阳，理血宣痹，兼调营卫之功。服药一月，阳通痹宣，血中之邪随阳气通达而出，遂使下肢转软，步履趋稳。邪去正虚，二诊顾其里虚，去桂枝之宣通，增参、地培补气血，配桑枝、鸡血藤通络柔筋。调治三月，不但肢体转和，复查血清酶均降至正常。三诊善后，重在扶益肝肾，酌加二冬、黄精滋阴柔筋。董师疗疾素重求因，精于辨证，条分缕析，按八纲，分气血，初起里虚邪入，先予通阳益气，活血宣痹祛邪为急；终以益气养血，培补肝肾，补虚图本。常谓不可拘于现代病名，见症治症，执一方治一方，则易入歧途而罔效，须识病而明理，细辨而应变，祛邪而扶正，终获步行如常，顽证得瘥。 	sstp上海科学技术出版社nihao	 	 	sstp上海科学技术出版社nihao"
