Title,Creator,Creation Time,Summary,Link,Abstract,Details
董廷瑶治膀胱结石,biaoyin10,创建时间:10-21 16:07,摘要:罗某，男，5岁。初诊(1974年2月15日)，小溲时有闭塞不通，西医诊断为膀胱结石。常有发热，纳食尚好，尿黄便干，性急易吵，脉沉，舌苔薄腻。证属湿热熬石，气阻尿闭。拟清利湿热，行气排石。[阅读全文:],index.php?doc-view-6694,主题词： 	石淋		医家：	董廷瑶		关键词：		流派：		医案患者信息		性别：	男		年龄段：	学龄前期(4至6岁)		职业：		婚姻：		<li>籍贯：</li>		医案信息		就诊时间：	1974年02月14日		主要症状：	小溲时有闭塞不通		病因病机：	湿热阻结，下注膀胱		中医诊断：	石淋		证型：	石淋（下焦湿热证）		西医诊断：	膀胱结石		治则：	清利湿热		方剂：	排石汤		医家信息		籍贯：		单位：		职称：		名中医：		所属学科：		代表作：		专业特长：,".BsIyov { display:none; } 	
	罗某，男，5岁	初诊(1974年2月15日)	小溲时有闭塞不通，西医诊断为膀胱结石。常有发热，纳食尚好，尿黄便干，性急易吵，脉沉，舌苔薄腻。证属湿热熬石，气阻尿闭。拟清利湿热，行气排石。处以排石汤方： 	sstp上海科学技术出版社nihao	 	条芩6克 木香3克 生枳壳3克	生川军9克  金钱草30克 生甘草9克 	sstp上海科学技术出版社nihao	 	柴胡4.5克  	sstp上海科学技术出版社nihao	 	三剂 	sstp上海科学技术出版社nihao	 	二诊(2月18日)	症情如前，结石未出，仍宗原法。	上方加车前草30克，四剂。	药后曾排出花生大小结石一颗，尿闭乃解，其病遂愈。	【按】泌尿道的结石，为中医石淋一类；其常用法有清利湿热、活血祛瘀、扶正补肾等。尤以清利湿热为要。本证为湿热阻结，肝火脾湿下注膀胱，熬炼成石，闭塞尿窍，故宜排石汤方、利湿下石，七剂而石出病除矣。 	sstp上海科学技术出版社nihao	 	 	sstp上海科学技术出版社nihao"
董廷瑶治疗心悸1,biaoyin10,创建时间:10-21 18:42,"摘要:张某,女,１２岁。初诊（１９８１年８月２５日），患儿心悸阵发，每周发作三四次，病已逾年。西医诊断为心动过速症。悸时脉搏间歇（早搏），面唇晦滞，精神消沉，便下干结，胃纳不香，舌尖红，苔薄腻，脉细涩。[阅读全文:]",index.php?doc-view-6774,主题词： 	心悸[病]		医家：	董廷瑶		关键词：		流派：		医案患者信息		性别：	女		年龄段：	学龄期(7至13岁)		职业：		婚姻：		<li>籍贯：</li>		医案信息		就诊时间：	1981年08月24日		主要症状：	心悸		病因病机：	瘀血阻络，郁火扰心		中医诊断：	心悸[病]		证型：	心悸（血脉瘀阻证）		西医诊断：	心律失常		治则：	清热泻火，活血化瘀		方剂：		医家信息		籍贯：		单位：		职称：		名中医：		所属学科：		代表作：		专业特长：,".DVytQl { display:none; } 	
	张某，女，１２岁	初诊（１９８１年８月２５日）	患儿心悸阵发，每周发作三四次，病已逾年。西医诊断为心动过速症。悸时脉搏间歇（早搏），面唇晦滞，精神消沉，便下干结，胃纳不香，舌尖红，苔薄腻，脉细涩。郁火挟瘀，拟化瘀熄火。 	sstp上海科学技术出版社nihao	 	当归６克 赤芍６克  桃仁泥９克 	sstp上海科学技术出版社nihao	 	红花４.５ 克 丹参９克  川连１.５克	火麻仁１５克 炙甘草３克 朱茯苓９克 	sstp上海科学技术出版社nihao	 	桂枝３克 	sstp上海科学技术出版社nihao	 	六剂	二诊（９月１日）	自感悸动仍有，但发作时间已短。便下稍润，脘中不舒，舌红苔薄润，脉细而匀。上法尚合，仍步前意。原方去炙草，加生地１２克，七剂。后又连服七剂。	三诊（９月２５日） 	sstp上海科学技术出版社nihao	 	上药服后，心悸发作大减，近日偶有一次心悸，精神渐振，面唇色润，大便通调，纳食亦可。舌苔薄，脉匀细。原法巩固之。	当归９克 赤白芍各６克 丹参９克 	sstp上海科学技术出版社nihao	 	生地１２克 炙甘草３克  桂枝２克	大麻仁１２克 茯苓９克川  石斛９克 	sstp上海科学技术出版社nihao	 	麦冬９克 	sstp上海科学技术出版社nihao	 	七剂	药后病情稳定，心悸未再发作。	【按】本例患儿之心悸，从四诊合参，诊断为瘀血阻络，郁火扰心所成。故初方以桃红归芍活血行瘀，川连、丹参清心凉血，而以桂枝为佐，通阳复脉。茯苓宁心安神，麻仁通结利便。药后症见减轻，故予原法，加生地滋养心血；惟因脘有不适，去甘草，恐其甘缓碍中。三诊时瘀阻已通，郁火亦除，即去桃红、川连，加地芍冬斛，是一变行瘀清火而为和阴养心之炙甘草汤加减，以作根治。 	sstp上海科学技术出版社nihao	 	 	sstp上海科学技术出版社nihao"
董廷瑶治心悸2,biaoyin10,创建时间:10-22 15:05,摘要:张某，男，９岁。初诊（１９８１年１０月２０日），今年春起，患儿时发感冒，热度升降不止，至８月确诊为病毒性心肌炎。现热度已净，但时感心悸，夜间平卧则气短喘促，睡眠不安，梦中惊叫，面色不华。[阅读全文:],index.php?doc-view-6915,主题词： 	心悸[病]		医家：	董廷瑶		关键词：		流派：		医案患者信息		性别：	男		年龄段：	学龄期(7至13岁)		职业：		婚姻：		<li>籍贯：</li>		医案信息		就诊时间：	1981年10月19日		主要症状：	心悸		病因病机：	营卫虚弱，心阳受伤		中医诊断：	心悸[病]		证型：	心悸（心阳不振证）		西医诊断：	病毒性心肌炎		治则：	调和阴阳，摄阳入阴		方剂：	桂枝龙骨牡蛎汤		医家信息		籍贯：		单位：		职称：		名中医：		所属学科：		代表作：		专业特长：,".PMHMME { display:none; } 	
	张某，男，９岁	初诊（１９８１年１０月２０日）	今年春起，患儿时发感冒，热度升降不止，至８月确诊为病毒性心肌炎。现热度已净，但时感心悸，夜间平卧则气短喘促，睡眠不安，梦中惊叫，面色不华，易汗淋多，纳食尚可，二便如常。脉软而数，时有间歇（早搏）。舌尖红，苔薄腻。是为营卫虚弱，心阳受伤，而神浮气逆。桂枝加龙牡汤主之。 	sstp上海科学技术出版社nihao	 	桂枝３克 白芍６克  龙骨齿各１２克（先入） 牡蛎２０克（先入） 	sstp上海科学技术出版社nihao	 	生姜３片 红枣５枚 炙甘草３克   远志６克 	sstp上海科学技术出版社nihao	 	六剂	二诊时又连服七剂	三诊（１１月３日）	心悸大减，夜喘亦平，汗出已少，睡眠较安，面色滋润，胃纳较增。脉数而细，偶见间歇，原法增损。上方去龙齿，加党参１０克，麦冬９克，当归６克，七剂，后又连服三周。 	sstp上海科学技术出版社nihao	 	七诊（１２月１日）	诸症均和，悸平不喘，舌润脉匀。予桂枝汤加党参、麦冬、茯神木、丹参，常服以作巩固。	【按】仲景以桂枝龙骨牡蛎汤主虚劳失精，其要旨在于调和阴阳，摄阳入阴。然据仲景之制方法度，以桂枝甘草汤、桂甘龙牡汤主治心悸汗多、烦扰难寐诸症，本方增芍枣，则尤可滋阴和营，乃知本方能主营虚心悸。本例起于感邪久热汗泄，耗伤营阴，心阳亦弱，神气浮越，故心悸脉结、梦惊夜喘，乃宜于桂枝加龙牡汤，一以扶助心阳，温通复脉，一以滋营宁神，摄纳气逆。在本方的基础上，先后加入龙齿、远志、茯神木，及党参、麦冬、当归、丹参，均为增强宁心安神、益气养血之力，终使其病迅即见功。 	sstp上海科学技术出版社nihao	 	 	sstp上海科学技术出版社nihao"
董廷瑶治慢性肾炎2,biaoyin10,创建时间:10-20 15:29,摘要:孙某，男，7岁。初诊(1965年3月22日)，全身浮肿已一月半，面部两足尤甚；腹满积水，小溲短少，大便不实，面色灰黯，脉沉而细，舌淡苔白腻。西医诊断慢性肾炎。显系脾肾阳微，水湿泛滥。[阅读全文:],index.php?doc-view-6554,主题词： 	阴水		医家：	董廷瑶		关键词：		流派：		医案患者信息		性别：	男		年龄段：	学龄期(7至13岁)		职业：		婚姻：		<li>籍贯：</li>		医案信息		就诊时间：	1965年03月21日		主要症状：	水肿		病因病机：	脾肾阳微，水湿泛滥		中医诊断：	阴水		证型：	阴水（阳虚水泛证）		西医诊断：		治则：	温阳利水		方剂：		医家信息		籍贯：		单位：		职称：		名中医：		所属学科：		代表作：		专业特长：,".adxrUs { display:none; } 	
	孙某，男，7岁	初诊(1965年3月22日)	全身浮肿已一月半，面部两足尤甚；腹满积水，小溲短少，大便不实，面色灰黯，脉沉而细，舌淡苔白腻。西医诊断慢性肾炎。显系脾肾阳微，水湿泛滥。治拟温化利水之法。 	sstp上海科学技术出版社nihao	 	上肉桂3克 淡附片4.5克 怀牛膝9克	大腹皮9克 车前子9克(包） 茯苓皮12克 	sstp上海科学技术出版社nihao	 	陈皮3克 姜衣2.4克 白术皮9克	泽泻9克汉 防己9克  陈葫芦15克 	sstp上海科学技术出版社nihao	 	二剂 	sstp上海科学技术出版社nihao	 	二诊(3月24日)	小溲较通，面部浮肿已减，腹水仍满，舌淡苔白。上方初效，宜按原法。	上方去腹皮、防己，附片加至6克，陈葫芦加至30克，加姜半夏9克，三剂。	三诊(3月27日)	浮肿已退，胃纳尚和，但小溲短少，腹水未消，面色苍黄，脉沉舌淡，正虚邪恋，姑拟攻补兼施之法。 	sstp上海科学技术出版社nihao	 	上肉桂3克 淡附片6克 生黄芪9克	党参6克 生白术9克 陈葫芦30克 	sstp上海科学技术出版社nihao	 	商陆根9 克大腹皮9克 陈皮3克	姜衣2.4克 另卢氏丸一料分四次服， 	sstp上海科学技术出版社nihao	 	日一次三剂	(卢氏丸方：黑白丑各63克，红糖120克，老姜500克，红枣60克，为丸)	服后上方又续一次，腹水全消，腹围73cm减至59cm，胃和便调，面色转润。乃去卢氏丸，以党、芪、术、苓、附、牛膝、巴戟等温肾健脾调补之剂，基本痊愈出院。 	sstp上海科学技术出版社nihao	 	【按】本例为脾肾两虚而水湿壅盛。初起即用温肾利水之方，浮肿虽退而腹水不去。三诊时考虑到正虚邪恋，遂攻补兼施。一方面附桂参芪以扶脾肾，另方面增商陆根、卢氏丸攻逐水邪。一周内使腹水全消，其功显著。再以温肾益脾诸品培补之，使杜其水病之根。 	sstp上海科学技术出版社nihao	 	 	sstp上海科学技术出版社nihao"
董廷瑶治肾病综合症1,biaoyin10,创建时间:10-20 15:36,摘要:魏某，男，2岁，住院号：161169。初诊(1980年5月13日)，患儿于今年3月因眼睑浮肿而初次住院，此时尿蛋白(+++)，血胆固醇9.828mmol／L，拟诊为肾病综合征。[阅读全文:],index.php?doc-view-6556,主题词： 	阴水		医家：	董廷瑶		关键词：		流派：		医案患者信息		性别：	男		年龄段：	幼儿期(1至3岁)		职业：		婚姻：		<li>籍贯：</li>		医案信息		就诊时间：	1980年05月12日		主要症状：	眼睑浮肿		病因病机：	肾阳虚弱，气化失司		中医诊断：	阴水		证型：	阴水（阳虚水泛证）		西医诊断：	肾病综合征		治则：	温阳扶肾		方剂：	济生肾气丸		医家信息		籍贯：		单位：		职称：		名中医：		所属学科：		代表作：		专业特长：,".eIyZep { display:none; } 	
	魏某，男，2岁，住院号：161169	初诊(1980年5月13日)	患儿于今年3月因眼睑浮肿而初次住院，此时尿蛋白(+++)，血胆固醇9.828mmol／L，拟诊为肾病综合征。	经西药治疗后好转出院。后又出现尿蛋白(+++)，予泼尼松后尿量明显减少，小便日一二次，发热咳嗽，于5月１1日再次入院。拟诊同上，给地塞米松、环磷酰胺、克霉唑等，并请中医会诊。 	sstp上海科学技术出版社nihao	 	现小便量少，眼睑浮肿，胃纳不佳，大便尚通，神色委靡，二脉沉弱，舌淡红，苔心薄腻。其见症为肾阳虚弱，气化失司。治以温阳扶肾，取济生肾气法。	熟地9克 淮山药9克  山萸肉4.5克 	sstp上海科学技术出版社nihao	 	茯苓9克 淡附片2.4克 丹皮6克	泽泻9克 肉桂1.5克(后入) 怀牛膝9克 	sstp上海科学技术出版社nihao	 	车前子9克(包) 	sstp上海科学技术出版社nihao	 	七剂	后又连续服十四剂。	二诊(6月3日)	病情尚不稳定，尿检时轻时重，睑肿已消，小溲频数，纳差汗多，舌苔白腻。久病肾虚，当宜温固，兼扶脾土。	仙灵脾9克 山萸肉6克 肉桂1.5克(后入) 	sstp上海科学技术出版社nihao	 	茯苓9克生 白术9克 陈皮6克	覆盆子9克 菟丝子9克 清甘草3克 	sstp上海科学技术出版社nihao	 	车前子9克(包) 	sstp上海科学技术出版社nihao	 	七剂	三诊(6月10日)	近日尿检蛋白(－)，白细胞少量。尿频已和，小溲转长，胃纳量少，大便尚调，神色稍振，舌淡苔心薄腻。脾肾不足，兹宜兼顾。	太子参9克 焦白术9克  茯苓9克 	sstp上海科学技术出版社nihao	 	清甘草3克 苡仁12克  菟丝子9克	萸肉6克 淮山药9克  仙灵脾9克 	sstp上海科学技术出版社nihao	 	陈皮3克 	sstp上海科学技术出版社nihao	 	七剂	四诊(6月17日)	尿检已基本正常，现病情稳定。小溲通长，大便如常，胃纳一般，舌心苔腻。肾气初复，而脾运尚弱，故以健脾为主而兼温肾。	赤苓12克  川朴2克 苡仁12克 	sstp上海科学技术出版社nihao	 	生白术9克  陈皮6克 谷芽9克 	sstp上海科学技术出版社nihao	 	淮山药9克  山萸肉6克 仙灵脾9克 	sstp上海科学技术出版社nihao	 	菟丝子9克 	sstp上海科学技术出版社nihao	 	七剂	服后尿检正常且稳定，舌苔转薄，惟纳食尚不甚香，续予调理脾胃后基本痊愈而出院。	【按】肾病综合征治多棘手，以其往往为本元虚怯，脾肾二亏之故也。本例初呈一派肾阳微弱之象，主以济生肾气之汤剂法。药后浮肿消退，尿检好转；但出现尿频纳差，遂改用脾肾兼顾之方，病情逐步稳定。后因仍见脾运不健，再以培补健运而终获痊可。但本病必在中西医结合中配合治疗，其疗效还是比较满意的。 	sstp上海科学技术出版社nihao"
曹颖甫治麻疹医案,liuxp,创建时间:08-22 08:50,摘要:李孩，疹发未畅，下利而臭，日行二十余次，舌质绛，而苔白腐，唇干，目赤，脉数，寐不安，宜葛根芩连汤加味。[阅读全文:],index.php?doc-view-1462,,
曹颖甫治麻疹医案2,liuxp,创建时间:08-22 09:21,摘要:镇江赵锡庠，章次公门人也，诊所在曹家渡，尝治康脑脱路忻康里四十八号蔡姓女孩，约一周岁，先病百日咳[阅读全文:],index.php?doc-view-1463,,
曹颖甫治风疹医案,liuxp,创建时间:08-21 14:25,摘要:王小，发热有涕，发风疹，此为风邪，当疏泄太阳。[阅读全文:],index.php?doc-view-1419,,
董廷瑶治胎黄2,biaoyin10,创建时间:10-19 17:14,摘要:杜某，女，2个月。初诊(1972年12月22日)，胎黄二旬，面目黄染不显，但粪如陶土，小溲黄赤，腹满肝脾肿大，舌红，根部苔腻，脉弦。是为胎湿阻滞，治以渗利湿热。[阅读全文:],index.php?doc-view-6458,主题词： 	胎黄		医家：	董廷瑶		关键词：		流派：		医案患者信息		性别：	女		年龄段：	0至1岁		职业：		婚姻：		<li>籍贯：</li>		医案信息		就诊时间：	1972年12月21日		主要症状：	黄疸		病因病机：	胎湿阻滞，郁而发黄		中医诊断：	胎黄		证型：	胎黄(湿热郁蒸证）		西医诊断：		治则：	渗利湿热，疏肝健脾		方剂：	茵陈五苓散		医家信息		籍贯：		单位：		职称：		名中医：		所属学科：		代表作：		专业特长：,".hmtOxj { display:none; } 	
	杜某，女，2个月	初诊(1972年12月22日)	胎黄二旬，面目黄染不显，但粪如陶土，小溲黄赤，腹满肝脾肿大，舌红，根部苔腻，脉弦。是为胎湿阻滞，治以渗利湿热。 	sstp上海科学技术出版社nihao	 	川朴1.8克 茵陈12克 赤苓9克	连翘9克 条芩6克 广木香1.8克 	sstp上海科学技术出版社nihao	 	青皮4.5克 陈皮3克 生甘草1.8克	川楝子6克 	sstp上海科学技术出版社nihao	 	三剂	二诊(12月25日)	便下溏黄，小溲清淡，舌根苔薄，腹部转软，黄疸渐退。是湿热通利，病情好转，续进原法加减。	茵陈9克 焦白术9克 广木香1.8克 	sstp上海科学技术出版社nihao	 	赤苓9克 条芩4.5克 生扁豆6克	青皮4.5克 陈皮3克 川楝子6克 	sstp上海科学技术出版社nihao	 	赤芍4.5克 	sstp上海科学技术出版社nihao	 	四剂	三诊(12月29日)	黄疸完全退清，肝脾亦见缩小，大便通黄，小溲清长，乳食亦和，惟稍有痰咳，再进调理。	陈皮3克 姜半夏6克 茯苓9克 	sstp上海科学技术出版社nihao	 	生甘草2.4克 焦白术6克 茵陈9克	广木香2.4克 赤苓3克 炒麦芽9克 	sstp上海科学技术出版社nihao	 	五剂服后而愈	 	sstp上海科学技术出版社nihao"
董廷瑶治胎黄4,biaoyin10,创建时间:10-19 17:26,摘要:邬某，男，3个月。初诊(1973年10月17日)，出生后即现黄疸，肤目黯黄，粪如陶土，小溲黄赤，不欲吮乳，舌淡苔腻，肝脏肿大。送经某医院治疗，诊断为阻塞性黄疸，其证为寒湿阴黄，治宜温中为主。[阅读全文:],index.php?doc-view-6461,主题词： 	胎黄		医家：	董廷瑶		关键词：		流派：		医案患者信息		性别：	男		年龄段：	0至1岁		职业：		婚姻：		<li>籍贯：</li>		医案信息		就诊时间：	1973年10月16日		主要症状：	黄疸		病因病机：	寒湿阻滞，郁而发黄		中医诊断：	胎黄		证型：	胎黄(寒湿凝滞证）		西医诊断：	黄疸		治则：	温中散寒，渗湿退黄		方剂：		医家信息		籍贯：		单位：		职称：		名中医：		所属学科：		代表作：		专业特长：,".CDgBgr { display:none; } 	
	邬某，男，3个月	初诊(1973年10月17日)	出生后即现黄疸，肤目黯黄，粪如陶土，小溲黄赤，不欲吮乳，舌淡苔腻，肝脏肿大。送经某医院治疗，诊断为阻塞性黄疸，其证为寒湿阴黄，治宜温中为主。 	sstp上海科学技术出版社nihao	 	茵陈9克 炒白术6克 淡干姜1.5克	茯苓6克 生甘草1.5克 广木香1.8克 	sstp上海科学技术出版社nihao	 	当归3克  炒麦芽6克 	sstp上海科学技术出版社nihao	 	五剂	二诊(10月22日)	黄疸稍退，黄色转润，腹虽软而肝仍肿，粪色尚白，小溲淡黄，舌淡苔腻，胃纳不佳。寒湿阻滞，再以温通。	当归尾3克  赤芍1.5克 茵陈9克 	sstp上海科学技术出版社nihao	 	淡干姜1.5克  茯苓6克 焦白术6克	生甘草1.5克 陈皮3克 青皮4.5克 	sstp上海科学技术出版社nihao	 	淡附片1.8克 	sstp上海科学技术出版社nihao	 	四剂	三诊(10月26日)	肤黄已退，目黄亦淡，面色转润，肝小腹软，惟粪色仍白，小溲淡黄，胃气已动。方既合辙，再宗原法。	上方去陈青皮，加炒谷芽9克，四剂。	四诊(10月30日) 	sstp上海科学技术出版社nihao	 	胃纳如常，黄疸基本消退，便色转黄，日二三次，小溲淡黄，其舌质尚淡。病后脾阳未复，兹拟温扶。	党参3克 焦 白术4.5克 干姜1.5克 	sstp上海科学技术出版社nihao	 	清甘草1.5克 茯苓6克 淡附片1.8克 	sstp上海科学技术出版社nihao	 	陈皮3克 淮山药6克 	sstp上海科学技术出版社nihao	 	五剂服后痊愈 	sstp上海科学技术出版社nihao"
董廷瑶治胎黄5,biaoyin10,创建时间:10-19 17:31,摘要:陆某，男，2个月。初诊(1974年3月5日)，胎黄，目黄肤黄，其色不泽，肝脾肿大，腹满吐乳，舌淡苔润，二脉濡弱，小溲深黄，粪如陶土。西医诊断为阻塞性黄疸。证属寒湿久滞，病势非轻，治拟温通化湿。[阅读全文:],index.php?doc-view-6463,主题词： 	胎黄		医家：	董廷瑶		关键词：		流派：		医案患者信息		性别：	男		年龄段：	0至1岁		职业：		婚姻：		<li>籍贯：</li>		医案信息		就诊时间：	1974年03月04日		主要症状：	黄疸		病因病机：	寒湿久滞，郁而发黄		中医诊断：	胎黄		证型：	胎黄(寒湿凝滞证）		西医诊断：	黄疸		治则：	温通化湿，调补脾胃		方剂：	参苓白术散		医家信息		籍贯：		单位：		职称：		名中医：		所属学科：		代表作：		专业特长：,".izAhQb { display:none; } 	
	陆某，男，2个月	初诊(1974年3月5日)	胎黄，目黄肤黄，其色不泽，肝脾肿大，腹满吐乳，舌淡苔润，二脉濡弱，小溲深黄，粪如陶土。西医诊断为阻塞性黄疸。证属寒湿久滞，病势非轻，治拟温通化湿。 	sstp上海科学技术出版社nihao	 	茵陈9克 当归3克 赤芍3克	淡干姜1.5克姜半夏6克 赤苓9克 	sstp上海科学技术出版社nihao	 	青皮3克 广木香１．８克 生甘草1.8克 	sstp上海科学技术出版社nihao	 	三剂	二诊(3月8日)	药后肤目黄减，能食不吐，腹部胀满，小溲仍黄，便泄色淡。阴寒湿滞于中，再以上法加减。	陈皮3克 焦白术6克  茯苓6克 	sstp上海科学技术出版社nihao	 	清甘草1克 淡干姜1.5克  煨木香1.8克	茵陈6 克 淡附片1.5克 青皮3克 	sstp上海科学技术出版社nihao	 	川楝子6克 	sstp上海科学技术出版社nihao	 	三剂	三诊(3月11日)	寒得温而散，湿得温而化，故黄疸渐淡，胃和能食，粪色转黄，但泄不化，腹满而软，尿赤而长，舌质淡白。仍属脾运不健，温阳和中主之。	陈皮3克 焦白术6克  茯苓6克 	sstp上海科学技术出版社nihao	 	生甘草1克 炮姜1.5克 煨木香1.8克 	sstp上海科学技术出版社nihao	 	茵陈9 克 熟苡仁9克 淡附片1.5克 	sstp上海科学技术出版社nihao	 	四剂	四诊(3月15日)	黄疸全退，舌净纳和，便调色黄，溲淡次多。病后以扶脾为重，再进调补以善其后。方用参苓白术加减，七剂而愈。	【按】阴黄，由于寒湿内阻，阳气不振，黄疸晦暗，舌质多淡，精神委靡；除与阳黄同属阻塞性而大便多见灰白色外，阴黄则粪便溏泄居多。因此辨证须明，用药亦有出入，但最后还需调补脾胃，则虽殊途而终同归也。 	sstp上海科学技术出版社nihao	 	 	sstp上海科学技术出版社nihao"
