Title,Creator,Creation Time,Summary,Link,Abstract,Details
董廷瑶治痿证5,biaoyin10,创建时间:10-23 15:27,摘要:单某，女，８岁。初诊（１９９０年３月８日，１９８８年因上感发热起，继则面部周身皮疹鲜红，乏力明显，下蹲及抬臂均感困难，肌痛，握力差，呈进行性加剧，经常发热。[阅读全文:],index.php?doc-view-7069,主题词： 	痿病		医家：	董廷瑶		关键词：		流派：		医案患者信息		性别：	女		年龄段：	学龄期(7至13岁)		职业：		婚姻：		<li>籍贯：</li>		医案信息		就诊时间：	1990年03月07日		主要症状：	红疹遍布		病因病机：	肺热叶焦，发为痿躄		中医诊断：	痿病		证型：	痿病（肺热津伤证）		西医诊断：	皮肌炎		治则：	泻肺降火，清营凉血		方剂：		医家信息		籍贯：		单位：		职称：		名中医：		所属学科：		代表作：		专业特长：,".tNSzbN { display:none; } 	
	单某，女，８岁	初诊（１９９０年３月８日）	１９８８年因上感发热起，继则面部周身皮疹鲜红，乏力明显，下蹲及抬臂均感困难，肌痛，握力差，呈进行性加剧，经常发热。某市级医院体检发现浅表淋巴结多处可及，红细胞沉降率３４mm／h，血红蛋白１０g／L，白细胞９．５×	10	9	／Ｌ，中性细胞８０％，淋巴细胞１６％，嗜酸４％，乳酸脱氢酶８３５U，肌酸磷酸激酶１４８U／Ｌ，抗核抗体阴性，乙肝抗原抗体全套阴性，狼疮细胞未找到。观面部、肘部红斑明显，下肢网状青斑，指背关节处淡红斑。确诊为皮肌炎。予服泼尼松５mg，一日四次、维生素Ｅ、复合维生素Ｂ、氯化钾等治疗。 	sstp上海科学技术出版社nihao	 	中医病史：皮肌炎二年。红疹遍身密布，皮肤热灼，上下眼睑红肿，肌痛，乏力明显，双下肢下蹲及起立困难，不能上楼，舌边尖红，苔薄而干，脉细带数。风热邪袭化火，体弱阴精不足，热入营血发为斑疹。先拟清肺泻火，养阴凉营。 	sstp上海科学技术出版社nihao	 	银花９克 连翘９克  桑白皮９克 	sstp上海科学技术出版社nihao	 	地骨皮９克 大生地１２克  女贞子９克 	sstp上海科学技术出版社nihao	 	旱莲草９克 甘草３克    丹皮９克 	sstp上海科学技术出版社nihao	 	夏枯草１０克 青蒿９克    白薇６克七剂 	sstp上海科学技术出版社nihao	 	二诊（４月１９日）	上方加减服已月余，肤热大减，面部蝶状红斑，周身红疹遇阳光照射后明显，肌力可，爱活动，复查肌酸磷酸激酶、乳酸脱氢酶恢复正常，但双下肢下蹲起立困难，不能上楼。大便坚硬，上法尚合，肌表邪热渐 减，阴精亏耗，再拟滋阴润下，凉血清热。 	sstp上海科学技术出版社nihao	 	玄参９克   麦冬９克   冬青子１０克 	sstp上海科学技术出版社nihao	 	旱莲草１０克   甘草３克   地骨皮１０克 	sstp上海科学技术出版社nihao	 	大生地１５克  知母６克    川石斛９克 	sstp上海科学技术出版社nihao	 	天花粉９克十四剂	手心烦热，颧赤盗汗，酌加乌梅、牡蛎、竹叶、丹皮等，连续服用。	三诊（８月１６日）	上方为主调治四月，面赤较淡，两足稍有力，借助扶梯自能上楼，颈部、上胸皮肤潮红，复查肌酸磷酸激酶、乳酸脱氢酶均正常。下蹲、抬手、翻身仍困难，但无吞咽困难，食欲欠佳，大便偏干。泼尼松减量至１２．５mg，一日二次。再拟益气健脾养阴。 	sstp上海科学技术出版社nihao	 	太子参９克  天麦冬各９克  冬青子１０克 	sstp上海科学技术出版社nihao	 	旱莲草１０克  大生地１５克  天花粉９克 	sstp上海科学技术出版社nihao	 	乌梅６克   生 首乌１２克   川石斛９克 	sstp上海科学技术出版社nihao	 	香谷芽１０克	四诊（１９９１年１月３０日）	外感发热（体温３８．６℃），咳嗽流涕二周，舌苔薄腻，纳呆口臭，乏力转甚，先拟辛凉疏解。	桑叶９克   薄荷３克（后下）  蝉衣６克 	sstp上海科学技术出版社nihao	 	杏仁６克    象贝９克陈皮５克 	sstp上海科学技术出版社nihao	 	苏叶６克     甘草３克  紫菀６克 	sstp上海科学技术出版社nihao	 	百部６克银花９克	五诊（３月７日）	三周前因患肺炎，用红霉素引起全身皮疹剧痒，面部红斑较明显，皮肌炎活动，增加泼尼松用量，血检：乳酸脱氢酶亦高于正常，增服雷公藤多苷片。药物过敏虽经处理，仍遍身发疹，再拟清热凉血。 	sstp上海科学技术出版社nihao	 	桑叶９克    竹叶９克   丹皮９克 	sstp上海科学技术出版社nihao	 	黑山栀９克黄芩６克   冬青子９克 	sstp上海科学技术出版社nihao	 	旱莲草９克荷叶１０克     银花１０克 	sstp上海科学技术出版社nihao	 	连翘９克大枣７枚 	六诊（１１月１４日）	清热凉血，滋养通便更替进行，血分安静，病情稳定，惟两腿关节痠痛无力，激素递减，直至停服激素。近因考试过劳又感肢体乏力，面斑又赤，眼睑红，口渴咽干，大便艰行，血白细胞偏低，血红蛋白９．８g／Ｌ，病情复杂，深入血分。再拟清养和血。 	sstp上海科学技术出版社nihao	 	生地３０克 麦冬９克  花粉９克 	sstp上海科学技术出版社nihao	 	玉竹９克 知母９克   丹皮９克 	sstp上海科学技术出版社nihao	 	冬青子１０克旱莲草１０克鸡血藤１５克 	sstp上海科学技术出版社nihao	 	忍冬藤３０克 粳米３０克（包）	七诊（１９９２年３月１２日） 	sstp上海科学技术出版社nihao	 	上方（加珠儿参９克，玄参９克）调治，验血基本正常，苔薄润、胃纳可，大便调，惟两腿“Ｏ”型，腿力尚弱，虽能登楼，易觉乏力。再拟培补肝肾，和血舒筋。	生地３０克  当归９克  天花粉９克 	sstp上海科学技术出版社nihao	 	赤白芍各９克   冬青子９克  旱莲草９克 	sstp上海科学技术出版社nihao	 	宣木瓜９克  怀牛膝１０克  狗脊９克 	sstp上海科学技术出版社nihao	 	黑芝麻１０克	【按】皮肌炎是慢性结缔组织病，以广泛性血管炎为主要病理变化，皮肤肌肉症状为主，起病缓慢，常有轻度发热，皮疹遍布，面部红斑涉及上下眼睑；肌痛肌无力，上楼困难，不能蹲下，病程久则坐立翻身均困难，严重的累及咽下肌、呼吸肌，导致吞咽困难、呼吸困难而危及生命。应用激素治疗反应良好，部分患儿可恢复正常，但须服激素二年以上，且易复发；部分患儿有皮肤及胃肠道溃疡，对激素治疗反应就差；有的甚至无效。一般于五年后转入静止状态，多数患儿由于肌无力而残废。故家长在应用激素的同时，求治于中医中药。 	sstp上海科学技术出版社nihao	 	中医古籍并无皮肌炎的病名，可归属于“血热发斑”、“阳毒发斑”等范畴。一般辨证分为热毒入营及气阴两虚型。本例患儿周身皮疹红痒热灼，面部红斑，尤以上下眼睑红肿、肌痛、肌无力明显，脉苔合参是内因阴精不足，外因风热邪袭郁而化火，邪入营血发为斑疹，热邪留滞不去，内舍脏腑则肌痛肢痿。病已二年，登楼困难。经曰：“五脏因肺热叶焦，发为痿躄。”肺热叶焦则清肃之气不能布行于五脏，故五脏之痿始于肺。先拟泻肺降火，清营凉血；继以益气健脾，柔肝舒筋；及滋养阴血，培补肝肾等三法按序调治，间有发热咳嗽，随诊疏解退热，化痰健脾。顽疾重证经治二年，逐步递减激素，终至停服激素八个月，虽症状略有反复，加重滋阴凉血清热之品，热清营和，诸恙递减，肌力增强，已能登楼，正常上学，血液化验正常，病情全面稳定向愈，惟足筋尚软，易觉乏力，终以滋养肝肾，舒筋和血巩固疗效。 	sstp上海科学技术出版社nihao	 	 	sstp上海科学技术出版社nihao"
董廷瑶治五软1,biaoyin10,创建时间:10-23 15:28,摘要:朱某，男，６岁。初诊（１９９１年２月２１日），生后手足痿软，手软不能握物，腿软足不任地，时或摇头、下肢抽搐，夜眠惊悸，发前能自觉预知，神萎智钝，语言正常。[阅读全文:],index.php?doc-view-7070,主题词： 	五软		医家：	董廷瑶		关键词：		流派：		医案患者信息		性别：	男		年龄段：	学龄前期(4至6岁)		职业：		婚姻：		<li>籍贯：</li>		医案信息		就诊时间：	1991年02月20日		主要症状：	肢体痿废		病因病机：	痰瘀交结，脑窍络阻		中医诊断：	五软		证型：	痰瘀互结证		西医诊断：		治则：	活血化瘀，祛痰定惊		方剂：	桃红四物汤		医家信息		籍贯：		单位：		职称：		名中医：		所属学科：		代表作：		专业特长：,".bNaWEM { display:none; } 	
	朱某，男，６岁	初诊（１９９１年２月２１日）	生后手足痿软，手软不能握物，腿软足不任地，时或摇头、下肢抽搐，夜眠惊悸，发前能自觉预知，神萎智钝，语言正常。病已五年有余，近作脑ＣＴ示：左顶叶脑血管畸形。舌红苔腻，胃纳尚可，大便偏干，二脉细涩，自诉头晕，咳嗽。证属痰瘀交结，脑窍络阻。治拟活血化瘀，祛痰定惊。 	sstp上海科学技术出版社nihao	 	当归尾９克  赤芍６克   川芎３克 	sstp上海科学技术出版社nihao	 	桃仁９克  红花４．５克  陈皮３克 	sstp上海科学技术出版社nihao	 	半夏６克   杏仁６克   紫菀６克 	sstp上海科学技术出版社nihao	 	钩藤６克（后下） 天浆壳７枚 	sstp上海科学技术出版社nihao	 	七剂	头晕加天麻、全蝎；肢冷加桂枝、牛膝。	二诊（３月２１日）	服上方加减一月，右手握力增强，两足行走虽软尚稳，四肢转温，抽搐减半，神清语常，小溲短数，大便间隔，舌红苔化，二脉沉细。痰化瘀散，再拟滋水涵木，补肾健脑。方用六味丸化裁。 	sstp上海科学技术出版社nihao	 	熟地１０克 萸肉６克   淮山药１２克 	sstp上海科学技术出版社nihao	 	茯苓９克  丹皮９克   泽泻９克 	sstp上海科学技术出版社nihao	 	杜仲９克续断９克 天麻６克 	sstp上海科学技术出版社nihao	 	杭菊花９克	三诊（６月１３日）	服上方加减三个月，滋养颇合，症情减轻，右手握力渐增，下肢仍有抽搐，口渴便坚，舌红苔净，阴血亏虚，再予上方去泽泻、杜仲、续断，加珠儿参９克，乌梅６克，玄参９克，麦冬９克。 	sstp上海科学技术出版社nihao	 	四诊（８月１日）	服药五月余，肢搐大减，下肢偶搐幅小微抖而已，常诉头晕，睡时露睛，口渴引饮，舌红无苔，脉细小弦。阴虚肾亏，虚风内动。再拟滋阴潜阳，凉肝和络，三甲复脉汤出入。 	sstp上海科学技术出版社nihao	 	生地１５克 鳖甲１０克（先煎） 龟版６克（先煎） 	sstp上海科学技术出版社nihao	 	龙齿１５克（先煎） 石决明３０克（先煎） 天麻６克 	sstp上海科学技术出版社nihao	 	滁菊花９克 乌梅６克 天冬９克 	sstp上海科学技术出版社nihao	 	炙甘草３克	五诊（９月５日）	自服上方一月，病情全面进步，惊搐已和，睡时睛合，头晕亦减，右手握力仍差，面色白，舌红苔薄，二脉细软，虚风渐平，阴血不易骤复，仍拟益气养血，滋阴熄风。 	sstp上海科学技术出版社nihao	 	当归９克  川芎６克 生熟地各１０克 	sstp上海科学技术出版社nihao	 	太子参１０ 克  萸肉６克 龟版９克（先煎） 	sstp上海科学技术出版社nihao	 	牡蛎３０克（先煎） 乌梅６克 天麻６克 	sstp上海科学技术出版社nihao	 	白芍9克黄精１０克  炙甘草５克 	sstp上海科学技术出版社nihao	 	【按】患儿脑血管畸形，先天疾患，属“五软”范畴。先天脑病，气血运行失常，久而血瘀痰阻，络道失于宣通，本虚标实，先拟治标，予活血祛瘀，豁痰通络。方拟桃红四物汤养血活血化瘀；桂枝通阳化气；加陈、半、杏、菀、天浆壳豁痰通络，钩藤熄风定惊，全方宣可决壅，通可行滞。加减服用一月，痰浊化而瘀血清，肢搐减半，舌红苔净脉沉，邪祛正虚，病久肾虚，水不涵木，虚风内动，缓图其本。再拟六味丸加杜仲、续断补肾壮骨；天麻、杭菊滋水涵木，肝肾同调。终用三甲复脉汤加减滋肾填精，熄风潜阳，壮骨强筋。痼疾顽症能获向愈，辨证求因时，切勿以惊搐即谓惊风，妄投截风定惊之品。景岳曰：“不知急惊慢惊，一以风热，一以脾肾之虚，皆不必由惊而得。”本例先天血瘀阻滞络道，虚风挟痰上旋，脑窍闭塞，上发为摇头而晕，下则肢搐而不利为慢惊。标本分治，先通后补，先天之疾后天调治，亦能痰化血活，络道宣通，濡养筋脉，填补脑髓，而脑功能逐渐恢复，实显中医中药治病救人之优势。 	sstp上海科学技术出版社nihao	 	 	sstp上海科学技术出版社nihao"
董廷瑶治肾病综合征2,biaoyin10,创建时间:10-20 15:41,摘要:张某，男，8岁。初诊(1980年7月22日)，四年前全身浮肿，用泼尼松、氢氯噻嗪、中药等治疗好转。两年后又发，上药效果不显，尿蛋白始终阳性。近日尿蛋白(++++)，血胆固醇13mmol／L。[阅读全文:],index.php?doc-view-6557,主题词： 	阴水		医家：	董廷瑶		关键词：		流派：		医案患者信息		性别：	男		年龄段：	学龄期(7至13岁)		职业：		婚姻：		<li>籍贯：</li>		医案信息		就诊时间：	1980年07月21日		主要症状：	水肿		病因病机：	湿热内滞，肾虚水泛		中医诊断：	阴水		证型：	阴水（阳虚水泛证）		西医诊断：	肾病综合征		治则：	利水消肿，温肾助阳		方剂：	五皮饮（《三因极一病证方论》）		医家信息		籍贯：		单位：		职称：		名中医：		所属学科：		代表作：		专业特长：,".QjUVoV { display:none; } 	
	张某，男，8岁	初诊(1980年7月22日)	四年前全身浮肿，用泼尼松、氢氯噻嗪、中药等治疗好转。两年后又发，上药效果不显，尿蛋白始终阳性。近日尿蛋白(++++)，血胆固醇13mmol／L，收入住院。诊为肾病综合征，予地塞米松、环磷酰胺、青霉素等，并结合中医治疗。 	sstp上海科学技术出版社nihao	 	现面部浮肿，略有咳嗽，小溲通长，大便不畅，二脉濡细，舌红苔黄。据症为湿热内滞，肾虚水泛。姑先以利水消肿为主，五皮饮加味，先治其标。	桑皮9克 茯苓皮12克 腹皮12克 	sstp上海科学技术出版社nihao	 	陈皮3克 五加皮9克 仙灵脾9克	半夏9克 苡仁根30克 地骷髅12克 	sstp上海科学技术出版社nihao	 	瘪竹12克 	sstp上海科学技术出版社nihao	 	三剂	二诊(7月25日)	面浮稍减，咳嗽已愈，二便尚通，纳谷一般，尿检好转，舌转淡而苔白。湿热略化，已见阳虚。故温阳利水以治本。	淡附片6克  肉桂1.5克(后入)  仙灵脾9克 	sstp上海科学技术出版社nihao	 	熟地9克  淮山药9克 赤苓皮12克	地骷髅12克 瘪竹12克  苡仁根30克 	sstp上海科学技术出版社nihao	 	车前草15克 	sstp上海科学技术出版社nihao	 	三剂	三诊(7月28日)	服上方三剂后浮肿已平，纳食亦香，二便尚调；但脉细，舌红苔薄白。病久肾虚，兼损阴分。根据病情转化拟六味地黄加味滋养肾阴以利余水。	生地12克   淮山药12克 山萸肉6克 	sstp上海科学技术出版社nihao	 	带皮苓12克 地骷髅12克 瘪竹12克	腹皮9克  丹皮9克 泽泻9克 	sstp上海科学技术出版社nihao	 	仙灵脾9克 	sstp上海科学技术出版社nihao	 	七剂	四诊(8月4日)	尿检已正常。小溲通长，胃纳渐旺，大便稍干，舌净略红。宜调补脾肾以固本元。	生地30克 淮山药12克 萸肉9克 	sstp上海科学技术出版社nihao	 	茯苓9克 清甘草3克  丹皮9克 	sstp上海科学技术出版社nihao	 	泽泻9克 生白术9克 仙灵脾9克 	sstp上海科学技术出版社nihao	 	黄芪9克 	sstp上海科学技术出版社nihao	 	七剂	药后诸症如常，乃以上方续服，加党参9克，以熟地易生地。病情稳定，于9月中旬基本痊愈出院。	【按】本例“肾病”，为肾虚而湿邪内滞。初诊先祛其邪，三剂后症状减轻，尿检好转，改用温肾利水。再后调补脾肾，诸症皆安。 	sstp上海科学技术出版社nihao	 	 	sstp上海科学技术出版社nihao"
董廷瑶治肾病综合征3,biaoyin10,创建时间:10-20 15:49,摘要:张某，男，6岁。初诊(1992年5月2日)，一年前，突然目睑浮肿，尿少，继而全身肢体浮肿，外院尿检蛋白(++++)，诊断为肾病综合征，住院治疗，用泼尼松(12.5mg口服，一日三次)等。[阅读全文:],index.php?doc-view-6558,主题词： 	阴水		医家：	董廷瑶		关键词：		流派：		医案患者信息		性别：	男		年龄段：	学龄前期(4至6岁)		职业：		婚姻：		<li>籍贯：</li>		医案信息		就诊时间：	1992年05月01日		主要症状：	水肿		病因病机：	脾肾两虚，水湿运化失常		中医诊断：	阴水		证型：	脾肾两虚证		西医诊断：	肾病综合征		治则：	补肾滋阴，健脾利水		方剂：		医家信息		籍贯：		单位：		职称：		名中医：		所属学科：		代表作：		专业特长：,".MuLbWK { display:none; } 	
	张某，男，6岁	初诊(1992年5月2日)	一年前，突然目睑浮肿，尿少，继而全身肢体浮肿，外院尿检蛋白(++++)，诊断为肾病综合征，住院治疗，用泼尼松(12.5mg口服，一日三次)等，病情得到控制后出院，以后蛋白尿时有出现。现尿检蛋白(+)，泼尼松用量40mg隔日一次，刻诊面目浮肿，面色潮红，腰腿软，小便尚通，纳可，大便通畅，夜寐欠安，舌红苔薄，脉细数。其病已久，必已损伤肾阴，治疗以滋补肾阴为先。 	sstp上海科学技术出版社nihao	 	熟地9克 淮山药9克  山萸肉6克	茯苓9克 炒白术9克  米仁9克 	sstp上海科学技术出版社nihao	 	川断5克 白花蛇舌草15克 半边莲10克 	sstp上海科学技术出版社nihao	 	炒谷芽9克 	sstp上海科学技术出版社nihao	 	七剂	二诊(5月28日)	今日尿检，只显蛋白痕迹，胃纳一般，汗出淋多，体质虚耗，舌苔薄润，脉细弱。久病脾气亦伤，法用健脾益气，四君子汤加味。	炒黄芪6克 白术9克 党参6克 	sstp上海科学技术出版社nihao	 	茯苓9克 甘草3克 半边莲10克 	sstp上海科学技术出版社nihao	 	山萸肉6克 川断15克 熟地10克	淮山药9克 白花蛇舌草15克 	sstp上海科学技术出版社nihao	 	七剂	以后症情稳定，药味稍作加减，连服二十一剂。	三诊(8月6日)	激素已减至25mg 隔日一次，尿检蛋白微量，小溲通长，舌淡苔白。治用济生肾气丸加味，温补肾阳，利水消肿。	四诊(8月13日) 	sstp上海科学技术出版社nihao	 	稍有感冒，咽红，乳蛾肿大，目睑浮肿，小溲通，舌红苔薄白，尿蛋白(+)，此为风水郁表，治用祛风利水之法。	炙麻黄3克 银花9克 赤小豆9克 	sstp上海科学技术出版社nihao	 	桔梗4.5克  射干5克 车前子9克(包煎) 	sstp上海科学技术出版社nihao	 	桑叶6克 泡米仁9克 茯苓9克 	sstp上海科学技术出版社nihao	 	生甘草3克 连翘９克 	sstp上海科学技术出版社nihao	 	七剂	五诊(8月20日)	尿检有蛋白痕迹，目睑肿消退，病情稳定，舌红苔薄白，再以四君子汤益气健脾，佐用白花蛇舌草、半边莲、川断等调治。	一月后尿检正常，泼尼松用量减至15mg 隔日一次，主以异功散合苡仁、赤小豆、淮山药等治疗，三个月后激素停用，病情稳定。 	sstp上海科学技术出版社nihao	 	【按】肾阴不足，累及脾土，故治疗上先以六味地黄丸滋补肾阴，合白花蛇舌草、半边莲清热利湿，川断补肝肾等。二周后，尿检蛋白减少，但患儿体质薄弱，方用四君合补肾药调治。此时患儿激素逐渐减量，期间偶有上感，水肿再起，此当风邪重犯，治用麻黄连翘赤小豆汤加味，消退皮水，待症情稳定后，仍用健脾补肾法调扶，收效良好。 	sstp上海科学技术出版社nihao	 	 	sstp上海科学技术出版社nihao"
董廷瑶治过敏性肾炎,biaoyin10,创建时间:10-20 15:59,摘要:梁某，男，8岁。初诊(1981年6月2日)，病孩自幼有支气管哮喘史。近五个月来，经常血尿。西医诊断为过敏性肾炎。唇红如朱，口干喜饮，纳食较少，时有遗溺。现尿检红细胞15～20个／高倍镜。[阅读全文:],index.php?doc-view-6560,主题词： 	尿血[病]		医家：	董廷瑶		关键词：		流派：		医案患者信息		性别：	男		年龄段：	学龄期(7至13岁)		职业：		婚姻：		<li>籍贯：</li>		医案信息		就诊时间：	1981年06月01日		主要症状：	血尿		病因病机：	阴虚火旺，伤及阴络		中医诊断：	尿血[病]		证型：	尿血（阴虚火旺证）		西医诊断：	过敏性紫癜性肾炎		治则：	滋肾和血，清泄相火		方剂：	六味地黄汤（《小儿药证直诀》）		医家信息		籍贯：		单位：		职称：		名中医：		所属学科：		代表作：		专业特长：,".fnhyfc { display:none; } 	
	梁某，男，8岁	初诊(1981年6月2日)	病孩自幼有支气管哮喘史。近五个月来，经常血尿。西医诊断为过敏性肾炎。唇红如朱，口干喜饮，纳食较少，时有遗溺。现尿检红细胞15～20个／高倍镜。脉细常数，舌红苔薄。肺肾两虚之体，当议图本。先拟滋肾和血。 	sstp上海科学技术出版社nihao	 	生地30克  丹皮9克 淮山药10克	山萸肉6克  泽泻9克 茯苓10克 	sstp上海科学技术出版社nihao	 	侧柏炭10克  茜根20克   桃仁泥6克	红花4.5克 仙鹤草20克 	sstp上海科学技术出版社nihao	 	七剂	二诊(6月9日)	血尿较少，尿检红细胞3～4个／高倍镜，余症略同，原法增损可也。上方去桃、红、泽泻，加缩泉丸12包，益母草9克，小蓟炭10克，七剂。后又连服二周。	三诊(7月7日) 	sstp上海科学技术出版社nihao	 	遗尿已止，血尿尚有(尿检红细胞6～8个／高倍镜)。胃纳见动，舌净脉细。金水二脏俱弱，治宜兼顾。	生地12克  山萸肉6  克丹皮9克 	sstp上海科学技术出版社nihao	 	茯苓9克 泽泻9克  小蓟炭10克 	sstp上海科学技术出版社nihao	 	侧柏炭10克 麦冬9克 元参6克	淮山药10克  	sstp上海科学技术出版社nihao	 	七剂后又连七剂	四诊(7月21日)	纳食既增，唇色渐淡，舌苔薄润，尿检趋佳(红细胞0～1个／高倍镜)。坚守原法，两补肺肾。	熟地12克 淮山药10克  侧柏炭10克 	sstp上海科学技术出版社nihao	 	藕节炭9克 北沙参10克 山萸肉6克 	sstp上海科学技术出版社nihao	 	茯苓9克 丹皮9克 泽泻9克 	sstp上海科学技术出版社nihao	 	麦冬9克 	sstp上海科学技术出版社nihao	 	七剂	此后尿检持续正常，上方连服，病情渐次稳定。	【按】该儿之过敏性体质十分明显，既有支气管哮喘史，又患过敏性肾炎，上下俱病，其本在肾。验之脉证，乃为阴虚火旺，伤及阴络。故主以六味地黄汤专养肾阴，清泄相火；方中重用生地，配以侧柏、茜草根、仙鹤草等，凉营止血。并加桃红行瘀活血为佐，以溺血日久，里必有瘀也。服后其症逐步改善，乃去桃红，增加缩泉丸，既为止遗之用，亦藉其滋养固肾之力。三诊之后，兼扶肺金，选用北沙参、麦冬、玄参之类，以金为水母，而肾为气根，两脏并治，相得益彰。四诊易生地为熟地，滋培肾阴，填补精血，尤为善后巩固所必需，其症遂得安和。 	sstp上海科学技术出版社nihao"
