Title,Creator,Creation Time,Summary,Link,Abstract,Details
董廷瑶治泄泻12,biaoyin10,创建时间:10-19 12:14,摘要:朱某，５个月。初诊（１９６１年５月２日）便下秘利，次数频多，小溲尚通，腹满胀气，按之即哭，形色较萎，身热不高，舌红口炎。热利伤津，脾运不畅。治以清养运脾。[阅读全文:],index.php?doc-view-6391,主题词： 	小儿泄泻		医家：	董廷瑶		关键词：		流派：		医案患者信息		性别：		年龄段：	0至1岁		职业：		婚姻：		<li>籍贯：</li>		医案信息		就诊时间：	1961年05月01日		主要症状：	腹泻		病因病机：	热邪伤阴，阴损及阳		中医诊断：	小儿泄泻		证型：	阴阳两虚证		西医诊断：	消化不良		治则：	扶元救阴，温中回阳		方剂：		医家信息		籍贯：		单位：		职称：		名中医：		所属学科：		代表作：		专业特长：,".EIchWZ { display:none; } 	
	朱某，５个月	初诊（１９６１年５月２日）	便下秘利，次数频多，小溲尚通，腹满胀气，按之即哭，形色较萎，身热不高，舌红口炎。热利伤津，脾运不畅。治以清养运脾。 	sstp上海科学技术出版社nihao	 	人参须２．４克  煨葛根６克  花粉９克 	sstp上海科学技术出版社nihao	 	扁豆衣６克 炒枳壳４．５克  青皮３克 	sstp上海科学技术出版社nihao	 	炒于术４．５克  生甘草２．４克 香连丸１．８克（包） 	sstp上海科学技术出版社nihao	 	二剂	二诊（５月４日）	泄利仍剧，日有十余次，腹满而胀，舌光干而淡红，形神委靡，汗出，纳少作恶，小溲尚有。元气大惫，伤阴耗液，阳虚之象。其势危殆，亟投益气扶元救之。 	sstp上海科学技术出版社nihao	 	西洋参２．４克（另炖） 移山参４．５克  乌梅４．５克 	sstp上海科学技术出版社nihao	 	钗石斛９克 煨诃子９克  天花粉９克 	sstp上海科学技术出版社nihao	 	石莲子９克生熟谷芽各９克 土炒于术４．５克 	sstp上海科学技术出版社nihao	 	淮山药９克 炮姜１．５克	生甘草２．４克 	sstp上海科学技术出版社nihao	 	一剂	三诊（５月５日）	泄泻次数虽减，但便下清谷，腹满有气，形神不振，舌光津少而质淡，体温反低。阴津已伤，阳气亦衰，幸胃气稍动，或有一线生机。兹拟救阴扶阳，以冀转机。 	sstp上海科学技术出版社nihao	 	西洋参２．４克（另炖） 移山参４．５克  黄厚附片９克   	sstp上海科学技术出版社nihao	 	炮姜１．８克 钗石斛９克生扁豆９克  	sstp上海科学技术出版社nihao	 	炒于术４．５克生熟谷芽各６克 焦甘草２．４克 	sstp上海科学技术出版社nihao	 	乌梅４．５克 茯苓９克 	sstp上海科学技术出版社nihao	 	一剂	四诊（５月６日）	服昨方今形神较振，泄利见粪，但有不化黏质，小溲尚通，胃气已动，腹部虽满，按之尚软。征象渐露生机，兹拟原法继之。	移山参４．５克 黄厚附片９克  上肉桂１．２克 	sstp上海科学技术出版社nihao	 	炒于术４．５克 炮姜１．５克 茯苓９克 	sstp上海科学技术出版社nihao	 	焦甘草２．４克 乌梅４．５克  钗石斛９克 	sstp上海科学技术出版社nihao	 	生熟谷 芽各９克 	sstp上海科学技术出版社nihao	 	三剂	五诊（５月９日）	大便泄利，次数减少，小溲通长，腹部亦软，形神转振，胃气亦和，舌光淡红。症情由险化夷，仍以原法加减。	移山参４．５克 黄厚附片９克  炒于术４．５克 	sstp上海科学技术出版社nihao	 	炮姜１．５克 乌梅４．５克 钗石斛９克 	sstp上海科学技术出版社nihao	 	生熟谷芽各９克 淮山药９克 清甘草３克 	sstp上海科学技术出版社nihao	 	煨木香２．４克 	sstp上海科学技术出版社nihao	 	二剂	嗣后病情稳定，由于体质太弱，一直调治至６月１日痊愈出院。	【按】本例西医诊断为中毒性消化不良，中医辨证为阴阳两伤。其病因是从热利转变而成。但本案病情错综复杂，非明察毫末，步步紧扣，则殊难见功。初诊时其症见舌红口炎，身热色萎，便下秘利次多，是热邪未清而又伤及阴分；腹满胀气，按之即哭，是脾运虽虚，气亦阻滞，乃系虚实互夹之证。如邪热不祛，气滞不畅，泄久必更亡津。因之用参须、于术、扁豆衣、花粉、甘草以养阴生津；香连丸、葛根清热止泻；青陈皮、枳壳理气运脾。二剂后泄利仍剧，舌光而干，形神委靡，纳少作恶，是阴津亏少，胃气亦衰；其腹满而胀，但按之不哭，与前胀不同。和舌质淡红、汗出相参，是为阳虚之征。经曰脏寒生满病；虽对水气而言，但其理相同。此是阴损及阳，而致火衰不能温熙肠胃，运化无权之虚胀腹满。这时邪热虽去，元阴亦由病久而随之虚衰，病情十分危重，当务之急在于扶元生津，保其胃气，所谓留得一分胃气，便有一线生机也。若妄用苦寒克伐，必致危殆。方中重用二参以扶元救阴，炮姜温运阳气，乌梅、石斛、天花粉、莲子、谷芽、淮山药、于术生津保胃。一剂后病情好转，体温反低（说明辨证阳衰虚胀是正确的）。再以原法增损，加入附片以温阳，病情日趋坦途。续予阴阳并扶加减运用，终克全功。 	sstp上海科学技术出版社nihao	 	 	sstp上海科学技术出版社nihao"
董廷瑶治泄泻13,biaoyin10,创建时间:10-19 12:21,摘要:沈某，男，１岁。初诊（１９６３年１２月１２日）脾虚泄泻，已有旬余，面色萎黄，毛发稀枯，小溲尚通，舌质淡红。为脾阳受损，治以温中。[阅读全文:],index.php?doc-view-6396,主题词： 	小儿泄泻		医家：	董廷瑶		关键词：		流派：		医案患者信息		性别：	男		年龄段：	0至1岁		职业：		婚姻：		<li>籍贯：</li>		医案信息		就诊时间：	1963年12月11日		主要症状：	腹泻		病因病机：	脾虚肠滑，温化失常		中医诊断：	小儿泄泻		证型：	小儿泄泻(脾虚证）		西医诊断：		治则：	温中健脾，涩肠固脱		方剂：		医家信息		籍贯：		单位：		职称：		名中医：		所属学科：		代表作：		专业特长：,".sHzQGH { display:none; } 	
	沈某，男，１岁	初诊（１９６３年１２月１２日）	脾虚泄泻，已有旬余，面色萎黄，毛发稀枯，小溲尚通，舌质淡红。为脾阳受损，治以温中。	党参４．５克  炮姜２．４克  炒于术３克 	sstp上海科学技术出版社nihao	 	焦甘草２．４克 煨木香２．４克煨诃子６克 	sstp上海科学技术出版社nihao	 	炒麦芽９克 炒楂肉９克 	sstp上海科学技术出版社nihao	 	二剂	二诊（１２月１４日）	泄泻不和，昨曾十二次，状若鹜溏，量少，腹满尚软，舌淡红苔洁。其症脾阳不振，泄久肠滑。治以温涩。	炮姜炭１．５克  石榴皮４．５克  炒于术４．５克 	sstp上海科学技术出版社nihao	 	淮山药９克 扁豆衣９克煨诃子６克 	sstp上海科学技术出版社nihao	 	煨木香２．４克 陈皮３克 炒麦芽９克 	sstp上海科学技术出版社nihao	 	二剂	三诊（１２月１６日）	泄利仍多，形神较活，小溲通长，胃纳尚和，啼哭有泪，腹软无气，舌淡苔洁。久泄肠滑，重用止涩温里。	淡附片３克  炮姜1.8 克 炒于术４．５克 	sstp上海科学技术出版社nihao	 	煨木香２．４克炒御米壳４．５克 煨诃子６克 	sstp上海科学技术出版社nihao	 	石榴皮６克扁豆衣９克  焦甘草２．４克 	sstp上海科学技术出版社nihao	 	煅龙骨９克赤石脂１２克（包）二剂	药后泄利次减，便亦转厚，泄久肠滑，仍须原法加党参续服，三剂后痊愈出院。	【按】该例属脾阳不振，久泄而致肠滑；故初用理中不效，乃补可去弱，不能固脱也。经改为温阳固涩之剂，如石榴皮、御米壳、煅龙骨、赤石脂等，泄利旋见好转而获愈。固涩法之运用，必须具备苔净，腹软，溲通，身无热四个条件，方为合宜。 	sstp上海科学技术出版社nihao	 	 	sstp上海科学技术出版社nihao"
董廷瑶治泄泻14,biaoyin10,创建时间:10-19 12:25,摘要:孙某，女，２岁。初诊（１９６２年７月２０日）暑邪挟湿，内困脾胃，纳食不佳，消化不良，大便溏泄，腹满略胀，身热四日，舌苔厚腻。当宜清化暑湿为主。[阅读全文:],index.php?doc-view-6401,主题词： 	小儿泄泻		医家：	董廷瑶		关键词：		流派：		医案患者信息		性别：	女		年龄段：	幼儿期(1至3岁)		职业：		婚姻：		<li>籍贯：</li>		医案信息		就诊时间：	1962年07月19日		主要症状：	腹泻		病因病机：	暑湿困脾，气机不畅		中医诊断：	小儿泄泻		证型：	泄泻（暑湿证）		西医诊断：		治则：	清热祛暑，化湿止泻		方剂：		医家信息		籍贯：		单位：		职称：		名中医：		所属学科：		代表作：		专业特长：,".MThFdN { display:none; } 	
	孙某，女，２岁	初诊（１９６２年７月２０日）	暑邪挟湿，内困脾胃，纳食不佳，消化不良，大便溏泄，腹满略胀，身热四日，舌苔厚腻。当宜清化暑湿为主。 	sstp上海科学技术出版社nihao	 	藿香９克 佩兰９克 川朴３克 	sstp上海科学技术出版社nihao	 	青蒿９克 六一散９克（包）   赤苓９克	广木香３克连翘９克生扁豆９克 	sstp上海科学技术出版社nihao	 	陈皮３克 神曲９克 焦白术６克 	sstp上海科学技术出版社nihao	 	三剂	二诊（７月２３日）	药后热和，舌苔化薄，腹部转软，便下次减。诸症向愈，改以调理脾胃。	陈皮３克 焦白术９克 藿香６克 	sstp上海科学技术出版社nihao	 	广木香３克 茯苓９克   清甘草３克 	sstp上海科学技术出版社nihao	 	川朴３克 炒扁豆９克 	sstp上海科学技术出版社nihao	 	三剂	药后舌净便调，再以调理三剂而愈。	【按】本例由于湿困脾胃，而致气滞不畅，腹见胀满，升降失职，故而泄泻。乃用太无神术散为主，以和中化湿，鼓动脾气。由于时值暑令，故温燥之剂加入芳化健脾和胃诸品，俾暑祛湿化，脾胃健复，清升浊降，其泄自愈。临床见湿困之腹胀者，需仔细辨别，灵活施治方能获效也。 	sstp上海科学技术出版社nihao	 	 	sstp上海科学技术出版社nihao"
董廷瑶治泄泻15,biaoyin10,创建时间:10-19 12:29,摘要:沈某，男，７个月。初诊（１９７４年８月９日）泄利一周，小溲短少，舌苔白滑，咳少有痰。证系水邪中阻，治以分利。[阅读全文:],index.php?doc-view-6402,主题词： 	小儿泄泻		医家：	董廷瑶		关键词：		流派：		医案患者信息		性别：	男		年龄段：	0至1岁		职业：		婚姻：		<li>籍贯：</li>		医案信息		就诊时间：	1974年08月08日		主要症状：	腹泻		病因病机：	水湿内滞，小肠泌别失职		中医诊断：	小儿泄泻		证型：	水湿内停证		西医诊断：		治则：	分利止泻		方剂：	五苓散（《伤寒论》）		医家信息		籍贯：		单位：		职称：		名中医：		所属学科：		代表作：		专业特长：,".QfNFLr { display:none; } 	
	沈某，男，７个月	初诊（１９７４年８月９日）	泄利一周，小溲短少，舌苔白滑，咳少有痰。证系水邪中阻，治以分利。	桂枝１．８克  米泔浸茅术９克 赤苓９克 	sstp上海科学技术出版社nihao	 	猪苓６克 泽泻９克 广木香２．４克 	sstp上海科学技术出版社nihao	 	葛根６克 陈皮３克  车前子９克（包） 	sstp上海科学技术出版社nihao	 	三剂	二诊（８月１２日）	舌净而淡，便泄已差，小溲转长，痰声尚有。还宜健运治之。	葛根6克 广木香3克  焦白术9克 	sstp上海科学技术出版社nihao	 	茯苓9克 陈皮3克 炒谷芽9克 	sstp上海科学技术出版社nihao	 	炒扁豆9克 炒楂肉９克 车前子9克(包) 	sstp上海科学技术出版社nihao	 	四剂	药后痰化便调，诸症均安。	【按】本例泄利溲少，痰多，苔滑，乃是水湿内滞，致小肠泌别失职所致。故用五苓散以分利之，使水湿从小便而出，以达到实大便的目的。	 	sstp上海科学技术出版社nihao"
董廷瑶治泄泻17,biaoyin10,创建时间:10-19 12:48,摘要:汪某，男，４个月。初诊(1975年3月18日)患儿生后不久，即有泄泻。粪便稀薄，日十余次，形色萎羸，舌净无苔，小溲通长。检查乳母蹲踞、踝膝反射异常，乃“脚气型”泄泻也。[阅读全文:],index.php?doc-view-6404,主题词： 	小儿泄泻		医家：	董廷瑶		关键词：		流派：		医案患者信息		性别：	男		年龄段：	0至1岁		职业：		婚姻：		<li>籍贯：</li>		医案信息		就诊时间：	1975年03月17日		主要症状：	腹泻		病因病机：	母乳缺乏营养，小儿营养不良		中医诊断：	小儿泄泻		证型：	脚气型		西医诊断：		治则：	温中健脾，消积化滞		方剂：	理中汤		医家信息		籍贯：		单位：		职称：		名中医：		所属学科：		代表作：		专业特长：,".YoQMqr { display:none; } 	
	汪某，男，４个月	初诊(1975年3月18日)	患儿生后不久，即有泄泻。粪便稀薄，日十余次，形色萎羸，舌净无苔，小溲通长。检查乳母蹲踞、踝膝反射异常，乃“脚气型”泄泻也。嘱停母乳，代以米汤、奶糕等，药用温运消积。 	sstp上海科学技术出版社nihao	 	炮姜1.8克 楂肉炭9克 炒麦芽9克	煨木香2.4克  党参4.5克 清甘草2.4克 	sstp上海科学技术出版社nihao	 	陈皮3克 青皮4.5克 焦白术9克三剂 	sstp上海科学技术出版社nihao	 	二诊(3月21日)	停乳进药，便下成条，为四月来所未有，舌苔薄净，形神亦振，小溲通长。再以理中加味，建议人工喂养。	党参4.5克 焦白术9克 炮姜1.8克 	sstp上海科学技术出版社nihao	 	清甘草2.4克 炒麦芽9克 广木香2.4克	陈皮3克 	sstp上海科学技术出版社nihao	 	三剂	以后家属告知，不哺母乳，大便从此正常。	 	sstp上海科学技术出版社nihao"
董廷瑶治泄泻18,biaoyin10,创建时间:10-19 12:51,摘要:乔某，女，3个月。初诊(1975年3月29日)生后不久即持续泄泻，二月余不愈。每日最多十至二十次，状如蛋花，色绿夹有乳块，无脱水征，小溲亦通，形神较软，舌苔薄润。[阅读全文:],index.php?doc-view-6405,主题词： 	小儿泄泻		医家：	董廷瑶		关键词：		流派：		医案患者信息		性别：	女		年龄段：	0至1岁		职业：		婚姻：		<li>籍贯：</li>		医案信息		就诊时间：	1975年03月28日		主要症状：	腹泻		病因病机：	母乳缺乏营养，小儿营养不良		中医诊断：	小儿泄泻		证型：	脚气型		西医诊断：		治则：	运脾消积		方剂：		医家信息		籍贯：		单位：		职称：		名中医：		所属学科：		代表作：		专业特长：,".VnrzWg { display:none; } 	
	乔某，女，3个月	初诊(1975年3月29日)	生后不久即持续泄泻，二月余不愈。每日最多十至二十次，状如蛋花，色绿夹有乳块，无脱水征，小溲亦通，形神较软，舌苔薄润。检查乳母蹲踞、踝膝反射异常。此为“脚气型”泄泻。嘱停母乳，暂饮米汤。方以温运兼化乳积。 	sstp上海科学技术出版社nihao	 	炮姜1.8克  楂肉炭9克		 	炒麦芽9克	 	sstp上海科学技术出版社nihao	 	陈皮3克		 	焦白术6克		 	清甘草2.4克	 	sstp上海科学技术出版社nihao	 	木香1.8克		 	党参4.5克		 	二剂	 	sstp上海科学技术出版社nihao	 	药后大便成形，次数减少，再进原方调理而愈。	【按】该二儿均为出生后不久即见泄泻，虽经中西药物治疗却不见效，但又未现脱水征象。根据检查乳母之蹲踞、踝膝反射异常，乃知其为“脚气型”泄泻。故嘱停乳，改为人工喂养，同时予运脾消积之剂，见效迅速。 	sstp上海科学技术出版社nihao	 	 	sstp上海科学技术出版社nihao"
董廷瑶治泄泻19,biaoyin10,创建时间:10-19 12:58,摘要:张某，男，1岁。初诊(1981年3月9日)患儿发热泄泻已近一月，现症泄泻不止，发热未清(体温38℃左右)，舌红少苔，唇朱口燥，食纳尚可，腹满胀气，肠鸣转矢，小溲不多，四肢清冷。[阅读全文:],index.php?doc-view-6406,主题词： 	小儿泄泻		医家：	董廷瑶		关键词：		流派：		医案患者信息		性别：	男		年龄段：	0至1岁		职业：		婚姻：		<li>籍贯：</li>		医案信息		就诊时间：	1981年03月08日		主要症状：	腹泻		病因病机：	虚中夹实，升降失职		中医诊断：	小儿泄泻		证型：	虚实夹杂证		西医诊断：	消化不良		治则：	升清降浊，清热止泻		方剂：		医家信息		籍贯：		单位：		职称：		名中医：		所属学科：		代表作：		专业特长：,".RQVaZu { display:none; } 	
	张某，男，1岁	初诊(1981年3月9日)	患儿发热泄泻已近一月，现症泄泻不止，发热未清(体温38℃左右)，舌红少苔，唇朱口燥，食纳尚可，腹满胀气，肠鸣转矢，小溲不多，四肢清冷。通过补液，啼哭有泪。经西医按消化不良症治疗后，病情有所减轻，但仍缠绵。其证为，当防病势反复。治以，升清降浊，清热止泻，略扶其正。 	sstp上海科学技术出版社nihao	 	煨葛根6克 条芩4.5克   广木香3克(后下) 	sstp上海科学技术出版社nihao	 	淮山药10克 米炒党参6克 扁豆衣9克 	sstp上海科学技术出版社nihao	 	炒枳壳4.5克 花粉9克 银花９克 	sstp上海科学技术出版社nihao	 	干荷叶30克 	sstp上海科学技术出版社nihao	 	三剂	二诊(3月12日)	热度已退，形神活泼，舌润口滋，四肢温和，腹满较软，矢气减少，大便成形，小溲通长，但胃纳不振，偶有吐恶。上方已合，病情好转，现当清养调扶，兼以升清理气。 	sstp上海科学技术出版社nihao	 	皮尾参4.5克(另炖）生扁豆９克  淮山药10克 	sstp上海科学技术出版社nihao	 	银花６克 清甘草3克  煨葛根6克 	sstp上海科学技术出版社nihao	 	干荷叶30克 川斛9克  广木香3克（后下） 	sstp上海科学技术出版社nihao	 	炒谷芽9克 	sstp上海科学技术出版社nihao	 	三剂	药后随之病愈出院。	【按】患儿病发一月，西医以补液等治疗，略见好转，但泄泻不瘥，腹满转气，发热迁延，四肢不温。此乃“清气在下，则生飧泄；浊气在上，则生胀”(《素问·阴阳应象大论》)，虚实互见之症也。其中手足清冷，为清阳不布、气郁热厥之候。此时既不宜补脾以止泻，亦不可通下以泄满。唯升清降浊之法，庶几相合。故初方即以荷叶、葛根、银花、扁豆衣轻灵升清为主，使清阳宣发而浊阴自降；配以木香、枳壳理气宽中，条芩、花粉清热生津，党参、山药健脾扶中，病情即得初安，泄止、肢温、舌润，清升之象也，腹松、气减、溲长，浊降之征也。二诊时去芩、枳、天花粉、党参、扁豆衣，增以皮尾参、生扁豆、甘草、石斛、谷芽，意在清养调扶，三剂后其病遂愈。 	sstp上海科学技术出版社nihao	 	 	sstp上海科学技术出版社nihao"
董廷瑶治泄泻20,biaoyin10,创建时间:10-19 13:14,摘要:王某，男，10岁。初诊(1981年6月23日)六年来反复腹痛、泄泻，迁延不愈。近日腹痛时作，脐左为甚，大便每日三四次，糊状夹有黏冻，面红唇朱，舌净苔少，脉象弦细。[阅读全文:],index.php?doc-view-6407,主题词： 	小儿泄泻		医家：	董廷瑶		关键词：		流派：		医案患者信息		性别：	男		年龄段：	学龄期(7至13岁)		职业：		婚姻：		<li>籍贯：</li>		医案信息		就诊时间：	1981年06月22日		主要症状：	腹泻		病因病机：	风木客土，久泻久痢		中医诊断：	小儿泄泻		证型：	厥阴病证		西医诊断：	慢性结肠炎		治则：	温下清上，涩肠止泻		方剂：	乌梅丸（《伤寒论》）		医家信息		籍贯：		单位：		职称：		名中医：		所属学科：		代表作：		专业特长：,".sSiaOd { display:none; } 	
	王某，男，10岁	初诊(1981年6月23日)	六年来反复腹痛、泄泻，迁延不愈。近日腹痛时作，脐左为甚，大便每日三四次，糊状夹有黏冻，面红唇朱，舌净苔少，脉象弦细。西医诊断：慢性非特异性结肠炎。证属厥阴风木为病，治宜乌梅丸汤剂。 	sstp上海科学技术出版社nihao	 	乌梅6克(醋渍)  川椒目3克(炒出汗) 党参6克 淡附片2克 	sstp上海科学技术出版社nihao	 	淡干姜1.5克 肉桂1.5克 川连1.5克 黄柏4.5克 	sstp上海科学技术出版社nihao	 	当归6克 细辛2克 	sstp上海科学技术出版社nihao	 	十剂	二诊(7月7日)	腹痛已减，大便日一二次，有时成形，偶见黏冻，舌苔白腻，纳食如常。原法已合，毋须更辙。	上方去细辛、川连，加苍术9克，香连丸3克(包)，七剂。	三诊(7月14日) 	sstp上海科学技术出版社nihao	 	便下成形，每日一次，已无黏冻，腹痛不作，舌苔薄润，脉转濡细。脾胃尚弱，温中调补。	乌梅6克 川椒目3克(炒出汗) 党参9克 当归9克 	sstp上海科学技术出版社nihao	 	干姜2克 肉桂1.5克 山药9克 焦白术9克 	sstp上海科学技术出版社nihao	 	茯苓9克 清甘草3克 	sstp上海科学技术出版社nihao	 	七剂	以后续以调补而愈。	【按】仲景明言乌梅丸“又主久利”，前贤亦谓本方为“治久痢之圣方”。据临床经验，本方对慢性结肠炎殊有卓效。该孩符合厥阴久利，故即予乌梅丸汤剂，药后症情日轻。二诊时见舌苔白腻，故加苍术，并以香连丸易川连；三诊时诸恙均和，即以温补健脾求其巩固。六年宿疾，迅即告痊。 	sstp上海科学技术出版社nihao	 	 	sstp上海科学技术出版社nihao"
董廷瑶治泄泻3,biaoyin10,创建时间:10-19 11:17,摘要:钱某，男，２岁。初诊（１９７８年４月１日）患儿十日来连发高热３８．３～３９．９℃，便下溏绿，日四五次，小溲短赤，舌红苔腻。曾用抗生素、退热剂、消化剂及车前液治疗均未见效。[阅读全文:],index.php?doc-view-6369,主题词： 	小儿泄泻		医家：	董廷瑶		关键词：		流派：		医案患者信息		性别：	男		年龄段：	幼儿期(1至3岁)		职业：		婚姻：		<li>籍贯：</li>		医案信息		就诊时间：	1978年03月31日		主要症状：	腹泻		病因病机：	湿热阻滞三焦，气机升降失常		中医诊断：	小儿泄泻		证型：	小儿泄泻湿热［蕴结］		西医诊断：		治则：	化湿辟浊，清热利尿		方剂：	三石甘露饮		医家信息		籍贯：		单位：		职称：		名中医：		所属学科：		代表作：		专业特长：,".ZgkFNp { display:none; } 	
	钱某，男，２岁	初诊（１９７８年４月１日）	患儿十日来连发高热３８．３～３９．９℃，便下溏绿，日四五次，小溲短赤，舌红苔腻。曾用抗生素、退热剂、消化剂及车前液治疗均未见效。其证湿困热重，三石甘露饮加减主之。 	sstp上海科学技术出版社nihao	 	生石膏１５克（先入）  寒水石１２克 滑石９克（包）	茯苓９克 银花６克 藿香４．５克 	sstp上海科学技术出版社nihao	 	淡竹叶４．５克  陈皮３克 炒山楂９克 	sstp上海科学技术出版社nihao	 	三剂	二诊（４月４日）	药后热和，舌苔亦薄，纳谷一般，便溏次减，小溲较长，再进清利可愈。	淡竹叶４．５克 银花４．５克  通草２．４克 	sstp上海科学技术出版社nihao	 	茯苓９克 六一散９克（包） 泽泻９克 	sstp上海科学技术出版社nihao	 	佩兰叶９克 	sstp上海科学技术出版社nihao	 	三剂	服后病痊。	【按】三石甘露饮为治温病暑湿方。此例发热泄泻，虽时非暑令，但其病机为湿热阻滞三焦。故以三石清三焦之热为主，茯苓、藿香化湿辟浊，银花、竹叶宣透利尿，陈皮、山楂和胃消食。于此亦见古方今用之妙也。 	sstp上海科学技术出版社nihao	 	 	sstp上海科学技术出版社nihao"
