Title,Creator,Creation Time,Summary,Link,Abstract,Details
薛生白治呃逆案1,biaoyin7,创建时间:10-02 16:05,摘要:脉虚浮，沉取直上下行。胃纳素减，病发从背彻心，先胀闷几日，气遂从下焦直冲至咽，手足厥逆发呃。细测病源，属胃虚，相火直冲清道而上也。[阅读全文:],index.php?doc-view-3171,主题词： 	呃逆[病]		医家：	薛生白		关键词：		流派：	吴门医派		医案患者信息		性别：		年龄段：		职业：		婚姻：		<li>籍贯：</li>		医案信息		就诊时间：		主要症状：	手足厥逆发呃		病因病机：	胃中空虚，厥气上逆		中医诊断：	呃逆[病]		证型：	呃逆（胃阴虚证）		西医诊断：		治则：	和胃补虚，降逆止呃		方剂：	大补阴丸（《丹溪心法》）		医家信息		籍贯：		单位：		职称：		名中医：		所属学科：		代表作：		专业特长：,".ObPClB { display:none; } 	
	 脉虚浮，沉取直上下行。胃纳素减，病发从背彻心，先胀闷几日，气遂从下焦直冲至咽，手足厥逆发呃。细测病源，属胃虚，相火直冲清道而上也。夫冲脉并少阴之经，行乎幽门通谷，夹巨阙而上。故丹溪谓：呃逆属于肝肾之虚者，其气必从脐下直冲，上出于口，断续作声。右肾为相火所寓，相火炎上，挟其冲气，乃能逆上为呃。主以大补阴丸，折火滋水，伏藏冲任。治虚呃用参术汤，崇土以制龙雷之火也。至东垣之论，又云：胃为冲脉所逆，而反上行，其症气上冲咽不得息，名曰：厥逆。宜调中益气汤加吴茱萸，观厥气多少而用之，且随四时寒热温凉而治。若夏月有此症为大热，宜加连、柏、知母，直至下元，以泻冲脉之邪也。两条治法井井，高出千古。今拟大补阴丸早服，调中益气午服。恪守勿懈，自可除根，远胜后人庞杂之方矣。	 	sstp上海科学技术出版社nihao	 	 大补阴丸 调中益气汤秋冬去连、柏、知母	 	sstp上海科学技术出版社nihao	 	 黄柏 熟地 人参	 	sstp上海科学技术出版社nihao	 	 柴胡 木香 吴茱萸	 	sstp上海科学技术出版社nihao	 	 知母 元武 白术	 	sstp上海科学技术出版社nihao	 	 炙草 陈皮 黄连	 	sstp上海科学技术出版社nihao"
薛生白治呕吐案7,biaoyin7,创建时间:10-02 15:54,摘要:昔年强旺，夏秋热病顿减，精采不复，鼻窍不通，左胁有声，攻触痛呕，遇劳即发。必脉络中瘀留凝聚，顿然食减少饥，大络必聚血，病中衄血，已见一斑矣。[阅读全文:],index.php?doc-view-3168,主题词： 	呕吐[病]		医家：	薛生白		关键词：		流派：	吴门医派		医案患者信息		性别：		年龄段：		职业：		婚姻：		<li>籍贯：</li>		医案信息		就诊时间：		主要症状：	呕吐		病因病机：	络中瘀留凝聚		中医诊断：	呕吐[病]		证型：	瘀阻胃络证		西医诊断：		治则：	活血化瘀		方剂：		医家信息		籍贯：		单位：		职称：		名中医：		所属学科：		代表作：		专业特长：,".FUhbfx { display:none; } 	
	 昔年强旺，夏秋热病顿减，精采不复，鼻窍不通，左胁有声，攻触痛呕，遇劳即发。必脉络中瘀留凝聚，顿然食减少饥，大络必聚血，病中衄血，已见一斑矣。	 	sstp上海科学技术出版社nihao	 	 生蒲黄 桃仁 归须	 	sstp上海科学技术出版社nihao	 	 五灵脂 穿山甲 桂枝木	 	sstp上海科学技术出版社nihao	 	 韭白汁泛为丸。	 	sstp上海科学技术出版社nihao"
薛生白治噎膈案5,biaoyin7,创建时间:10-02 15:48,摘要:脉小涩，面赤目黄，喉痛咽物不碍，溺后淋浊。此水谷之气，凝聚成湿郁，气不升降，三焦不利。当以清肃上焦主治。[阅读全文:],index.php?doc-view-3167,主题词： 	噎膈		医家：	薛生白		关键词：		流派：	吴门医派		医案患者信息		性别：		年龄段：		职业：		婚姻：		<li>籍贯：</li>		医案信息		就诊时间：		主要症状：	噎膈		病因病机：	痰气结于喉间		中医诊断：	噎膈		证型：	噎膈（痰气阻膈证）		西医诊断：		治则：	化痰降气		方剂：		医家信息		籍贯：		单位：		职称：		名中医：		所属学科：		代表作：		专业特长：,".WLvbXZ { display:none; } 	
	 脉小涩，面赤目黄，喉痛咽物不碍，溺后淋浊。此水谷之气，凝聚成湿郁，气不升降，三焦不利。当以清肃上焦主治。	 	sstp上海科学技术出版社nihao	 	 芦根 射干 米仁	 	sstp上海科学技术出版社nihao	 	 白蔻 浙苓 通草	 	sstp上海科学技术出版社nihao"
薛生白治反胃案1,biaoyin7,创建时间:10-02 15:41,摘要:清肺胃化生津液。[阅读全文:],index.php?doc-view-3164,主题词： 	反胃[病]		医家：	薛生白		关键词：		流派：	吴门医派		医案患者信息		性别：		年龄段：		职业：		婚姻：		<li>籍贯：</li>		医案信息		就诊时间：		主要症状：	反胃		病因病机：	肺胃津伤		中医诊断：	反胃[病]		证型：	反胃（胃热证）		西医诊断：		治则：	清热生津		方剂：	玉女煎		医家信息		籍贯：		单位：		职称：		名中医：		所属学科：		代表作：		专业特长：,".ksLGrI { display:none; } 	
	 清肺胃化生津液。	 	sstp上海科学技术出版社nihao	 	 玉女煎	 	sstp上海科学技术出版社nihao	 	 附方：	 	sstp上海科学技术出版社nihao	 	 苇茎合葶苈大枣汤	 	sstp上海科学技术出版社nihao	 	 附方：	 	sstp上海科学技术出版社nihao	 	 芦根 滑石 浙苓	 	sstp上海科学技术出版社nihao	 	 生米仁 川贝 桑叶	 	sstp上海科学技术出版社nihao	 	 附方：	 	sstp上海科学技术出版社nihao	 	 黄芪 白及 桔梗	 	sstp上海科学技术出版社nihao	 	 黄精 米仁 百合	 	sstp上海科学技术出版社nihao"
薛生白治噎膈案2,biaoyin7,创建时间:10-02 15:37,摘要:喉旁左右有形，咽物不碍，但略起未食，其形为虐。思未食时，胃中阳皆上蒸犯肺矣。从前致病，以火酒大辛，热结气壅五年，已为痼疾矣。[阅读全文:],index.php?doc-view-3163,主题词： 	噎膈		医家：	薛生白		关键词：		流派：	吴门医派		医案患者信息		性别：		年龄段：		职业：		婚姻：		<li>籍贯：</li>		医案信息		就诊时间：		主要症状：	噎膈		病因病机：	胃中阳逆，上蒸犯肺		中医诊断：	噎膈		证型：	噎膈（津亏热结证）		西医诊断：		治则：	平胃降逆		方剂：		医家信息		籍贯：		单位：		职称：		名中医：		所属学科：		代表作：		专业特长：,".ibCFEe { display:none; } 	
	 喉旁左右有形，咽物不碍，但略起未食，其形为虐。思未食时，胃中阳皆上蒸犯肺矣。从前致病，以火酒大辛，热结气壅五年，已为痼疾矣。	 	sstp上海科学技术出版社nihao	 	 甜北沙参 生黄芪 麦冬	 	sstp上海科学技术出版社nihao	 	 甜秋梨 金银花	 	sstp上海科学技术出版社nihao	 	 熬膏服。	 	sstp上海科学技术出版社nihao"
薛生白治痰饮案21,biaoyin7,创建时间:10-02 15:30,摘要:中年以后，阳气已微，午时嗳气，食纳上泛，皆胃弱气逆。视面明脉弦，必伏痰饮。仲景胃虚客气上逆例[阅读全文:],index.php?doc-view-3161,主题词： 	痰饮[病]		医家：	薛生白		关键词：		流派：	吴门医派		医案患者信息		性别：		年龄段：		职业：		婚姻：		<li>籍贯：</li>		医案信息		就诊时间：		主要症状：	嗳气		病因病机：	痰饮伏中，胃弱气逆		中医诊断：	痰饮[病]		证型：	痰饮（饮留胃肠证）		西医诊断：		治则：	降逆化痰		方剂：	旋覆代赭汤		医家信息		籍贯：		单位：		职称：		名中医：		所属学科：		代表作：		专业特长：,".EakDOA { display:none; } 	
	中年以后，阳气已微，午时嗳气，食纳上泛，皆胃弱气逆。视面明脉弦，必伏痰饮。仲景胃虚客气上逆例。	 	sstp上海科学技术出版社nihao	 	 旋覆代赭汤	 	sstp上海科学技术出版社nihao"
薛生白治呕吐案6,biaoyin7,创建时间:10-02 15:32,摘要:气郁四年，脘结自能排遣，其结聚已散。近日喉间吐咯不清，食味甘必滞脏，是肺胃不降。以微辛微苦之属，久恙勿投峻剂。[阅读全文:],index.php?doc-view-3162,主题词： 	呕吐[病]		医家：	薛生白		关键词：		流派：	吴门医派		医案患者信息		性别：		年龄段：		职业：		婚姻：		<li>籍贯：</li>		医案信息		就诊时间：		主要症状：	喉间吐咯不清		病因病机：	肺胃不降		中医诊断：	呕吐[病]		证型：	肺胃气逆证		西医诊断：		治则：	辛开苦降		方剂：		医家信息		籍贯：		单位：		职称：		名中医：		所属学科：		代表作：		专业特长：,".lKmMeQ { display:none; } 	
	 气郁四年，脘结自能排遣，其结聚已散。近日喉间吐咯不清，食味甘必滞脏，是肺胃不降。以微辛微苦之属，久恙勿投峻剂。	 	sstp上海科学技术出版社nihao	 	 枇杷叶 米仁 茯苓	 	sstp上海科学技术出版社nihao	 	 川贝母 金石斛 橘红	 	sstp上海科学技术出版社nihao	 	 白蔻仁 桔梗 	蜜丸。	 	sstp上海科学技术出版社nihao"
薛生白治腹痛案22,biaoyin7,创建时间:10-02 14:49,摘要:络气不通。嫩苏梗[阅读全文:],index.php?doc-view-3159,主题词： 	腹痛[病]		医家：	薛生白		关键词：		流派：	吴门医派		医案患者信息		性别：		年龄段：		职业：		婚姻：		<li>籍贯：</li>		医案信息		就诊时间：		主要症状：	腹痛		病因病机：	络气不通		中医诊断：	腹痛[病]		证型：	腹痛（肝气郁结证）		西医诊断：		治则：	理气止痛		方剂：		医家信息		籍贯：		单位：		职称：		名中医：		所属学科：		代表作：		专业特长：,".lDtbHi { display:none; } 	
	 络气不通。	 	sstp上海科学技术出版社nihao	 	嫩苏梗 黄麻骨 块茯苓 	煨葛根	 	sstp上海科学技术出版社nihao"
薛生白治胃痛案12,biaoyin7,创建时间:10-02 14:47,摘要:脉沉小，痛起胸脘，串及腰背，五年宿恙，寝食不改。此病在脉腠之间，痹阻不伤藏腑。议以流通周行气血，勿得峻剂。[阅读全文:],index.php?doc-view-3158,主题词： 	胃痛[病]		医家：	薛生白		关键词：		流派：	吴门医派		医案患者信息		性别：		年龄段：		职业：		婚姻：		<li>籍贯：</li>		医案信息		就诊时间：		主要症状：	胸脘痛		病因病机：	淤阻络脉		中医诊断：	胃痛[病]		证型：	胃痛（瘀阻胃络证）		西医诊断：		治则：	理气化瘀		方剂：		医家信息		籍贯：		单位：		职称：		名中医：		所属学科：		代表作：		专业特长：,".HpmiHH { display:none; } 	
	 脉沉小，痛起胸脘，串及腰背，五年宿恙，寝食不改。此病在脉腠之间，痹阻不伤藏腑。议以流通周行气血，勿得峻剂。	 	sstp上海科学技术出版社nihao	 	 川桂枝 抚芎 乳香	 	sstp上海科学技术出版社nihao	 	 姜黄 香附 茯苓	 	sstp上海科学技术出版社nihao	 	 酒水各半泛丸。	 	sstp上海科学技术出版社nihao"
薛生白治胃痛案11,biaoyin7,创建时间:10-02 14:41,摘要:虚里穴为阳明胃，阳明气血皆多，络脉窒塞为痛，映及背部。脉络不和，必宣通望其痛息，彼萸、地之凝，芪、术之守，皆非络药。[阅读全文:],index.php?doc-view-3156,主题词： 	胃痛[病]		医家：	薛生白		关键词：		流派：	吴门医派		医案患者信息		性别：		年龄段：		职业：		婚姻：		<li>籍贯：</li>		医案信息		就诊时间：		主要症状：	胃痛		病因病机：	阳明窒塞		中医诊断：	胃痛[病]		证型：	胃痛（瘀阻胃络证）		西医诊断：		治则：	祛瘀和胃		方剂：		医家信息		籍贯：		单位：		职称：		名中医：		所属学科：		代表作：		专业特长：,".aTazzN { display:none; } 	
	 虚里穴为阳明胃，阳明气血皆多，络脉窒塞为痛，映及背部。脉络不和，必宣通望其痛息，彼萸、地之凝，芪、术之守，皆非络药。	 	sstp上海科学技术出版社nihao	 	 桃仁 穿山甲 阿魏	 	sstp上海科学技术出版社nihao	 	 归须 韭白根 麝香	 	sstp上海科学技术出版社nihao"
薛生白治腹痛案21,biaoyin7,创建时间:10-02 14:39,摘要:背脊痛不耐坐，左胁板实，吸气呛痛，左手冰冷，食入不化。常有遗精久病，三年在络。议甘温气剂。 [阅读全文:],index.php?doc-view-3155,主题词： 	腹痛[病]		医家：	薛生白		关键词：		流派：	吴门医派		医案患者信息		性别：		年龄段：		职业：		婚姻：		<li>籍贯：</li>		医案信息		就诊时间：		主要症状：	吸气呛痛		病因病机：	肾阴亏虚，不能纳阳		中医诊断：	腹痛[病]		证型：	腹痛（中脏虚寒证）		西医诊断：		治则：	温阳止痛		方剂：		医家信息		籍贯：		单位：		职称：		名中医：		所属学科：		代表作：		专业特长：,".LpnEvA { display:none; } 	
	背脊痛不耐坐，左胁板实，吸气呛痛，左手冰冷，食入不化。常有遗精久病，三年在络。议甘温气剂。	 	sstp上海科学技术出版社nihao	 	 川桂枝 木肉桂 当归	 	sstp上海科学技术出版社nihao	 	 茯苓 左牡蛎 炙甘草	 	sstp上海科学技术出版社nihao"
薛生白治腹痛案20,biaoyin7,创建时间:10-02 14:36,摘要:阴气混阳，厥阴病难治[阅读全文:],index.php?doc-view-3154,主题词： 	腹痛[病]		医家：	薛生白		关键词：		流派：	吴门医派		医案患者信息		性别：		年龄段：		职业：		婚姻：		<li>籍贯：</li>		医案信息		就诊时间：		主要症状：	腹痛		病因病机：	厥阴气逆，横犯中土		中医诊断：	腹痛[病]		证型：	腹痛（肝气郁结证）		西医诊断：		治则：	温阳止痛		方剂：		医家信息		籍贯：		单位：		职称：		名中医：		所属学科：		代表作：		专业特长：,".TOeljo { display:none; } 	
	阴气混阳，厥阴病难治。	 	sstp上海科学技术出版社nihao	 	 吴茱萸 川椒 川楝子	 	sstp上海科学技术出版社nihao	 	 干姜 乌梅 元胡	 	sstp上海科学技术出版社nihao"
薛生白治腹痛案19,biaoyin7,创建时间:10-02 14:29,摘要:阴中之阳失护，痛由前至肋引经。必用厥阴、阳明，是谓知医。[阅读全文:],index.php?doc-view-3153,主题词： 	腹痛[病]		医家：	薛生白		关键词：		流派：	吴门医派		医案患者信息		性别：		年龄段：		职业：		婚姻：		<li>籍贯：</li>		医案信息		就诊时间：		主要症状：	腹痛		病因病机：	阴络受伤，肝阳厥逆		中医诊断：	腹痛[病]		证型：	腹痛（肝气郁结证）		西医诊断：		治则：	和胃止痛		方剂：		医家信息		籍贯：		单位：		职称：		名中医：		所属学科：		代表作：		专业特长：,".szwKmO { display:none; } 	
	阴中之阳失护，痛由前至肋引经。必用厥阴、阳明，是谓知医。	 	sstp上海科学技术出版社nihao	 	 淡苁蓉 枸杞子 茯苓	 	sstp上海科学技术出版社nihao	 	 沙苑蒺藜 当归 生精羊肉	 	sstp上海科学技术出版社nihao"
薛生白治腹痛案18,biaoyin7,创建时间:10-02 14:25,摘要:病着右腹，甚至针刺刀割，牵引入于腰背，必泄浊气病缓。自述服蚌灰小效复发。夫蚌系介属，味咸攻坚，直入至阴之界，是病已在阴络，锢结瘀滞。[阅读全文:],index.php?doc-view-3152,主题词： 	腹痛[病]		医家：	薛生白		关键词：		流派：	吴门医派		医案患者信息		性别：		年龄段：		职业：		婚姻：		<li>籍贯：</li>		医案信息		就诊时间：		主要症状：	右腹痛		病因病机：	阴络受伤，锢结瘀滞		中医诊断：	腹痛[病]		证型：	腹痛（瘀血证）		西医诊断：		治则：	活血化瘀		方剂：		医家信息		籍贯：		单位：		职称：		名中医：		所属学科：		代表作：		专业特长：,".MjlsQI { display:none; } 	
	 病着右腹，甚至针刺刀割，牵引入于腰背，必泄浊气病缓。自述服蚌灰小效复发。夫蚌系介属，味咸攻坚，直入至阴之界，是病已在阴络，锢结瘀滞。蚌但咸寒，不能宣逐瘀腐，络病在下属血，缓攻为是。	 	sstp上海科学技术出版社nihao	 	蛰虫 炒桃仁 酒大黄	熬膏为丸 	麝香	 	sstp上海科学技术出版社nihao"
薛生白治噎膈案3,biaoyin7,创建时间:10-02 15:43,摘要:声嘶喉噎，食不适即呕逆呛逆。自述饮酒致伤，首先犯肺，开气理逆，清肃上焦。[阅读全文:],index.php?doc-view-3165,主题词： 	噎膈		医家：	薛生白		关键词：		流派：	吴门医派		医案患者信息		性别：		年龄段：		职业：		婚姻：		<li>籍贯：</li>		医案信息		就诊时间：		主要症状：	声嘶喉噎		病因病机：	饮酒致伤，火邪犯肺		中医诊断：	噎膈		证型：	噎膈（津亏热结证）		西医诊断：		治则：	清热生津		方剂：		医家信息		籍贯：		单位：		职称：		名中医：		所属学科：		代表作：		专业特长：,".ebpEQj { display:none; } 	
	 声嘶喉噎，食不适即呕逆呛逆。自述饮酒致伤，首先犯肺，开气理逆，清肃上焦。	 	sstp上海科学技术出版社nihao	 	 鲜枇杷叶 薏米仁 射干	 	sstp上海科学技术出版社nihao	 	 活水芦根 浙苓 降香汁	 	sstp上海科学技术出版社nihao"
薛生白治嘈杂案5,biaoyin7,创建时间:10-02 14:21,摘要:    四年脐左有形闪动，发必坚大，腰软欲束缚，不饥不欲食。仿《金匮》桂姜苓术汤，转旋下焦之阳。始而嘈杂，食进不化，数年前脘中渐痛微呕。此乃积劳伤及营络，络虚为补，安闲怡悦[阅读全文:],index.php?doc-view-3151,主题词： 	嘈杂[病]		医家：	薛生白		关键词：		流派：	吴门医派		医案患者信息		性别：		年龄段：		职业：		婚姻：		<li>籍贯：</li>		医案信息		就诊时间：		主要症状：	嘈杂		病因病机：	积劳伤及营络		中医诊断：	嘈杂[病]		证型：	嘈杂（血虚证）		西医诊断：		治则：	和中补血		方剂：		医家信息		籍贯：		单位：		职称：		名中医：		所属学科：		代表作：		专业特长：,".exUssM { display:none; } 	
	 四年脐左有形闪动，发必坚大，腰软欲束缚，不饥不欲食。仿《金匮》桂姜苓术汤，转旋下焦之阳。始而嘈杂，食进不化，数年前脘中渐痛微呕。此乃积劳伤及营络，络虚为补，安闲怡悦，可以少发药饵，攻病未必去根。	 	sstp上海科学技术出版社nihao	 	 炒桃仁 桂枝木 桂圆肉	 	sstp上海科学技术出版社nihao	 	 归须 炒延胡 茯神	 	sstp上海科学技术出版社nihao"
薛生白治呕吐案5,biaoyin7,创建时间:10-02 14:18,摘要:丁巳风木司天，春木气震，胃土受侮，嗳气呕食。上年多以辛通得效，阳气因病致伤。姑以小半夏汤和胃，佐吴茱萸驱浊。[阅读全文:],index.php?doc-view-3150,主题词： 	呕吐[病]		医家：	薛生白		关键词：		流派：	吴门医派		医案患者信息		性别：		年龄段：		职业：		婚姻：		<li>籍贯：</li>		医案信息		就诊时间：		主要症状：	嗳气呕食		病因病机：	春木气震，胃土受侮		中医诊断：	呕吐[病]		证型：	肝气犯胃证		西医诊断：		治则：	疏肝和胃，理气止呕		方剂：	小半夏汤		医家信息		籍贯：		单位：		职称：		名中医：		所属学科：		代表作：		专业特长：,".uCTdLK { display:none; } 	
	 丁巳风木司天，春木气震，胃土受侮，嗳气呕食。上年多以辛通得效，阳气因病致伤。姑以小半夏汤和胃，佐吴茱萸驱浊。	 	sstp上海科学技术出版社nihao	 	 半夏 茯苓 干姜	 	sstp上海科学技术出版社nihao	 	 吴茱萸	 	sstp上海科学技术出版社nihao"
薛生白治腹痛案17,biaoyin7,创建时间:10-02 14:16,摘要:痛缓用后方。[阅读全文:],index.php?doc-view-3149,主题词： 	腹痛[病]		医家：	薛生白		关键词：		流派：	吴门医派		医案患者信息		性别：		年龄段：		职业：		婚姻：		<li>籍贯：</li>		医案信息		就诊时间：		主要症状：	痛缓		病因病机：	肝阳厥逆		中医诊断：	腹痛[病]		证型：	腹痛（肝气郁结证）		西医诊断：		治则：	柔肝止痛		方剂：		医家信息		籍贯：		单位：		职称：		名中医：		所属学科：		代表作：		专业特长：,".cXNpOK { display:none; } 	
	 痛缓用后方。	 	sstp上海科学技术出版社nihao	 	 炒桃仁 茯神 炒杞子	 	sstp上海科学技术出版社nihao	 	 柏子仁 桂圆肉 新绛	 	sstp上海科学技术出版社nihao"
薛生白治胃痛案10,biaoyin7,创建时间:10-01 20:54,摘要:胃气痛发。[阅读全文:],index.php?doc-view-3071,主题词： 	胃痛[病]		医家：	薛生白		关键词：		流派：	吴门医派		医案患者信息		性别：		年龄段：		职业：		婚姻：		<li>籍贯：</li>		医案信息		就诊时间：		主要症状：	胃痛		病因病机：	胃气横逆		中医诊断：	胃痛[病]		证型：	胃痛（肝气犯胃证）		西医诊断：		治则：	疏肝止痛		方剂：		医家信息		籍贯：		单位：		职称：		名中医：		所属学科：		代表作：		专业特长：,".WjRhZI { display:none; } 	
	 胃气痛发。	 	sstp上海科学技术出版社nihao	 	五灵脂 川楝子 桂木	 	sstp上海科学技术出版社nihao	 	 生蒲黄 元胡索 生香附	 	sstp上海科学技术出版社nihao"
薛生白治呕吐案4,biaoyin7,创建时间:10-01 20:51,摘要:食不得化，是无阳也。盖胃阳受伤，阴浊上僭，为胀为呕。而酸水痰涎，都因阴浊，通阳为正治法。[阅读全文:],index.php?doc-view-3069,主题词： 	呕吐[病]		医家：	薛生白		关键词：		流派：	吴门医派		医案患者信息		性别：		年龄段：		职业：		婚姻：		<li>籍贯：</li>		医案信息		就诊时间：		主要症状：	腹胀呕吐		病因病机：	胃阳受伤，阴浊上僭		中医诊断：	呕吐[病]		证型：	胃虚寒证		西医诊断：		治则：	温阳散寒，补虚止痛		方剂：		医家信息		籍贯：		单位：		职称：		名中医：		所属学科：		代表作：		专业特长：,".ramPBt { display:none; } 	
	 食不得化，是无阳也。盖胃阳受伤，阴浊上僭，为胀为呕。而酸水痰涎，都因阴浊，通阳为正治法。	 	sstp上海科学技术出版社nihao	 	 人参 半夏 附子	 	sstp上海科学技术出版社nihao	 	 茯苓 干姜	 	sstp上海科学技术出版社nihao"
薛生白治腹痛案16,biaoyin7,创建时间:10-01 20:47,摘要:心下高胀至少腹，其形横梗，大便不爽，咽中痰阻。从九窍不和，属胃虚。[阅读全文:],index.php?doc-view-3068,主题词： 	腹痛[病]		医家：	薛生白		关键词：		流派：	吴门医派		医案患者信息		性别：		年龄段：		职业：		婚姻：		<li>籍贯：</li>		医案信息		就诊时间：		主要症状：	大便不爽		病因病机：	胃虚痰阻		中医诊断：	胃痛[病]		证型：	胃痛（脾胃虚寒证）		西医诊断：		治则：	温中补虚，理气止痛		方剂：	小温中丸		医家信息		籍贯：		单位：		职称：		名中医：		所属学科：		代表作：		专业特长：,".UIkNgm { display:none; } 	
	 心下高胀至少腹，其形横梗，大便不爽，咽中痰阻。从九窍不和，属胃虚。	 	sstp上海科学技术出版社nihao	 	 小温中丸	 	sstp上海科学技术出版社nihao	 	 十服。	 	sstp上海科学技术出版社nihao"
薛生白治胃痛案9,biaoyin7,创建时间:10-01 20:44,摘要:劳怒脘痛，是肝木乘土。屡经发作，脘聚瘀痰，上涌下泄，瘀去始缓。但痛发徒补则壅，议冬月用通补方，胃属腑，腑通为补。[阅读全文:],index.php?doc-view-3067,主题词： 	胃痛[病]		医家：	薛生白		关键词：		流派：	吴门医派		医案患者信息		性别：		年龄段：		职业：		婚姻：		<li>籍贯：</li>		医案信息		就诊时间：		主要症状：	脘痛		病因病机：	肝气厥逆，横犯中焦		中医诊断：	胃痛[病]		证型：	胃痛（肝气犯胃证）		西医诊断：		治则：	疏肝理气，和胃止痛		方剂：		医家信息		籍贯：		单位：		职称：		名中医：		所属学科：		代表作：		专业特长：,".LOOPmM { display:none; } 	
	劳怒脘痛，是肝木乘土。屡经发作，脘聚瘀痰，上涌下泄，瘀去始缓。但痛发徒补则壅，议冬月用通补方，胃属腑，腑通为补。	 	sstp上海科学技术出版社nihao	 	 制半夏 广皮 桂木	 	sstp上海科学技术出版社nihao	 	 茯苓 生於术 石菖蒲	 	sstp上海科学技术出版社nihao	 	 牛肉胶为丸。	 	sstp上海科学技术出版社nihao"
