Title,Creator,Creation Time,Summary,Link,Abstract,Details
陆渊雷治腹痛病案3,biaoyin2,创建时间:08-31 10:52,摘要:袁老太太初诊 八十高年，平时大便难，得泻盐始行一次，改服燕医生补丸，致腹痛。小便至今涩小，今胸腹满闷，恐是肝脾肿，噫与下气俱不行。脉弱舌白。[阅读全文:],index.php?doc-view-1686,主题词： 	腹痛[病]		医家：	陆渊雷		关键词：		流派：	海派（中医恽氏中西医汇通）		医案患者信息		性别：	女		年龄段：	70岁以上		职业：		婚姻：	已婚		<li>籍贯：</li>		医案信息		就诊时间：		主要症状：	腹痛，胸腹满闷		病因病机：	肾阳亏虚，气血不足		中医诊断：	腹痛[病]		证型：	腹痛（气虚证）		西医诊断：		治则：	补肾益气，养血通便		方剂：		医家信息		籍贯：		单位：		职称：		名中医：		所属学科：		代表作：		专业特长：,".OOEaIB { display:none; } 	
	袁老太太	 	sstp上海科学技术出版社nihao	 	初诊 八十高年，平时大便难，得泻盐始行一次，改服燕医生补丸，致腹痛。小便至今涩小，今胸腹满闷，恐是肝脾肿，噫与下气俱不行。脉弱舌白。	 	sstp上海科学技术出版社nihao	 	人参须	9	克	（另煎冲）	 	当归	9	克	 	莪术	6	克	 	sstp上海科学技术出版社nihao	 	木通	3	克	 	黑附块	6	克	 	生白术	6	克	 	sstp上海科学技术出版社nihao	 	干蟾皮	4.5	克	 	陈皮	6	克	 	淡苁蓉	12	克	 	sstp上海科学技术出版社nihao	 	三棱	6	克	 	制香附	6	克	 	sstp上海科学技术出版社nihao	 	【	按	】	燕医生补丸：民国时期上海比较流行的一种自称可以清洁肠道，排除毒素，解除便秘的保健品。	 	sstp上海科学技术出版社nihao	 	患者八十多岁，平素大便即难，属于老年习惯性便秘，肾阳亏虚，气血不足，气机不畅证。陆氏以人参、白术、陈皮等药大补元气，健运脾胃；附子、肉苁蓉、当归温阳养血通便；木通、干蟾皮清热解毒，利水消胀，通小便，去肝脾肿胀；三棱、莪术、香附行气通导，利大便。诸药共奏补肾益气，养血通便，利水消胀之功效。文中特别提出曾服通便保健品燕医生补丸致腹痛一事，可以作为今日滥用保健品的借鉴。	 	sstp上海科学技术出版社nihao	 		 	sstp上海科学技术出版社nihao"
陆渊雷治腹痛病案2,biaoyin2,创建时间:08-31 10:15,摘要:陈先生  爱文义路普益里四十二号初诊  八月一日胃弱，又执螯引冷，常噫气，大便虽坚，如厕频数。舌胖微黄，内寒已化热，慎食即佳。[阅读全文:],index.php?doc-view-1684,主题词： 	腹痛[病]		医家：	陆渊雷		关键词：		流派：	海派（中医恽氏中西医汇通）		医案患者信息		性别：	男		年龄段：		职业：		婚姻：		<li>籍贯：</li>		医案信息		就诊时间：	1938年07月31日		主要症状：	大便次数多，噫气		病因病机：	饮食不节，寒湿化热		中医诊断：	腹痛[病]		证型：	腹痛（中脏虚寒证）		西医诊断：		治则：	健脾温胃，清热化湿		方剂：	温胆汤		医家信息		籍贯：		单位：		职称：		名中医：		所属学科：		代表作：		专业特长：,".nUcwCL { display:none; } 	
	陈先生 		爱文义路普益里四十二号	 	sstp上海科学技术出版社nihao	 	初诊	 	八月一日	 	sstp上海科学技术出版社nihao	 	胃弱，又执螯引冷，常噫气，大便虽坚，如厕频数。舌胖微黄，内寒已化热，慎食即佳。	 	sstp上海科学技术出版社nihao	 	炒茅术	6	克	  	陈皮	6	克	 	紫苏叶	6	克	 	sstp上海科学技术出版社nihao	 	扁豆	9	克	  	赤小豆	12	克	 	厚朴	3	克	 	sstp上海科学技术出版社nihao	 	炙草	3	克	  	淡黄芩	6	克	 	夏枯草	9	克	 	sstp上海科学技术出版社nihao	 	二诊	 	八月十三日	 	sstp上海科学技术出版社nihao	 	稍稍命驾，或吟咏，辄自觉倦，曾吐痰颇多。食思反增。脉有神，舌胖苔白，是脾家湿，亦致困致泄也。	 	sstp上海科学技术出版社nihao	 	茅、白术各	6	克	 	陈皮	6	克	 	菟丝	9	克	 	sstp上海科学技术出版社nihao	 	枳实	6	克	 	厚朴	6	克	 	姜夏	9	克	 	sstp上海科学技术出版社nihao	 	草果	4.5	克	 	竹茹	9	克	 	云苓	12	克	 	sstp上海科学技术出版社nihao	 	绵仲	9	克	 	制首乌	12	克	 	sstp上海科学技术出版社nihao	 	【	按	】	执螯引冷：即吃螃蟹，伤食寒冷之意。	 	sstp上海科学技术出版社nihao	 	此案患者因食蟹太多而致病。上海地区居民有食大闸蟹的习惯，然螃蟹性寒，对于脾胃本弱者，多食则易致受寒伤食而引起腹痛。本案患者即是如此，至诊病时“内寒已化热”，陆氏以赤小豆、淡黄芩、夏枯草等药清热化湿；以茅苍术、陈皮、紫苏、扁豆、厚朴、炙甘草等药健脾温胃化湿。诸药合奏健脾温胃，清热化湿之功效。二诊在以加陈皮、半夏、枳实、竹茹、茯苓之温胆汤，化痰利湿；苍术、白术、草果健脾温运；菟丝子、杜仲、制首乌补肝肾之虚。陆氏告诫“慎食即佳”。可见日常饮食是养生很需要注意的地方。	 	sstp上海科学技术出版社nihao	 		 	sstp上海科学技术出版社nihao"
陆渊雷治腹痛病案1,biaoyin2,创建时间:08-31 09:30,摘要:刘世兄初诊 食桃五枚，遂绕脐作痛。大便仍通。脉迟，舌苔稍厚。饮水自觉作水声。[阅读全文:],index.php?doc-view-1683,主题词： 	腹痛[病]		医家：	陆渊雷		关键词：		流派：	海派（中医恽氏中西医汇通）		医案患者信息		性别：	男		年龄段：		职业：		婚姻：		<li>籍贯：</li>		医案信息		就诊时间：		主要症状：	腹痛		病因病机：	饮食不慎，气机阻滞		中医诊断：	腹痛[病]		证型：	腹痛（中脏虚寒证）		西医诊断：		治则：	温脾止痛		方剂：		医家信息		籍贯：		单位：		职称：		名中医：		所属学科：		代表作：		专业特长：,".vjglYD { display:none; } 	
	刘世兄	 	sstp上海科学技术出版社nihao	 	初诊 食桃五枚，遂绕脐作痛。大便仍通。脉迟，舌苔稍厚。饮水自觉作水声。	 	sstp上海科学技术出版社nihao	 	干姜	3	克	 	陈皮	9	克	 	桂枝	4.5	克	（后下）	 	sstp上海科学技术出版社nihao	 	延胡	3	克	半	 	姜夏	12	克	 	云苓	15	克	 	sstp上海科学技术出版社nihao	 	木香	2.4	克	（后下）	 	六一散	12	克	（包）	 	sstp上海科学技术出版社nihao	 	【	按	】	本案属于伤食腹痛，是因饮食不慎，气机阻滞所致的腹痛。其证痛甚欲大便，利后痛减。本例患者食桃过多所致的腹痛。	 	sstp上海科学技术出版社nihao	 	桃子具有较强的通瘀泻下的作用，因此脾胃虚弱者不宜多吃，本案患者脾胃素虚，且短时间内食入桃子过多，以致腹痛不适，是值得警醒的。陆氏以桂枝、干姜温脾回阳为主；陈皮、半夏、茯苓取二陈汤之意，化痰健脾；延胡索、木香缓急止痛；六一散祛暑利湿。诸药合奏温脾止痛之功效。	 	sstp上海科学技术出版社nihao	 		 	sstp上海科学技术出版社nihao"
叶天士治疗痰饮病案3,biaoyin3,创建时间:10-22 21:48,摘要:十二月间，诊得阳微浊饮，上干为咳，不能卧，曾用小青龙汤，减去麻黄、细辛，服后已得着枕而卧。想更医接用。不明治饮方法，交惊蛰阳气发泄，病势更炽。顷诊脉来濡弱无神，痰饮咳逆未已，谅非前法可效。宗仲景真武汤法[阅读全文:],index.php?doc-view-7022,主题词： 	痰饮[病]		医家：	叶天士		关键词：		流派：	吴门医派		医案患者信息		性别：		年龄段：		职业：		婚姻：		<li>籍贯：</li>		医案信息		就诊时间：		主要症状：	咳喘不得卧		病因病机：	肾阳衰微，痰饮停肺		中医诊断：	痰饮[病]		证型：	脾肾阳虚证		西医诊断：		治则：	温阳化饮		方剂：	真武汤		医家信息		籍贯：		单位：		职称：		名中医：		所属学科：		代表作：		专业特长：,".nuYqfr { display:none; } 	
	十二月间，诊得阳微浊饮，上干为咳，不能卧，曾用小青龙汤，减去麻黄、细辛，服后已得着枕而卧。想更医接用。不明治饮方法，交惊蛰阳气发泄，病势更炽。顷诊脉来濡弱无神，痰饮咳逆未已，谅非前法可效。宗仲景真武汤法，以熟附配生姜，通阳逐饮立法。	 	sstp上海科学技术出版社nihao	 	 	sstp上海科学技术出版社nihao	 	真武汤去白术加人参	 	sstp上海科学技术出版社nihao"
叶天士治疗痞满病案4,biaoyin3,创建时间:10-24 15:39,摘要:精气内损，是皆脏病。萸、地甘酸，未为背谬。缘清阳先伤于上，柔阴之药，反碍阳气之旋运。食减中痞，显然明白。病人食姜稍舒者，得辛以助阳之用也。至于黄芪、麦冬、枣仁，更蒙上焦，斯为背谬。姑议辛甘理阳可效。[阅读全文:],index.php?doc-view-7302,主题词： 	痞满[病]		医家：	叶天士		关键词：		流派：	吴门医派		医案患者信息		性别：		年龄段：		职业：		婚姻：		<li>籍贯：</li>		医案信息		就诊时间：		主要症状：	食减中痞		病因病机：	饮食不节		中医诊断：	痞满[病]		证型：	痞满（脾胃气虚证）		西医诊断：		治则：	辛甘理阳		方剂：	桂枝汤		医家信息		籍贯：		单位：		职称：		名中医：		所属学科：		代表作：		专业特长：,".jsRytt { display:none; } 	
	精气内损，是皆脏病。萸、地甘酸，未为背谬。缘清阳先伤于上，柔阴之药，反碍阳气之旋运。食减中痞，显然明白。病人食姜稍舒者，得辛以助阳之用也。至于黄芪、麦冬、枣仁，更蒙上焦，斯为背谬。姑议辛甘理阳可效。	 	sstp上海科学技术出版社nihao	 	 	sstp上海科学技术出版社nihao	 	桂枝汤去芍加茯苓	 	sstp上海科学技术出版社nihao"
叶天士治疗痞满病案3,biaoyin3,创建时间:10-24 15:37,摘要:因惊而得，邪遂入肝，故厥后热，神色昏狂。诊得面青舌白，微呕渴饮，胸次按之而痛。此属痞结，乃在里之症。宗仲景以泻心汤为法。[阅读全文:],index.php?doc-view-7301,主题词： 	痞满[病]		医家：	叶天士		关键词：		流派：	吴门医派		医案患者信息		性别：		年龄段：		职业：		婚姻：		<li>籍贯：</li>		医案信息		就诊时间：		主要症状：	微呕渴饮，胸次按之而痛		病因病机：	感受外邪，邪盛入里		中医诊断：	痞满[病]		证型：	虚实夹杂证		西医诊断：		治则：	疏肝解郁，和胃消痞		方剂：	泻心汤		医家信息		籍贯：		单位：		职称：		名中医：		所属学科：		代表作：		专业特长：,".iJprye { display:none; } 	
	因惊而得，邪遂入肝，故厥后热，神色昏狂。诊得面青舌白，微呕渴饮，胸次按之而痛。此属痞结，乃在里之症。宗仲景以泻心汤为法。	 	sstp上海科学技术出版社nihao	 	 	sstp上海科学技术出版社nihao	 	川连	 	半夏	 	干姜	 	黄芩	 	人参	 	枳实	 	sstp上海科学技术出版社nihao"
叶天士治疗痞满病案2,biaoyin3,创建时间:10-24 15:35,摘要:面垢油亮，目眦黄，头胀如束，胸脘痞闷，此暑湿热气内伏，因劳倦正气泄越而发，既非暴受风寒，发散取汗，徒伤阳气。按脉形濡涩，岂是表症?凡伤寒必究六经，伏气须明三焦。论症参脉，壮年已非有余之质，当以劳倦损伤伏[阅读全文:],index.php?doc-view-7300,主题词： 	痞满[病]		医家：	叶天士		关键词：		流派：	吴门医派		医案患者信息		性别：		年龄段：		职业：		婚姻：		<li>籍贯：</li>		医案信息		就诊时间：		主要症状：	胸脘痞闷		病因病机：	暑湿内伏		中医诊断：	痞满[病]		证型：	痞满（湿热中阻证）		西医诊断：		治则：	除湿化痰，理气和中		方剂：		医家信息		籍贯：		单位：		职称：		名中医：		所属学科：		代表作：		专业特长：,".aIxnnp { display:none; } 	
	面垢油亮，目眦黄，头胀如束，胸脘痞闷，此暑湿热气内伏，因劳倦正气泄越而发，既非暴受风寒，发散取汗，徒伤阳气。按脉形濡涩，岂是表症	?	凡伤寒必究六经，伏气须明三焦。论症参脉，壮年已非有余之质，当以劳倦损伤伏邪例诊治。	 	sstp上海科学技术出版社nihao	 	 	sstp上海科学技术出版社nihao	 	滑石	 	黄芩	 	厚朴	 	醋炒半夏	 	杏仁	 	蔻仁	 	竹叶	 	sstp上海科学技术出版社nihao"
叶天士治疗痞满病案1,biaoyin3,创建时间:10-24 15:33,摘要:日前议用辛润下气以治肺痹，谓上焦不行，则下脘不通，古称痞闷多属气分之郁也。两番大便，胸次稍舒，而未为全爽，此岂有形之滞?乃气郁必热，陈腐粘凝胶聚，故脘腹热气下注，隐然微痛。[阅读全文:],index.php?doc-view-7299,主题词： 	痞满[病]		医家：	叶天士		关键词：		流派：	吴门医派		医案患者信息		性别：		年龄段：		职业：		婚姻：		<li>籍贯：</li>		医案信息		就诊时间：		主要症状：	痞闷		病因病机：	内伤饮食		中医诊断：	痞满[病]		证型：	湿热阻胃		西医诊断：		治则：	清热化湿，和胃消痞		方剂：	栀子豉汤		医家信息		籍贯：		单位：		职称：		名中医：		所属学科：		代表作：		专业特长：,".FZTNlR { display:none; } 	
	日前议用辛润下气以治肺痹，谓上焦不行，则下脘不通，古称痞闷多属气分之郁也。两番大便，胸次稍舒，而未为全爽，此岂有形之滞	?	乃气郁必热，陈腐粘凝胶聚，故脘腹热气下注，隐然微痛。法当用仲景栀子豉汤，解其陈腐郁热，暮卧另进白金丸一钱。盖热必生痰，气阻痰滞，一汤一丸，以有形无形之各异也。	 	sstp上海科学技术出版社nihao	 	 	sstp上海科学技术出版社nihao	 	黑山栀	 	郁金	 	香豉	 	桃仁	 	杏仁	 	瓜蒌皮	 	降香	 	白金丸	 	sstp上海科学技术出版社nihao"
叶天士治疗痰饮病案8,biaoyin3,创建时间:10-24 15:29,摘要:病起痰饮，渐为咳嗽外寒，遇劳倦即发，发必胸膈气胀，吐出稀涎浊沫，病退则痰浓，气降乃已。凡饮邪皆阴浊凝聚，两年之久，渐渐腹中痞闷妨食，肛门尻骨，坐则无恙，行动站立，时时气坠，若欲大便。[阅读全文:],index.php?doc-view-7298,主题词： 	痰饮[病]		医家：	叶天士		关键词：		流派：		医案患者信息		性别：		年龄段：		职业：		婚姻：		<li>籍贯：</li>		医案信息		就诊时间：		主要症状：	咳嗽胸膈气胀		病因病机：	肾虚不纳		中医诊断：	痰饮[病]		证型：	脾肾阳虚证		西医诊断：		治则：	温补脾肾		方剂：	肾气丸		医家信息		籍贯：		单位：		职称：		名中医：		所属学科：		代表作：		专业特长：,".twdjJU { display:none; } 	
	病起痰饮，渐为咳嗽外寒，遇劳倦即发，发必胸膈气胀，吐出稀涎浊沫，病退则痰浓，气降乃已。凡饮邪皆阴浊凝聚，两年之久，渐渐腹中痞闷妨食，肛门尻骨，坐则无恙，行动站立，时时气坠，若欲大便。显系肾虚不能收摄，惑于在前见痰治嗽，苟非辛解，即属寒降，乃致养成锢疾。	 	sstp上海科学技术出版社nihao	 	 	sstp上海科学技术出版社nihao	 	肾气汤加紫衣胡桃、沉香汁	 	sstp上海科学技术出版社nihao	 	 	sstp上海科学技术出版社nihao	 	 	sstp上海科学技术出版社nihao"
叶天士治疗痰饮病案7,biaoyin3,创建时间:10-24 15:27,摘要:伏饮阴浊上千，因春地气主升而发，呕吐不饥，自然脾胃受伤。六君子宣补，方法未尝不妙。今诊得吸气甚微，小溲晨通暮癃，足跗浮肿，其腑中之气开阖失司，最虑中满。夫太阳司开，阳明司阖，浊阴弥漫，通腑即是通阳。[阅读全文:],index.php?doc-view-7295,主题词： 	痰饮[病]		医家：	叶天士		关键词：		流派：		医案患者信息		性别：		年龄段：		职业：		婚姻：		<li>籍贯：</li>		医案信息		就诊时间：		主要症状：	浮肿腹胀		病因病机：	伏饮失治		中医诊断：	痰饮[病]		证型：	脾虚水泛证		西医诊断：		治则：	健脾利水		方剂：		医家信息		籍贯：		单位：		职称：		名中医：		所属学科：		代表作：		专业特长：,".MwWGVr { display:none; } 	
	伏饮阴浊上千，因春地气主升而发，呕吐不饥，自然脾胃受伤。六君子宣补，方法未尝不妙。今诊得吸气甚微，小溲晨通暮癃，足跗浮肿，其腑中之气开阖失司，最虑中满。夫太阳司开，阳明司阖，浊阴弥漫，通腑即是通阳。仿仲景开太阳一法。	 	sstp上海科学技术出版社nihao	 		牡蛎	 	泽泻	 	防己	 	茯苓	 	五味	 	干姜	 	sstp上海科学技术出版社nihao"
叶天士治疗痰饮病案6,biaoyin3,创建时间:10-24 15:21,摘要:冬温，阳不潜伏，伏饮上泛。仲景云：“脉沉属饮。”面色鲜明为饮。饮家咳甚，当治其饮，不当治咳。缘年高下焦根蒂已虚，因温暖气泄，不主收藏，饮邪上扰乘肺，肺气不降，一身之气交阻，薰灼不休，络血上涌。[阅读全文:],index.php?doc-view-7293,主题词： 	痰饮[病]		医家：	叶天士		关键词：		流派：	吴门医派		医案患者信息		性别：		年龄段：		职业：		婚姻：		<li>籍贯：</li>		医案信息		就诊时间：		主要症状：	喘咳不得卧		病因病机：	伏饮上泛		中医诊断：	悬饮		证型：	悬饮（饮停胸胁证）		西医诊断：		治则：	温肺化饮		方剂：	小青龙汤（《伤寒论》）		医家信息		籍贯：		单位：		职称：		名中医：		所属学科：		代表作：		专业特长：,".QAFiHt { display:none; } 	
	冬温，阳不潜伏，伏饮上泛。仲景云：“脉沉属饮。”面色鲜明为饮。饮家咳甚，当治其饮，不当治咳。缘年高下焦根蒂已虚，因温暖气泄，不主收藏，饮邪上扰乘肺，肺气不降，一身之气交阻，薰灼不休，络血上涌。经云：“不得卧，卧则喘甚痹塞。”乃肺气之逆乱也。若以见病图病，昧于色诊候气，必致由咳变幻，腹肿胀满，渐不可挽。明眼医者，勿得忽为泛泛可也	!	兹就管见，略述大意：议开太阳，以使饮浊下趋，仍无碍于冬温，从仲景小青龙越婢合法。	 	sstp上海科学技术出版社nihao	 	 	sstp上海科学技术出版社nihao	 	杏仁	 	茯苓	 	苡仁	 	炒半夏	 	桂枝木	 	石膏	 	白芍	 	炙草	 	sstp上海科学技术出版社nihao"
叶天士治疗痰饮病案4,biaoyin3,创建时间:10-22 21:52,摘要:脉弦右涩，面亮舌白，口乾不喜饮，头重岑岑然，胸脘痹塞而痛，得嗳气稍舒，酒客谷少中虚，痰饮聚蓄。当此夏令，地气上升，饮邪挟气，上阻清空，遂令前症之来。《金匮》云：“脉弦为饮。”色鲜明者为留饮，口乾不欲饮水[阅读全文:],index.php?doc-view-7023,主题词： 	痰饮[病]		医家：	叶天士		关键词：		流派：	吴门医派		医案患者信息		性别：		年龄段：		职业：		婚姻：		<li>籍贯：</li>		医案信息		就诊时间：		主要症状：	胸脘痹塞而痛		病因病机：	饮停肺脾		中医诊断：	痰饮[病]		证型：	痰饮（脾阳虚证）		西医诊断：		治则：	温脾化饮		方剂：		医家信息		籍贯：		单位：		职称：		名中医：		所属学科：		代表作：		专业特长：,".IxmVmP { display:none; } 	
	脉弦右涩，面亮舌白，口乾不喜饮，头重岑岑然，胸脘痹塞而痛，得嗳气稍舒，酒客谷少中虚，痰饮聚蓄。当此夏令，地气上升，饮邪挟气，上阻清空，遂令前症之来。《金匮》云：“脉弦为饮。”色鲜明者为留饮，口乾不欲饮水者，此为饮邪未去故也。况汗出，岂是风寒	?	春夏温邪，辛温发散为大禁。自云：身体空飘。年已六旬有四，辛散以泄其阳，不亦左乎	!	 	sstp上海科学技术出版社nihao	 	 	sstp上海科学技术出版社nihao	 	半夏	 	姜汁	 	川连	 	吴萸	 	茯苓	 	枳实	 	竹沥	 	sstp上海科学技术出版社nihao"
叶天士治疗痰饮病案2,biaoyin3,创建时间:10-22 21:43,摘要:脉弦右濡，阳微恶寒，饮浊上千，咳吐涎沫。且食减胃衰，寒疝窃踞。阴浊见症，岂止一端!喻嘉言谓浊阴上加于天，非离照当空，氛雾焉得退避?反以地黄五味，阴药附和其阴，阴霾冲逆肆虐，饮邪滔天莫制。[阅读全文:],index.php?doc-view-7021,主题词： 	痰饮[病]		医家：	叶天士		关键词：		流派：	吴门医派		医案患者信息		性别：		年龄段：		职业：		婚姻：		<li>籍贯：</li>		医案信息		就诊时间：		主要症状：	咳吐涎沫		病因病机：	脾肾阳虚，痰饮内停		中医诊断：	痰饮[病]		证型：	痰饮（脾阳虚证）		西医诊断：		治则：	温脾化饮		方剂：		医家信息		籍贯：		单位：		职称：		名中医：		所属学科：		代表作：		专业特长：,".iFoGkP { display:none; } 	
	脉弦右濡，阳微恶寒，饮浊上千，咳吐涎沫。且食减胃衰，寒疝窃踞。阴浊见症，岂止一端	!	喻嘉言谓浊阴上加于天，非离照当空，氛雾焉得退避	?	反以地黄五味，阴药附和其阴，阴霾冲逆肆虐，饮邪滔天莫制。议以仲景熟附配生姜法，扫群阴以驱饮邪，维阳气以立基本。况尊年尤宜急护真阳为主，	 	sstp上海科学技术出版社nihao	 	 	sstp上海科学技术出版社nihao	 	人参	 	茯苓	 	熟附子	 	生姜汁	 	南枣	 	sstp上海科学技术出版社nihao"
叶天士治疗痰饮病案1,biaoyin3,创建时间:10-22 21:39,摘要:昔肥今瘦为饮。仲景云：“脉沉而弦，是为饮家。”男子向老，下元先亏，气不收摄，则痰饮上泛，饮与气涌，斯为咳矣。今医见嗽，辄以清肺降气消痰；久而不效，更与滋阴。不明痰饮，皆属浊阴之化，滋则堆砌，助浊滞气。[阅读全文:],index.php?doc-view-7020,主题词： 	痰饮[病]		医家：	叶天士		关键词：		流派：	吴门医派		医案患者信息		性别：		年龄段：		职业：		婚姻：		<li>籍贯：</li>		医案信息		就诊时间：		主要症状：	着枕咳呛		病因病机：	脾肾阳虚，痰饮上犯		中医诊断：	痰饮[病]		证型：	痰饮（脾阳虚证）		西医诊断：		治则：	温脾化饮		方剂：	苓桂术甘汤		医家信息		籍贯：		单位：		职称：		名中医：		所属学科：		代表作：		专业特长：,".UffUAo { display:none; } 	
	昔肥今瘦为饮。仲景云：“脉沉而弦，是为饮家。”男子向老，下元先亏，气不收摄，则痰饮上泛，饮与气涌，斯为咳矣。今医见嗽，辄以清肺降气消痰；久而不效，更与滋阴。不明痰饮，皆属浊阴之化，滋则堆砌，助浊滞气。试述着枕咳呛一端：知身体卧着，上气不平，必下冲上逆，其痰饮伏于至阴之界，肾脏络病无疑。形寒畏风，阳气微弱，而藩篱疏撤，仲景有要言不烦，曰：“饮邪必用温药和之。”更分外饮治脾，内饮治肾。不读圣经，焉知此理	!	 	sstp上海科学技术出版社nihao	 	 	sstp上海科学技术出版社nihao	 	桂苓	甘术汤	 	sstp上海科学技术出版社nihao"
叶天士治疗呃逆病案3,biaoyin3,创建时间:10-12 13:23,摘要:脉搏劲，舌乾赤，嗳气不展，状如呃忒。缘频吐胃伤，诸经之气上逆，填胸聚脘，出入机逆。周行脉痹，肌肉著席而痛转加。平昔辛香燥药不受。先议治肺经，以肺主一身之气化耳。 [阅读全文:],index.php?doc-view-5094,主题词： 	呃逆[病]		医家：	叶天士		关键词：		流派：		医案患者信息		性别：		年龄段：		职业：		婚姻：		<li>籍贯：</li>		医案信息		就诊时间：		主要症状：	呃逆		病因病机：	饮食不当，情志不调		中医诊断：	呃逆[病]		证型：	呃逆（气滞痰阻证）		西医诊断：		治则：	理气化痰，降逆止逆		方剂：		医家信息		籍贯：		单位：		职称：		名中医：		所属学科：		代表作：		专业特长：,".UCksBY { display:none; } 	
	脉搏劲，舌乾赤，嗳气不展，状如呃忒。缘频吐胃伤，诸经之气上逆，填胸聚脘，出入机逆。周行脉痹，肌肉著席而痛转加。平昔辛香燥药不受。先议治肺经，以肺主一身之气化耳。	 	sstp上海科学技术出版社nihao	 	 	sstp上海科学技术出版社nihao	 	枇杷叶汁	 	杏仁	 	桔梗	 	枳实	 	sstp上海科学技术出版社nihao"
