Title,Creator,Creation Time,Summary,Link,Abstract,Details
张伯臾治奔豚气案1,biaoyin1,创建时间:03-21 08:06,摘要:王××，男，57岁，军人，门诊号：76/58952。一诊1976年7月14日。脑膜瘤手术切除后，时有气从少腹上冲至口，头晕屋转，甚则昏倒，后头项胀痛，两足筋脉拘急，脉小弦滑，苔薄白腻。[阅读全文:],index.php?doc-view-19799,主题词： 	奔豚		医家：	张伯臾		关键词：		流派：	海派（张氏内科）		医案患者信息		性别：	男		年龄段：	51至60岁		职业：		婚姻：		<li>籍贯：</li>		医案信息		就诊时间：	1976年07月13日		主要症状：	气从少腹上冲至口，头晕屋转		病因病机：	脾肾阳气不足，痰浊内生，肝气挟痰浊上逆		中医诊断：	奔豚		证型：	奔豚（肝气犯肺证）		西医诊断：		治则：	温阳逐饮化痰降浊		方剂：	真武汤		医家信息		籍贯：		单位：		职称：		名中医：		所属学科：		代表作：		专业特长：,".ScgpOg { display:none; } 	
	王××	，	男	，	57	岁	，	军人	，	门诊号：	76/58952	 	sstp上海科学技术出版社nihao	 	一诊	1976	年	7	月	14	日	 	sstp上海科学技术出版社nihao	 	脑膜瘤手术切除后，时有气从少腹上冲至口，头晕屋转，甚则昏倒，后头项胀痛，两足筋脉拘急，脉小弦滑，苔薄白腻，某医院诊断为继发性腹型癫，曾长期服用抗癫药物无法控制。据脉论证，为奔豚气也。乃由脾肾阳气不足，痰浊内生，肝气挟痰浊上逆而发。治拟温阳逐饮化痰降浊。	 	sstp上海科学技术出版社nihao	 	熟附片	9	克（先煎）		生白术	9	克		福泽泻	15	克	 	sstp上海科学技术出版社nihao	 	川桂枝	4.5	克	 	茯苓	12	克	 	葛根	9	克	 	sstp上海科学技术出版社nihao	 	制半夏	9	克	 	陈胆星	9	克		石菖蒲	9	克	 	sstp上海科学技术出版社nihao	 	炒当归	12	克	 	生白芍	12	克		白金丸	3	克（分吞）		稍加减服二十剂	 	sstp上海科学技术出版社nihao	 	二诊	1976	年	8	月	3	日	 	sstp上海科学技术出版社nihao	 	头晕、气从少腹上冲之症本周只发一次，一分钟即止，较前大为好转，后头项胀痛亦减，两足筋脉拘急依然，自汗盗汗，脉沉迟，苔薄腻。仍守前法增入益气养血之品。	 	sstp上海科学技术出版社nihao	 	熟附片	9	克		生白术	9	克	 	福泽泻	15	克	 	sstp上海科学技术出版社nihao	 	川桂枝	4.5	克		云茯苓	15	克	  	炙甘草	3	克	 	sstp上海科学技术出版社nihao	 	制半夏	9	克	 	炒当归	12	克		制熟地	12	克	 	sstp上海科学技术出版社nihao	 	炙黄芪	15	克	 	生白芍	12	克	 白	金丸	3	克（分吞）		十四剂	 	sstp上海科学技术出版社nihao	 	三诊	1976	年	8	月	18	日	 	sstp上海科学技术出版社nihao	 	劳则易发头晕，后头项板胀未作，两足筋脉拘急已平，出汗亦减，脉虚弦，苔薄腻已化，舌质淡红。痰浊已化，气血两亏，虚风上扰渐平，原法迭投，更进一筹。	 	sstp上海科学技术出版社nihao	 	原方加生晒参	9	克（另煎代茶）。十四剂	 	sstp上海科学技术出版社nihao	 	四诊	1976	年	9	月	1	日	 	sstp上海科学技术出版社nihao	 	头晕未发，后头项已舒适，口不干，精神转佳，脉沉细，舌淡有裂纹。气血两亏渐复，虚风得平，证势已有向愈之象。	 	sstp上海科学技术出版社nihao	 	熟附片	9	克		炒白术	9	克	 	福泽泻	15	克	 	sstp上海科学技术出版社nihao	 	潞党参	12	克	 	炙黄芪	12	克	 	全当归	12	克	 	sstp上海科学技术出版社nihao	 	制熟地	12	克	 	炒川芎	6	克	 	制半夏	9	克	 	sstp上海科学技术出版社nihao	 	云茯苓	12	克	 	白金丸	3	克（分吞）		七剂	 	sstp上海科学技术出版社nihao	 	另：生晒参	9	克（另煎代茶）。	 	sstp上海科学技术出版社nihao	 	 	sstp上海科学技术出版社nihao	 	【按】《金匮》有“奔豚气从少腹上冲咽喉，发作欲死……”、“奔豚气上冲胸……”的记载，前录二例，据其脉证，皆奔豚为患。二例皆因水气上逆，故均用桂枝、茯苓通阳利水，以平冲逆，为治奔豚气之要药；然前例肝气挟水饮上冲，头晕屋转，甚则昏仆，痰饮之重症也，故用真武汤合胆星、菖蒲、白金丸温阳逐饮而化痰浊，当归、芍药、葛根、半夏调肝降逆；而后例下腹胀，时有冷气上冲胸膈，又见右胁胀痛，知是肾中寒气挟饮上冲，兼有肝气郁滞，故先予桂枝加桂汤，重桂枝之量，易桂枝为肉桂，并与紫石英相配，增加其温肾纳气、平降冲逆之力，随后再予滋肾泄肝调治。同为奔豚之患，诊治相异，同病异治者是也。	 	sstp上海科学技术出版社nihao"
董廷瑶治咽喉麻痹案,biaoyin10,创建时间:10-23 14:32,摘要:许某，男，11岁。初诊（1974年6月29日），十日来不能咽食，仅饮流质，亦时见喷吐，西医诊断为第九、第十对脑神经麻痹。面色晦暗，声音嘶哑，喉中如梗，自感舌麻，脉细，舌红而黯，苔薄白。[阅读全文:],index.php?doc-view-7057,主题词： 	噎膈		医家：	董廷瑶		关键词：		流派：		医案患者信息		性别：	男		年龄段：	学龄期(7至13岁)		职业：		婚姻：		<li>籍贯：</li>		医案信息		就诊时间：	1974年06月28日		主要症状：	不能咽食		病因病机：	瘀结阻络		中医诊断：	噎膈		证型：	噎膈（痰瘀互结证）		西医诊断：	脑神经麻痹		治则：	活血通络		方剂：		医家信息		籍贯：		单位：		职称：		名中医：		所属学科：		代表作：		专业特长：,".JvRVzB { display:none; } 	
	许某，男，11岁	初诊（1974年6月29日）	十日来不能咽食，仅饮流质，亦时见喷吐，西医诊断为第九、第十对脑神经麻痹。面色晦暗，声音嘶哑，喉中如梗，自感舌麻，脉细，舌红而黯，苔薄白。其症为瘀结阻络，故拟活血化瘀。 	sstp上海科学技术出版社nihao	 	桃仁9克 土红花4.5克   当归6克 	sstp上海科学技术出版社nihao	 	赤芍6克 川芎3克   乳没各4．5克 	sstp上海科学技术出版社nihao	 	五灵脂9克 生蒲黄6克    桔梗3克 	sstp上海科学技术出版社nihao	 	枳壳4．5克 	sstp上海科学技术出版社nihao	 	七剂	二诊（7月5日）	诸症均减，稍能进食，发音略开，喉梗尚有。上法甚合，仍宗前方。	上方去灵脂、 蒲黄， 加赭石１２克，生草２．４克，六剂。	三诊（７月１２日）	已能咽食，音声亦出，喉梗欲咳，有痰不爽。此为络结初开，尚需宣瘀泄痰。 	sstp上海科学技术出版社nihao	 	桃仁９克土  红花４．５克  乳没各４．５克 	sstp上海科学技术出版社nihao	 	当归６克   桔梗３克    生甘草２．４克 	sstp上海科学技术出版社nihao	 	川贝４．５克 杏仁６克   竹茹６克 	sstp上海科学技术出版社nihao	 	六剂	四诊（７月１９日）	咽食如常，音声大亮，喉梗已无，吐痰爽利，惟面色萎黄，小溲频数，脉沉而细，舌苔薄润。病情向愈，正气略虚，上病及下。当需滋肾利尿为主。	菟丝子９克   覆盆子９  克花粉９克  	sstp上海科学技术出版社nihao	 	川贝４．５克   竹茹６克  杏仁６克 	sstp上海科学技术出版社nihao	 	盐水炒桑螵蛸９克 生草３克  远志６克	山萸肉６克七剂 	sstp上海科学技术出版社nihao	 	服后诸症皆安。	【按】本例之症殊为罕见。前贤曾有“噎枯在上，咽喉壅塞，饮虽可入，食不能下”的记述，并认为与气滞火炎、血阻痰凝等有关（见《证治汇补》）；王清任氏亦提出了“饮水即呛，乃会厌有血滞”的论点，制定了会厌逐瘀汤。本例的病机，以其不能咽食、咽中阻结、面色晦暗、喉梗舌麻，故从瘀滞论治，投以活血通络解结之法，即见好转。是本之于王氏所说，得到启发也。二诊后加入化痰开音之品，功效益彰，终于获得痊愈。 	sstp上海科学技术出版社nihao	 	 	sstp上海科学技术出版社nihao"
张羹梅治慢性萎缩性胃炎案,biaoyin10,创建时间:10-24 16:21,摘要:王某，男，38岁，门诊号６５／８７７６６。初诊：１９６５年１２月１１日。主诉：上腹部不规则疼痛十五年，伴腹泻。病史：1949年开始上腹部疼痛，无一定规律，与饮食无关。食欲减退。[阅读全文:],index.php?doc-view-7307,主题词： 	胃痛[病]		医家：	张羹梅		关键词：		流派：		医案患者信息		性别：	男		年龄段：	31至40岁		职业：		婚姻：		<li>籍贯：</li>		医案信息		就诊时间：	1965年12月10日		主要症状：	腹痛		病因病机：	肝失疏泄，横逆犯胃		中医诊断：	胃痛[病]		证型：	胃痛（肝气犯胃证）		西医诊断：	胃炎		治则：	疏肝解郁，和胃降逆		方剂：		医家信息		籍贯：		单位：		职称：		名中医：		所属学科：		代表作：		专业特长：,".fpoeub { display:none; } 	
	王某，男，38岁，门诊号６５／８７７６６。	 	sstp上海科学技术出版社nihao	 	初诊：１９６５年１２月１１日。	主诉：上腹部不规则疼痛十五年，伴腹泻。	病史：1949年开始上腹部疼痛，无一定规律，与饮食无关。食欲减退，恶心嗳气。至1953年出现腹泻，先后住院两次。胃镜检查发现胃黏膜皱襞平滑变薄，胃液分泌示游离酸缺乏，组胺注射后亦不升高。 	sstp上海科学技术出版社nihao	 	诊断：慢性萎缩性胃炎(腹泻型)。	医案：胃脘疼痛，胃纳不馨，时有泛恶，频频嗳气，大便溏薄，形容委顿。脉弦，苔薄腻。肝失疏泄，横逆犯胃，胃失和降，脾失健运。治拟疏肝和胃以降逆，健脾益气以止泻。 	sstp上海科学技术出版社nihao	 	潞党参9克  焦白术9克 姜半夏9克 	sstp上海科学技术出版社nihao	 	广陈皮6克 砂蔻仁(各)１．８克(后下)  广木香４．５克 	sstp上海科学技术出版社nihao	 	云茯苓9克  炙甘草3克 旋覆花6克(包) 	sstp上海科学技术出版社nihao	 	代赭石18克(醋煅先煎) 炒赤芍9克 鸡血藤12克 	sstp上海科学技术出版社nihao	 	三剂	二诊１９６５年12月14日。	胃脘疼痛得减，腹泻亦有好转，法仍守之。原方去旋覆花、代赭石，加煅瓦楞18克(先煎)，海贝粉9克(分两次吞)。四剂	疗效：以上加减方共服五十余剂，饮食恢复正常，每日食粮一斤余，腹泻亦止，精神明朗，面色红润，体重增加。血常规中血色素及红细胞亦有明显增高。但未复作胃液分析。 	sstp上海科学技术出版社nihao	 	【按语】久痛必然入络，故加用鸡血藤、赤芍等活血药。《本经逢原》认为瓦楞子可“治积年胃脘瘀血疼痛”。 	sstp上海科学技术出版社nihao"
张羹梅治胃溃疡、胃黏膜脱垂症,biaoyin10,创建时间:10-24 16:42,摘要:徐某，男，41岁，门诊号６３／６６６３６。初诊：１９６３年１２月６日。主诉：上腹部疼痛，反复发作四年。病史：1959年患败血症，在某中心医院经抗生素、激素等药治疗后痊愈，但诱发了溃疡病，反复发作上腹部疼[阅读全文:],index.php?doc-view-7314,主题词： 	胃痛[病]		医家：	张羹梅		关键词：		流派：		医案患者信息		性别：	男		年龄段：	41至50岁		职业：		婚姻：		<li>籍贯：</li>		医案信息		就诊时间：	1963年12月05日		主要症状：	腹痛		病因病机：	内伤脾胃，气亏发热		中医诊断：	胃痛[病]		证型：	胃痛		西医诊断：	胃溃疡		治则：	甘温除热		方剂：		医家信息		籍贯：		单位：		职称：		名中医：		所属学科：		代表作：		专业特长：,".iJrrNa { display:none; } 	
	徐某，男，41岁，门诊号６３／６６６３６。	初诊：１９６３年１２月６日。	主诉：上腹部疼痛，反复发作四年。	病史：1959年患败血症，在某中心医院经抗生素、激素等药治疗后痊愈，但诱发了溃疡病，反复发作上腹部疼痛，经各种中西药物治疗无效。胃肠钡剂造影示：胃溃疡和胃黏膜脱垂。近日上腹部疼痛加剧，同时伴有发烧，故来我院门诊。 	sstp上海科学技术出版社nihao	 	诊断：胃溃疡、胃黏膜脱垂症。	医案：胃脘疼痛，迁延日久，内伤脾胃。近日又有发热，精神甚疲，头项胀，耳失聪，眼昏花，夜盗汗，饮食只进流质，大便时见黑色，乃伤其气。脉虚细，苔白腻。《脾胃论》曰：“内伤脾胃，乃伤其气，”“伤其内为不足，不足者补之。”宗东垣甘温除热法。 	sstp上海科学技术出版社nihao	 	红参3克(另炖冲服) 焦白术9克 云茯苓12克	炙甘草3克  全当归9克 川石斛12克 	sstp上海科学技术出版社nihao	 	炒白芍9克  焦山药9克  佛手片４．５克 	sstp上海科学技术出版社nihao	 	小川连１．５克焦谷芽１２克 	sstp上海科学技术出版社nihao	 	一剂	疗效：上药服四剂后，发烧未作，盗汗已止。上药服至1964年1月3日时，胃脘胀痛已消失。后因黄连缺货，改用左金丸3克，吞服。于1964年2月19日胃肠钡剂造影复查：胃溃疡之壁龛消失，无胃黏膜脱垂症之征象，但胃幽窦部黏膜较粗，似为炎症所致。上药服至1964年3月，饮食如常，无自觉症状。 	sstp上海科学技术出版社nihao	 	【按语】本案既有胃脘痛，又兼有发热症状。发热乃由于胃脘痛迁延日久，内伤脾胃，气不足而生热。可用《脾胃论》之甘温除热法。历代医书，甘温除热法多用补中益气汤。此处取其意而舍其方，应用归芍六君加黄连、石斛而成。既可益气养血，清热养阴，又可甘温而不伤阴，滋阴有助于清热。 	sstp上海科学技术出版社nihao"
董廷瑶治慢性胃炎案1,biaoyin10,创建时间:10-23 18:48,摘要:朱某，女，４０岁。初诊（１９７７年８月３０日），每于食后胃脘隐痛频频，西医诊断为慢性胃炎。纳谷不佳，腹中胀气，大便时泄时闭，脉象沉细，舌苔白腻。症属胃虚中寒，气滞湿阻，治宜温中散寒为主。[阅读全文:],index.php?doc-view-7127,主题词： 	胃痛[病]		医家：	董廷瑶		关键词：		流派：		医案患者信息		性别：	女		年龄段：	31至40岁		职业：		婚姻：		<li>籍贯：</li>		医案信息		就诊时间：	1977年08月29日		主要症状：	胃痛		病因病机：	脾胃虚寒，寒湿阻滞		中医诊断：	胃痛[病]		证型：	胃痛（脾胃虚寒证）		西医诊断：	胃炎		治则：	温中散寒、利气燥湿		方剂：		医家信息		籍贯：		单位：		职称：		名中医：		所属学科：		代表作：		专业特长：,".mQkYOq { display:none; } 	
	朱某，女，４０岁	初诊（１９７７年８月３０日）	每于食后胃脘隐痛频频，西医诊断为慢性胃炎。纳谷不佳，腹中胀气，大便时泄时闭，脉象沉细，舌苔白腻。症属胃虚中寒，气滞湿阻，治宜温中散寒为主。 	sstp上海科学技术出版社nihao	 	荜拨６克 高良姜３克 肉桂粉（吞）１．５克	白芍９克 生姜３片 陈皮３克 	sstp上海科学技术出版社nihao	 	淡吴萸2.４克 半夏６克 	sstp上海科学技术出版社nihao	 	五剂	二诊（９月６日）	脘痛较和，泛已止，腹胀亦减，便下时结，胃纳欠佳，脉沉苔白。温化尚合，兼以调气。	上方去半夏，加沉香曲４．５克，枳壳４．５克，六剂。	服后诸症向愈，原法调治而安。 	sstp上海科学技术出版社nihao	 	【按】本例为寒湿阻结，胃虚气滞之证。胃脘隐痛，大便时秘，均为中阳不足、气滞湿阻之故。此不宜补中益气以碍湿，也不宜淡渗利湿以伐下。宜投温中散寒、利气燥湿之剂。	 	sstp上海科学技术出版社nihao"
董廷瑶治呕逆案1,biaoyin10,创建时间:10-23 18:55,摘要:陈某，女，３０岁。初诊（１９７８年３月１０日），患者因传肝，于１月７日住院由西医治疗。但自２月１３日起发生严重呕吐，不能进食，反复发作不止。西医已用阿托品，胃肠减压，补液等治疗。[阅读全文:],index.php?doc-view-7129,主题词： 	呕吐[病]		医家：	董廷瑶		关键词：		流派：		医案患者信息		性别：	女		年龄段：	21至30岁		职业：		婚姻：		<li>籍贯：</li>		医案信息		就诊时间：	1978年03月09日		主要症状：	恶心与呕吐		病因病机：	肝气郁结，胃气上逆		中医诊断：	呕吐[病]		证型：	肝郁脾虚证		西医诊断：		治则：	疏肝和胃，苦辛通降		方剂：	左金丸		医家信息		籍贯：		单位：		职称：		名中医：		所属学科：		代表作：		专业特长：,".mqqalY { display:none; } 	
	陈某，女，３０岁	初诊（１９７８年３月１０日）	患者因传肝，于１月７日住院由西医治疗。但自２月１３日起发生严重呕吐，不能进食，反复发作不止。西医已用阿托品，胃肠减压，补液等治疗。呕吐依然频繁，极度虚弱，邀中医会诊。现吐恶甚剧，胸痞头眩，大便涩滞，黄疸未清，二脉弦细，舌尖红苔薄白。询之素有胃病；是胃气不降，肝郁横逆也。治当疏肝和胃，苦辛通降。 	sstp上海科学技术出版社nihao	 	川连３克  吴茱萸３克 条芩４．５克 全瓜蒌１２克 	sstp上海科学技术出版社nihao	 	郁金９克 香附９克 半夏９克 代赭石２４克（捣） 	sstp上海科学技术出版社nihao	 	姜竹茹９克 柴胡４．５克 	sstp上海科学技术出版社nihao	 	四剂	二诊（３月１４日）	呕吐大减，稍可进食，便下坚硬，胸脘呃逆，脉弦细，舌尖红苔薄黄润。药有初效，续进疏肝降逆。	水炒川连３克 全瓜蒌１２克  代赭石２４克（捣） 香附９克 	sstp上海科学技术出版社nihao	 	姜竹茹９克 枇杷叶９克（包）  陈皮３克 半夏９克 	sstp上海科学技术出版社nihao	 	茯苓９克 柴胡４．５克 麸炒枳壳９克 柿蒂３枚 	sstp上海科学技术出版社nihao	 	七剂	三诊（３月２１日）	吐恶已止，呃逆不作，便下坚硬，小溲尚通；但脘腹胀满，胸痞苔润，二目淡黄。是为中焦气饮互阻，升降还未复常。治以化饮开结，行气降逆。	全瓜蒌１２克 薤白９克 大腹皮１２克 苏梗９克 	sstp上海科学技术出版社nihao	 	姜竹茹９克 香橼１２克  枇杷叶９克（包） 茯苓９克 	sstp上海科学技术出版社nihao	 	半夏９克 炒莱菔子９克 麸炒枳壳４．５克 	sstp上海科学技术出版社nihao	 	七剂	四诊（３月２８日）	痞胀已舒，纳食亦佳，便下通调，脉舌均和。诸症皆安，而目黄大减，兹拟调气和胃可也。	全瓜蒌１２克 竹茹６克  香橼６克 佛手柑６克 	sstp上海科学技术出版社nihao	 	炒谷芽９克麸炒枳壳４．５克赤苓９克 陈皮３克 	sstp上海科学技术出版社nihao	 	半夏９克 生甘草２．４克 	sstp上海科学技术出版社nihao	 	四剂	药后吐恶再不发作，病情显著好转。	【按】本例主症为剧烈呕吐，兼见胸痞头眩，二脉弦细，辨证是肝气郁结，胃气上逆。乃予左金合小陷胸汤。参以小柴胡之意，疏肝清热，理气和胃。初效后增加下气诸品如枇杷叶、柿蒂、陈皮、枳壳，吐恶遂平。但三诊时见脘腹胀满，胸痞苔润，是气饮痰浊阻塞于中，即选用栝楼薤白半夏汤加减，以腹皮、苏梗、香橼、莱菔子等为佐，共奏豁痰化饮，下气降浊之效。服后痞除胀消，纳佳便调，而其症已安矣。 	sstp上海科学技术出版社nihao"
董廷瑶治呕逆案2,biaoyin10,创建时间:10-23 18:58,摘要:王某，女，２７岁。初诊，二月来食入恶心呕吐，迄今不愈。西医检查无阳性发现，诸药罔效。胸脘不适，头部昏胀，大便不畅，隔二三日一行，坚硬努责。舌淡苔润，脉象弦细。诊为冲气上逆，胃气不降。[阅读全文:],index.php?doc-view-7133,主题词： 	呕吐[病]		医家：	董廷瑶		关键词：		流派：		医案患者信息		性别：	女		年龄段：	21至30岁		职业：		婚姻：		<li>籍贯：</li>		医案信息		就诊时间：		主要症状：	恶心与呕吐		病因病机：	冲气上逆，胃气不降		中医诊断：	呕吐[病]		证型：	冲气上逆证		西医诊断：		治则：	镇逆平冲		方剂：		医家信息		籍贯：		单位：		职称：		名中医：		所属学科：		代表作：		专业特长：,".HuoEph { display:none; } 	
	王某，女，２７岁	初诊	二月来食入恶心呕吐，迄今不愈。西医检查无阳性发现，诸药罔效。胸脘不适，头部昏胀，大便不畅，隔二三日一行，坚硬努责。舌淡苔润，脉象弦细。诊为冲气上逆，胃气不降。治以镇逆平冲。 	sstp上海科学技术出版社nihao	 	代赭石２４克 怀牛膝１２克  生麦芽３０克 当归９克 	sstp上海科学技术出版社nihao	 	白芍９克 左金丸３克（吞） 桃仁４．５克 红花２．４克 	sstp上海科学技术出版社nihao	 	刺蒺藜９克 龙骨９克 牡蛎１８克 	sstp上海科学技术出版社nihao	 	五剂	二诊	吐恶初平，已可进食，但胸脘不适，便结不畅，是冲气未平，再以原法加减。	上方去桃红、左金，加熟地１５克，四剂。	三诊	能饮可食，精神亦振，但便结难下，头昏不适。脉舌略同。再以镇逆为主，佐以润肠。 	sstp上海科学技术出版社nihao	 	桂枝２．４克  龙骨９克 牡蛎１５克 代赭石１８克 	sstp上海科学技术出版社nihao	 	生麦芽１５克 当归９克   白芍９克 瓜蒌仁１２克 	sstp上海科学技术出版社nihao	 	桑麻丸１２克（包） 	sstp上海科学技术出版社nihao	 	五剂	四诊	冲逆已平，纳佳便畅，舌净脉缓，但头部时感不适。再以调胃扶元，平肝安冲。	党参９克  代赭石１５克 石决明１５克 生麦芽１２克 	sstp上海科学技术出版社nihao	 	桑叶９克  瓜蒌仁１２克 滁菊６克 白芍９克 	sstp上海科学技术出版社nihao	 	沙苑子９克 生熟地各１２克 	sstp上海科学技术出版社nihao	 	五剂	五诊	诸症俱安，冲逆全平，纳和思食，便下通畅，仅时感头昏。治以调扶安冲。原法出入，上方去桑、菊、石决，加磁石１５克，当归９克，谷芽９克，七剂。	以后从此不再发作，随访诸症皆愈。 	sstp上海科学技术出版社nihao	 	【按】张锡纯氏于冲气上逆之证颇多阐述，其谓冲气之病，首在胃气上逆，化生痰涎，阻格饮食；且见腹中膨闷，哕气呃逆，甚则胁肋胀疼，头目眩晕，脉弦硬而长。论其病机，为冲气上逆，胃气不降也。而冲脉隶属阳明，且此证多因肝气恣横，逆气上攻。故治当镇冲降逆为主，以平肝之药佐之。张氏降胃镇冲汤以赭石、龙牡、白芍为重要主药，即此意也。 	sstp上海科学技术出版社nihao	 	本例属冲气上逆，故以龙牡镇敛冲气，赭石降逆止呕，白芍柔肝平木，并用左金丸两和肝胃，当归养血和肝，牛膝引导下行，白蒺藜疏肝熄风，对胸闷、头昏均可使用；尤重用生麦芽，既有消胀除痞之功，又有条达肝木之力，张氏对本病颇常用之；因气逆日久，恐血分有瘀，故少加桃红；头昏加桑菊、石决、磁石；便结用蒌仁、桑麻丸；肾虚用二地、沙苑子。这是随宜而治也。 	sstp上海科学技术出版社nihao"
