Title,Creator,Creation Time,Summary,Link,Abstract,Details
叶天士治呕吐病案2,biaoyin11,创建时间:09-28 16:46,摘要:身腴体质，适值过劳，阳气受伤，呕吐食物，身热而无头痛，已非外感风寒。间日烦躁渴饮，唇焦舌黑，是内伏热气，由募原以流布三焦，亦如疟邪之分争营卫[阅读全文:],index.php?doc-view-2495,主题词： 	暴吐		医家：	叶天士		关键词：		流派：	吴门医派		医案患者信息		性别：		年龄段：		职业：		婚姻：		<li>籍贯：</li>		医案信息		就诊时间：		主要症状：	呕吐身热		病因病机：	胃热不清		中医诊断：	呕吐[病]		证型：	胃阴不足		西医诊断：		治则：	滋养胃阴		方剂：		医家信息		籍贯：		单位：		职称：		名中医：		所属学科：		代表作：		专业特长：,".hHHviv { display:none; } 	
	 身腴体质，适值过劳，阳气受伤，呕吐食物，身热而无头痛，已非外感风寒。间日烦躁渴饮，唇焦舌黑，是内伏热气，由募原以流布三焦，亦如疟邪之分争营卫者然。然积劳既久，伏邪客病，脉来小缓，按之不鼓，可为征验。且两便颇通，略能纳谷，焉有停聚积滞？仲景以单热无寒之症，不出方药，但以饮食消息之，后贤参拟甘寒滋养胃阴，其热自解。 	sstp上海科学技术出版社nihao	 	 竹叶 花粉 麦冬	 连翘 生地 杏仁	 蔗浆 	sstp上海科学技术出版社nihao"
叶天士治泄泻病案,biaoyin11,创建时间:09-28 11:59,摘要:脉微而迟，色衰萎黄。凡阳气不足，久利久泻，穷必伤肾。今浮肿渐起，目下是水失火而败。若非暖下，徒见泄泻有红，为脾胃湿热，必至中满败坏。[阅读全文:],index.php?doc-view-2447,主题词： 	泄泻		医家：	叶天士		关键词：		流派：	吴门医派		医案患者信息		性别：		年龄段：		职业：		婚姻：		<li>籍贯：</li>		医案信息		就诊时间：		主要症状：	久泄不止		病因病机：	肾阳亏虚		中医诊断：	泄泻[病]		证型：	肾阳虚衰证		西医诊断：		治则：	温肾固脾		方剂：		医家信息		籍贯：		单位：		职称：		名中医：		所属学科：		代表作：		专业特长：,".suLTxJ { display:none; } 	
	 脉微而迟，色衰萎黄。凡阳气不足，久利久泻，穷必伤肾。今浮肿渐起，目下是水失火而败。若非暖下，徒见泄泻有红，为脾胃湿热，必至中满败坏。	 熟地炭 淡附子茯苓 	sstp上海科学技术出版社nihao	 	车前子 生茅术 干姜 	sstp上海科学技术出版社nihao"
叶天士治呕吐病案,biaoyin11,创建时间:09-27 20:39,摘要:      下体痿躄，先有遗泄、湿疡，频进渗利，阴阳更伤。虽有参、芪、术养脾肺以益气，未能救下。即如长冷阳微，饭后吐食，乃胃阳顿衰，应乎卫外失职。但下焦[阅读全文:],index.php?doc-view-2423,主题词： 	暴吐		医家：	叶天士		关键词：		流派：	吴门医派		医案患者信息		性别：		年龄段：		职业：		婚姻：		<li>籍贯：</li>		医案信息		就诊时间：		主要症状：	饭后呕吐		病因病机：	胃阳虚弱		中医诊断：	暴吐		证型：	脾肾阳虚证		西医诊断：		治则：	补益脾肾		方剂：	大半夏汤		医家信息		籍贯：		单位：		职称：		名中医：		所属学科：		代表作：		专业特长：,".jPAfni { display:none; } 	
	 下体痿躄，先有遗泄、湿疡，频进渗利，阴阳更伤。虽有参、芪、术养脾肺以益气，未能救下。即如长冷阳微，饭后吐食，乃胃阳顿衰，应乎卫外失职。但下焦之病，都属精血受伤，两投温通柔剂，以肾恶燥，久病宜通任督，通摄兼施，亦与古贤四斤健步诸法互参。至于胃药必须另用，夫胃府主乎气，气得下行为顺。东垣有升阳益胃之条，似乎相悖，然芩、连非苦降之气乎。凡吐后一二日，停止下焦血分，药即用扶阳理胃。二日俾中下两固，《经》旨谓阳明之脉，束筋骨以流利机关，本病即有合矣。 	sstp上海科学技术出版社nihao	 	鹿茸 归身 柏子霜	 茯苓 苁蓉 巴戟	 补骨脂 川石斛 牛膝 	sstp上海科学技术出版社nihao	 	 枸杞子	吐后间服大半夏汤，加干姜、姜汁。	 	再诊 	长夏湿热，经脉流行气钝，兼以下元络脉已虚，痿弱不耐步趋，常似酸楚，大便或结或溏，都属肝肾为病。然益下必佐宣通脉络，乃正治之法，恐夏季后湿热还扰，预为防理。 	sstp上海科学技术出版社nihao	 	鹿角霜 生茅术 茯苓	苁蓉 归身 熟地	桑椹子 巴戟 远志 	sstp上海科学技术出版社nihao	 	茴香 酒蒸金毛狗脊	水熬膏。	 三诊 	痿躄在下，肝肾居多。但素饮必有湿热，热瘀湿滞，气血不行，筋缩肌肉不仁，体质重著不移，无非湿邪之深沉也。若论阳虚不该大发疮痍，但病久非可速攻，莫计效迟，方可愈也。 	sstp上海科学技术出版社nihao	 	细生地 归身 黄柏	萆薢 苁蓉 川斛	牛膝 蒺藜	 四诊 	寝食如常，脉沉而缓，独两腿内外肉脱麻木。年逾五旬，阳脉渐衰，蹻维不为用事，非三气杂感也。温通以佐脉络之流畅，仿古圣四斤金刚之属。 	sstp上海科学技术出版社nihao	 	苁蓉 牛膝茯苓	萆薢 木瓜 枸杞子	蒺藜金毛狗脊膏丸 	sstp上海科学技术出版社nihao"
叶天士治胃痛病案,biaoyin11,创建时间:09-27 19:09,摘要:据述久有胃痛，当年因痛吐蛔，服资生丸，消补相投。用八味丸，温润不合。凭脉论症，向时随发随愈。[阅读全文:],index.php?doc-view-2388,主题词： 	胃痛[病]		医家：	叶天士		关键词：		流派：	吴门医派		医案患者信息		性别：		年龄段：		职业：		婚姻：		<li>籍贯：</li>		医案信息		就诊时间：		主要症状：	胃痛		病因病机：	脾胃虚弱		中医诊断：	胃痛[病]		证型：	脾胃虚寒证		西医诊断：		治则：	理气健脾		方剂：	大半夏汤		医家信息		籍贯：		单位：		职称：		名中医：		所属学科：		代表作：		专业特长：,".IZzNZc { display:none; } 	
	 据述久有胃痛，当年因痛吐蛔，服资生丸，消补相投。用八味丸，温润不合。凭脉论症，向时随发随愈。今病发一月，痛止不纳，口味酸浊，假寐未久，忽躁热头汗淋漓，口不渴饮。凡肝病必犯胃府，且攻涤寒热等药，必先入胃以分。布药不对，病更伤胃气。胃司九窍，清浊既乱于中，焉有下行为顺之理。上下不宣，状如关格。但关格乃阴枯阳结，圣贤尤以为难。今是胃伤困乏，清阳不司旋运，斯为异歧。不必以寒之不应而投热，但主伤在无形，必图清气宣通，则为善治程法，《金匮》大半夏汤。 	sstp上海科学技术出版社nihao	 	 大半夏汤 	sstp上海科学技术出版社nihao"
叶天士治痞满病案,biaoyin11,创建时间:09-27 17:57,摘要:脘下胀及少腹，疏肝平胃，不应肾气，加辛香又不应。食物仍进，二便仍利，病既非停著，有形之滞，自属阳微气结。议与通阳润剂。阿魏麝香丸服。[阅读全文:],index.php?doc-view-2372,主题词： 	痞满[病]		医家：	叶天士		关键词：		流派：	吴门医派		医案患者信息		性别：		年龄段：		职业：		婚姻：		<li>籍贯：</li>		医案信息		就诊时间：		主要症状：	脘腹胀满		病因病机：	脾胃虚弱		中医诊断：	痞满[病]		证型：	痞满（脾胃气虚证）		西医诊断：		治则：	补中益气		方剂：		医家信息		籍贯：		单位：		职称：		名中医：		所属学科：		代表作：		专业特长：,".WXlOng { display:none; } 	
	脘下胀及少腹，疏肝平胃，不应肾气，加辛香又不应。食物仍进，二便仍利，病既非停著，有形之滞，自属阳微气结。议与通阳润剂。	阿魏麝香	丸服。	 	sstp上海科学技术出版社nihao"
何鸿舫治外感病案11,biaoyin12,创建时间:10-18 21:53,摘要:脘痛呕酸，脉来弦濡，此寒邪湿滞也。[阅读全文:],index.php?doc-view-6304,主题词： 	胃痛[病]		医家：	何鸿舫		关键词：		流派：		医案患者信息		性别：		年龄段：		职业：		婚姻：		<li>籍贯：</li>		医案信息		就诊时间：		主要症状：	胃痛		病因病机：	寒邪挟湿，阻滞胃络		中医诊断：	胃痛[病]		证型：	胃痛（寒邪犯胃证）		西医诊断：		治则：	温胃散寒		方剂：		医家信息		籍贯：		单位：		职称：		名中医：		所属学科：		代表作：		专业特长：,".NCcYqx { display:none; } 	
	脘痛呕酸，脉来弦濡，此寒邪湿滞也。 	sstp上海科学技术出版社nihao	 	桂枝五分 藿梗一钱五分 赤苓三钱	神曲三钱 生白术二钱 泽泻一钱五分	猪苓三钱 川朴八分 白豆蔻六分 	sstp上海科学技术出版社nihao"
何鸿舫治外感病案10,biaoyin12,创建时间:10-18 21:49,摘要:腹痛便泻，脉来浮濡带数，咳嗽音哑，风邪湿滞为病。生白术二钱 赤茯苓三钱 广藿梗一钱五分防风一钱五分 泽泻一钱五分 神曲三钱川朴八分 大麦仁三钱 猪苓三钱[阅读全文:],index.php?doc-view-6300,主题词： 	外感热病		医家：	何鸿舫		关键词：		流派：		医案患者信息		性别：		年龄段：		职业：		婚姻：		<li>籍贯：</li>		医案信息		就诊时间：		主要症状：	腹痛		病因病机：	风邪挟湿，侵袭机体		中医诊断：	外感热病		证型：	风湿挟毒证		西医诊断：		治则：	祛风燥湿		方剂：		医家信息		籍贯：		单位：		职称：		名中医：		所属学科：		代表作：		专业特长：,".uVXCIK { display:none; } 	
	腹痛便泻，脉来浮濡带数，咳嗽音哑，风邪湿滞为病。 	sstp上海科学技术出版社nihao	 	生白术二钱 赤茯苓三钱 广藿梗一钱五分	防风一钱五分 泽泻一钱五分 神曲三钱	川朴八分 大麦仁三钱 猪苓三钱 	sstp上海科学技术出版社nihao"
何书田治呕吐病案3,biaoyin12,创建时间:10-08 14:22,摘要:纳食即呕，舌本干红。此中气虚而肝火上亢也，殊非轻恙。[阅读全文:],index.php?doc-view-4465,主题词： 	呕吐[病]		医家：	何书田		关键词：		流派：		医案患者信息		性别：		年龄段：		职业：		婚姻：		<li>籍贯：</li>		医案信息		就诊时间：		主要症状：	恶心与呕吐		病因病机：	肝郁乘脾，脾虚肝亢		中医诊断：	呕吐[病]		证型：	肝郁脾虚证		西医诊断：		治则：	疏肝和胃		方剂：		医家信息		籍贯：		单位：		职称：		名中医：		所属学科：		代表作：		专业特长：,".YiWwXJ { display:none; } 	
	纳食即呕，舌本干红。此中气虚而肝火上亢也，殊非轻恙。 	sstp上海科学技术出版社nihao	 	党参二钱 川石斛三钱 法半夏一钱五分	橘白一钱五分 茯苓二钱 谷芽三钱	白芍一钱五分 藿梗一钱五分 山栀一钱五分	代赭石三钱 	sstp上海科学技术出版社nihao"
何书田治呕吐病案2,biaoyin12,创建时间:10-08 14:18,摘要:脾阳衰，纳食呕逆，治以辛温。[阅读全文:],index.php?doc-view-4460,主题词： 	呕吐[病]		医家：	何书田		关键词：		流派：		医案患者信息		性别：		年龄段：		职业：		婚姻：		<li>籍贯：</li>		医案信息		就诊时间：		主要症状：	恶心与呕吐		病因病机：	脾胃阳虚，温煦失职，运化失布		中医诊断：	呕吐[病]		证型：	脾阳虚证		西医诊断：		治则：	温补脾胃		方剂：		医家信息		籍贯：		单位：		职称：		名中医：		所属学科：		代表作：		专业特长：,".lTmvau { display:none; } 	
	脾阳衰，纳食呕逆，治以辛温。 	sstp上海科学技术出版社nihao	 	吴萸四分 干姜五分 白芍一钱五分	川朴八分 藿梗八分 半夏一钱五分	代赭三钱 陈皮一钱五分 茯苓二钱	佛手八分 	sstp上海科学技术出版社nihao"
何书田治呕吐病案1,biaoyin12,创建时间:10-08 14:14,摘要:呕逆膈痛，肝胃不和也，法当通补。[阅读全文:],index.php?doc-view-4456,主题词： 	呕吐[病]		医家：	何书田		关键词：		流派：		医案患者信息		性别：		年龄段：		职业：		婚姻：		<li>籍贯：</li>		医案信息		就诊时间：		主要症状：	恶心与呕吐		病因病机：	肝胃不和，胃失和降		中医诊断：	呕吐[病]		证型：	肝胃不和证		西医诊断：		治则：	疏肝和胃		方剂：	二陈汤（《太平惠民合剂局方》）		医家信息		籍贯：		单位：		职称：		名中医：		所属学科：		代表作：		专业特长：,".QGoOAD { display:none; } 	
	呕逆膈痛，肝胃不和也，法当通补。 	sstp上海科学技术出版社nihao	 	二陈汤 吴萸四分 干姜五分	香附一钱五分 白芍一钱五分 益智仁一钱 	sstp上海科学技术出版社nihao"
何书田治痞病案4,biaoyin12,创建时间:10-08 14:08,摘要:痞胀减食，四肢无力。[阅读全文:],index.php?doc-view-4450,主题词： 	痞满[病]		医家：	何书田		关键词：		流派：		医案患者信息		性别：		年龄段：		职业：		婚姻：		<li>籍贯：</li>		医案信息		就诊时间：		主要症状：	胸胁苦满		病因病机：	脾胃虚弱，运化失司		中医诊断：	痞满[病]		证型：	痞满（脾胃气虚证）		西医诊断：		治则：	补脾益气		方剂：		医家信息		籍贯：		单位：		职称：		名中医：		所属学科：		代表作：		专业特长：,".XLkOoM { display:none; } 	
	痞胀减食，四肢无力。	制於术一钱五分 广藿香八分 川石斛二钱	陈皮一钱五分 白芍一钱五分 茯苓二钱	半夏一钱五分 木瓜二钱 	sstp上海科学技术出版社nihao"
何书田治痞病案3,biaoyin12,创建时间:10-08 14:03,摘要:肋痞胀痛，恐有停饮，脉弦滑，当燥土分清。[阅读全文:],index.php?doc-view-4446,主题词： 	痞满[病]		医家：	何书田		关键词：		流派：		医案患者信息		性别：		年龄段：		职业：		婚姻：		<li>籍贯：</li>		医案信息		就诊时间：		主要症状：	胸胁苦满		病因病机：	脾虚湿困		中医诊断：	痞满[病]		证型：	痞满（痰湿中阻证）		西医诊断：		治则：	燥湿化痰		方剂：		医家信息		籍贯：		单位：		职称：		名中医：		所属学科：		代表作：		专业特长：,".IJXQaT { display:none; } 	
	肋痞胀痛，恐有停饮，脉弦滑，当燥土分清。 	sstp上海科学技术出版社nihao	 	麻油炒茆术一钱五分 橘红一钱五分 郁金一钱五分	川楝子一钱五分 广木香五分 半夏一钱五分	姜皮五分 赤苓二钱 泽泻一钱五分 	sstp上海科学技术出版社nihao"
何书田治痞病案2,biaoyin12,创建时间:10-08 13:58,摘要:左胁下结痞作痛，饮食减少，形衰脉弱。此属木部侮土，病势非轻。[阅读全文:],index.php?doc-view-4441,主题词： 	痞满[病]		医家：	何书田		关键词：		流派：		医案患者信息		性别：		年龄段：		职业：		婚姻：		<li>籍贯：</li>		医案信息		就诊时间：		主要症状：	胸胁苦满		病因病机：	肝气犯胃，胃气郁滞		中医诊断：	痞满[病]		证型：	痞满（肝胃不和证）		西医诊断：		治则：	疏肝和胃		方剂：		医家信息		籍贯：		单位：		职称：		名中医：		所属学科：		代表作：		专业特长：,".vNfzWd { display:none; } 	
	左胁下结痞作痛，饮食减少，形衰脉弱。此属木部侮土，病势非轻。 	sstp上海科学技术出版社nihao	 	当归身一钱五分 木香五分 郁金一钱五分	半夏一钱五分 白芍一钱五分 川楝子一钱五分	蔻仁五分 陈皮一钱 青橘叶一钱五分	焦谷芽三钱 	sstp上海科学技术出版社nihao"
何书田治痞病案1,biaoyin12,创建时间:10-08 13:52,摘要:中虚挟湿，结痞渐大，脉细模糊，久防腹满。[阅读全文:],index.php?doc-view-4438,主题词： 	痞满[病]		医家：	何书田		关键词：		流派：		医案患者信息		性别：		年龄段：		职业：		婚姻：		<li>籍贯：</li>		医案信息		就诊时间：		主要症状：	胸胁苦满		病因病机：	脾虚痰湿阻滞，气机不和		中医诊断：	痞满[病]		证型：	痞满（痰湿中阻证）		西医诊断：		治则：	化痰散结		方剂：		医家信息		籍贯：		单位：		职称：		名中医：		所属学科：		代表作：		专业特长：,".FQnRyV { display:none; } 	
	中虚挟湿，结痞渐大，脉细模糊，久防腹满。 	sstp上海科学技术出版社nihao	 	川茆术二钱 半夏一钱五分 黑姜五分	橘白一钱 姜皮三分 郁金一钱五分	白芍一钱五分 茯苓二钱 泽泻一钱五分 	sstp上海科学技术出版社nihao"
何书田治噎膈反胃病案,biaoyin12,创建时间:10-08 13:45,摘要:纳食格拒，甚则吐涎。此系木郁侮土，气滞痰凝，议苦降辛通。[阅读全文:],index.php?doc-view-4425,主题词： 	噎膈		医家：	何书田		关键词：		流派：		医案患者信息		性别：		年龄段：		职业：		婚姻：		<li>籍贯：</li>		医案信息		就诊时间：		主要症状：	纳呆		病因病机：	肝气郁结乘脾，痰湿交阻，胃气上逆		中医诊断：	噎膈		证型：	噎膈（痰气阻膈证）		西医诊断：	食管炎		治则：	理气化痰		方剂：		医家信息		籍贯：		单位：		职称：		名中医：		所属学科：		代表作：		专业特长：,".NYDlEO { display:none; } 	
	纳食格拒，甚则吐涎。此系木郁侮土，气滞痰凝，议苦降辛通。 	sstp上海科学技术出版社nihao	 	川连三分 半夏二钱 橘红一钱五分	杏仁三钱 干姜五分 代赭石三钱	茯苓二钱 白芍一钱五分 郁金一钱五分 	sstp上海科学技术出版社nihao"
何书田治杂症病案3,biaoyin12,创建时间:10-05 19:43,摘要: 先后天俱亏，内热自生，饮食少进，若不加意调养，惟恐延成童怯。[阅读全文:],index.php?doc-view-3783,主题词： 	厌食[病]		医家：	何书田		关键词：		流派：		医案患者信息		性别：		年龄段：		职业：		婚姻：		<li>籍贯：</li>		医案信息		就诊时间：		主要症状：	纳呆		病因病机：	先后天不足，内热自生，损伤脾胃		中医诊断：	厌食[病]		证型：	阴虚内热证		西医诊断：		治则：	滋阴益胃		方剂：		医家信息		籍贯：		单位：		职称：		名中医：		所属学科：		代表作：		专业特长：,".ufZYTK { display:none; } 	
	先后天俱亏，内热自生，饮食少进，若不加意调养，惟恐延成童怯。 	sstp上海科学技术出版社nihao	 	制首乌二钱 炙鳖甲四钱 北沙参二钱	茯苓二钱 地骨皮二钱 川斛三钱	半曲一钱五分 广皮一钱五分 山药二钱 	sstp上海科学技术出版社nihao"
何书田治泻病案2,biaoyin12,创建时间:09-30 21:13,摘要:暑湿伤气，寒热腹痛而胀，脉不条达，太阴疟也。[阅读全文:],index.php?doc-view-2900,主题词： 	泄泻		医家：	何书田		关键词：		流派：		医案患者信息		性别：		年龄段：		职业：		婚姻：		<li>籍贯：</li>		医案信息		就诊时间：		主要症状：	腹痛		病因病机：	暑湿内伤气分		中医诊断：	泄泻[病]		证型：	泄泻（暑湿证）		西医诊断：		治则：	芳香化湿		方剂：	藿香正气散		医家信息		籍贯：		单位：		职称：		名中医：		所属学科：		代表作：		专业特长：,".AlROYp { display:none; } 	
	暑湿伤气，寒热腹痛而胀，脉不条达，太阴疟也。 	sstp上海科学技术出版社nihao	 	杜藿香一钱五分 川朴一钱 赤苓二钱	半夏一钱五分 广皮一钱五分 苡仁三钱	瓜蒌皮三钱 泽泻一钱五分 大豆卷三钱	加：	六一散三钱 	sstp上海科学技术出版社nihao"
何书田治便闭病案3,biaoyin12,创建时间:10-04 21:45,摘要:脏液干枯，大便燥结，仿东垣通幽意。[阅读全文:],index.php?doc-view-3654,主题词： 	便秘[病]		医家：	何书田		关键词：		流派：		医案患者信息		性别：		年龄段：		职业：		婚姻：		<li>籍贯：</li>		医案信息		就诊时间：		主要症状：	大便秘结		病因病机：	阴津不足，肠道失润		中医诊断：	便秘[病]		证型：	便秘（阴虚证）		西医诊断：		治则：	滋阴润燥		方剂：		医家信息		籍贯：		单位：		职称：		名中医：		所属学科：		代表作：		专业特长：,".tZOVVD { display:none; } 	
	脏液干枯，大便燥结，仿东垣通幽意。 	sstp上海科学技术出版社nihao	 	元生地四钱 归身二钱（炒） 郁李仁二钱（研）	柏子霜二钱 黑脂二钱 淡苁蓉二钱	原红花四分 紫石英三钱（煅） 炙升麻四分 	sstp上海科学技术出版社nihao"
何书田治便闭病案2,biaoyin12,创建时间:10-04 21:42,摘要:大便闭结，脉来沉迟。下焦阳气失运也，治以温润。[阅读全文:],index.php?doc-view-3653,主题词： 	便秘[病]		医家：	何书田		关键词：		流派：		医案患者信息		性别：		年龄段：		职业：		婚姻：		<li>籍贯：</li>		医案信息		就诊时间：		主要症状：	大便秘结		病因病机：	阳虚肠道失于温运		中医诊断：	便秘[病]		证型：	便秘（阳虚证）		西医诊断：		治则：	温阳通便		方剂：	济川煎		医家信息		籍贯：		单位：		职称：		名中医：		所属学科：		代表作：		专业特长：,".rSssww { display:none; } 	
	大便闭结，脉来沉迟。下焦阳气失运也，治以温润。 	sstp上海科学技术出版社nihao	 	熟地四钱 制川附八分 枸杞二钱	归身一钱五分 牛膝二钱（炒） 广皮一钱五分	淡苁蓉二钱 紫石英二钱 郁李仁二钱	加：	松子仁三钱 	sstp上海科学技术出版社nihao"
何书田治便闭病案1,biaoyin12,创建时间:10-04 21:38,摘要:少腹膨痛，二便不通。由肝胃郁热所致，治以苦泄。[阅读全文:],index.php?doc-view-3652,主题词： 	便秘[病]		医家：	何书田		关键词：		流派：		医案患者信息		性别：		年龄段：		职业：		婚姻：		<li>籍贯：</li>		医案信息		就诊时间：		主要症状：	大便秘结		病因病机：	肝胃郁热，津伤便结		中医诊断：	便秘[病]		证型：	肝胃不和证		西医诊断：		治则：	清肝泻火		方剂：		医家信息		籍贯：		单位：		职称：		名中医：		所属学科：		代表作：		专业特长：,".ILqIme { display:none; } 	
	少腹膨痛，二便不通。由肝胃郁热所致，治以苦泄。 	sstp上海科学技术出版社nihao	 	制大黄三钱 川连五分 全瓜蒌三钱	归身一钱五分 川楝子肉二钱（炒） 小茴香八分（炒）	炒淮膝二钱 车前子三钱（炒） 青皮一钱五分	加：	通草五分（煎汤代水） 	sstp上海科学技术出版社nihao"
何书田治腹痛病案7,biaoyin12,创建时间:10-04 13:16,摘要: 中虚积湿，腹痛多痰。[阅读全文:],index.php?doc-view-3560,主题词： 	腹痛[病]		医家：	何书田		关键词：		流派：		医案患者信息		性别：		年龄段：		职业：		婚姻：		<li>籍贯：</li>		医案信息		就诊时间：		主要症状：	腹痛		病因病机：	痰湿阻滞经络，中阳虚衰		中医诊断：	腹痛[病]		证型：	腹痛（痰积证）		西医诊断：		治则：	祛痰化浊		方剂：		医家信息		籍贯：		单位：		职称：		名中医：		所属学科：		代表作：		专业特长：,".cTjxGJ { display:none; } 	
	中虚积湿，腹痛多痰。	生白术一钱五分 制厚朴一钱 橘红一钱	半夏一钱五分（制） 赤苓二钱 石斛三钱	瓜蒌皮三钱 广藿梗一钱 炒苏子三钱 	sstp上海科学技术出版社nihao"
何书田治腹痛病案6,biaoyin12,创建时间:10-04 13:12,摘要:下午绕脐腹痛，上逆嗳气。此木强侮土也，莫作轻视。[阅读全文:],index.php?doc-view-3559,主题词： 	腹痛[病]		医家：	何书田		关键词：		流派：		医案患者信息		性别：		年龄段：		职业：		婚姻：		<li>籍贯：</li>		医案信息		就诊时间：		主要症状：	腹痛		病因病机：	肝气犯胃		中医诊断：	腹痛[病]		证型：	腹痛（肝气郁结证）		西医诊断：		治则：	疏肝和胃		方剂：		医家信息		籍贯：		单位：		职称：		名中医：		所属学科：		代表作：		专业特长：,".rfcaGt { display:none; } 	
	下午绕脐腹痛，上逆嗳气。此木强侮土也，莫作轻视。 	sstp上海科学技术出版社nihao	 	制於术一钱五分 熟地五钱（沉香末拌炒） 附子八分	炮姜六分 广皮一钱五分 半夏一钱五分（制）	紫石英三钱（煅） 郁金一钱五分 炒白芍一钱五分 	sstp上海科学技术出版社nihao"
